OBJECTID,CREATION_DT,RECORDATION_DT,NARRATIVE,EXPIRATION_DT,STATUS,SQUARE,SUFFIX,LOT,LOT_TYPE,COMPUTED_AREA_SF,SURVEYED_AREA_SF,MAR_ID,IS_REAR_OF,BLDG_NUM,BLDG_NUM_EXT,BLDG_NUM_END_RANGE,BLDG_EXT_END_RANGE,QUADRANT,ZIP5,ZIP4,RECORD_AREA_SF,CONV_TOLERANCE_TYPE,CONV_TOLERANCE_VALUE,CONV_TOLERANCE_RESOLUTION,RECORDLOTSPLYID,PARCELSPLYID,SQUAREPLYID,OF_LOT_SEQ,BOOK_NUM,PAGE_NUM,UNDERLIES_CONDO,CONDO_BOOK_NUM,CONDO_PAGE_NUM,KILL_DT,SSL,COL,CONDOLOT,CONDO_REGIME_NUM,AREA,LEN,SHAPE_Length,SHAPE_Area
3852604,2011/05/17 00:00:00+00,2011/05/17 00:00:00+00,"SEE CONDO BOOK 77, PAGE 47 (CONDOS 2161 - 2170) KILLED TAX LOTS 807 - 811 ON 11/28/2012",,2,4327,,0810,2,2064,,,,,,,,,,,2064,,,,,,,,3853 & 3854,E & A,1,77,47,2012/11/28 00:00:00+00,4327    0810,N,Y,3200,,,86.164433820442,317.270068369966
3852605,2006/09/09 00:00:00+00,,DELIVERY 7 - SEE CONDO BOOK 76 PAGE 12 (CONDOS 2007 & 2008) KILLED TAX LOT 809 ON 1/25/2012.,,2,3104,,0809,2,1561,,,,,,,,,,,1561,1,,,,,,,106,*,1,76,12,2012/01/25 00:00:00+00,3104    0809,N,Y,1444,,,88.7004470475961,239.941969026
3852606,2006/09/09 00:00:00+00,,"SEE CONDO BOOK 118, PAGE 7 (CONDOS 2041 - 2044) KILLED TAX LOT 826 ON 9/7/2021",,2,4059,,0826,2,2304,,,,,,,,,,,2304,1,,,,,,,1757,*,1,118,7,2021/09/07 00:00:00+00,4059    0826,N,Y,9999,,,81.5661957223396,354.001157908892
3852607,2006/09/09 00:00:00+00,,PHASE 1,,2,0156,,0811,2,2105,,,,,,,,,,,2115,1,,,,,,,,,1,45,8,2001/05/17 00:00:00+00,0156    0811,N,Y,2527,,,95.9576876191061,323.526000225111
3852608,2010/06/11 00:00:00+00,1967/04/21 00:00:01+00,SEE CONDO BOOK 28 PAGE 45 (CONDOS 2001 - 2757) KILLED TAX LOT 803 ON 9/21/1981.,,2,2049,,0803,2,342488,,,,,,,,,,,341546,,,,,,,,3554,F,1,28,45,1981/09/21 00:00:00+00,2049    0803,N,Y,1080,,,993.11210696533,53221.0040452202
3852609,2006/09/09 00:00:00+00,,"SEE CONDO BOOK 104, PAGE 32 (CONDOS 2024 - 2027) KILLED TAX LOT 827 ON 11/15/2019",,2,4059,,0827,2,2304,,,,,,,,,,,2304,1,,,,,,,1757,*,1,104,32,2019/11/15 00:00:00+00,4059    0827,N,Y,9999,,,81.5680604926203,354.008302744079
3852610,2006/09/09 00:00:00+00,,"SEE CONDO BOOK 116, PAGE 50 (CONDOS 2032 - 2035) KILLED TAX LOT 833 ON 6/7/2021",,2,4059,,0833,2,2304,,,,,,,,,,,2304,1,,,,,,,1757,*,1,116,50,2021/06/07 00:00:00+00,4059    0833,N,Y,9999,,,81.5689825288203,354.029476169184
3852611,2010/02/13 00:00:00+00,,COMMERCIAL CONDOS (2013 - 2022) KILLED TAX LOT 809.,,2,0177,N,0809,2,2228,,,,,,,,,,,,,,,,,,,,,1,41,34,1994/04/28 00:00:00+00,0177N   0809,N,Y,0005,,,86.6653576278015,342.458237820822
3852612,2010/06/21 00:00:00+00,1982/09/16 00:00:00+00,"SEE CONDO BOOK 31, PAGE 10 (CONDOS 2001 - 2014) KILLED TAX LOT 846 ON 11/15/1982.",,2,2621,,0846,2,14226,,,,,,,,,,,14321,,,,,,,,3686,L,1,31,10,1982/11/15 00:00:00+00,2621    0846,N,Y,1232,,,260.387094408034,2187.73474116796
3852613,2010/06/25 00:00:00+00,,SEE CONDO BOOK 34 PAGE 2 (CONDOS 2007 - 2026) KILLED TAX LOT 819 ON 2/22/1985.,,2,3276,,0819,2,9350,,,,,,,,,,,,,,,,,,,,,1,34,2,1985/02/22 00:00:00+00,3276    0819,N,Y,3018,,,176.746198889032,1439.40180199613
3852614,2010/07/13 00:00:00+00,,SEE CONDO BOOK 46 PAGE 9 (CONDOS 2010 - 2012) KILLED TAX LOT 800.,,2,0177,N,0800,2,1618,,,,,,,,,,,,1,,,,,,,JHK,79,1,31,43,1985/01/18 00:00:00+00,0177N   0800,N,Y,2168,,,77.461026390581,248.62799745883
3852615,2010/07/20 00:00:00+00,1991/05/24 00:00:00+00,SEE CONDO BOOK 40 PAGE 32 (CONDOS 2005 - 2006) KILLED TAX LOTS 843 & 844.,,2,0477,,0843,2,1971,,,,,,,,,,,1972,,,,,,,,3750,V,1,40,32,1992/05/21 00:00:00+00,0477    0843,N,Y,2271,,,91.1552290195532,302.871799977805
3852616,2010/07/20 00:00:00+00,1991/05/28 00:00:00+00,SEE CONDO BOOK 40 PAGE 32 (CONDOS 2005 - 2006) KILLED TAX LOTS 843 & 844.,,2,0477,,0844,2,59,,,,,,,,,,,59,,,,,,,,3750,W,1,40,32,1992/05/21 00:00:00+00,0477    0844,N,Y,2271,,,50.5509844435606,9.10580738933484
3852617,2010/06/15 00:00:00+00,1991/07/19 00:00:00+00,"SEE CONDO BOOK 40 PAGE 12 (CONDOS 2144, 2146 - 2151) KILLED TAX LOT 813.",,2,2536,,0813,2,2436,,,,,,,,,,,2435,,,,,,,,*,3754,1,40,12,1991/06/28 00:00:00+00,2536    0813,N,Y,1120,,,119.348656867144,374.336258406893
3852618,2010/06/15 00:00:00+00,1979/06/21 00:00:00+00,SEE CONDO BOOK 22 PAGE 34 (CONDOS 2001 - 2028) KILLED TAX LOT 841 ON 7/24/1980.,,2,2540,,0841,2,10823,,,,,,,,,,,10837,1,,,,,,,3655,N,1,22,34,1980/07/24 00:00:00+00,2540    0841,N,Y,1125,,,162.09889676856,1663.65420793855
3852619,2010/06/21 00:00:00+00,1924/10/03 00:00:01+00,SEE CONDO BOOK 45 PAGE 16 (CONDOS 2013 - 2039) KILLED TAX LOT 825.,,2,2582,,0825,2,15000,,,,,,,,,,,15000,,,,,,,,*,1401,1,45,16,2001/08/02 00:00:00+00,2582    0825,N,Y,1479,,,196.071389150103,2306.07929220259
3852620,2010/06/15 00:00:00+00,1984/03/09 00:00:00+00,SEE CONDO BOOK 33 PAGE 18 (CONDOS 2041 - 254) KILLED TAX LOT 843 ON 5/24/1984.,,2,2540,,0843,2,4000,,,,,,,,,,,4041,1,,,,,,,3692,C,1,33,18,1984/05/24 00:00:00+00,2540    0843,N,Y,1128,,,109.845334236205,614.820713967018
3852621,2010/06/21 00:00:00+00,,"SEE CONDO BOOK 28, PAGE 4 (CONDOS 2025 - 2046) KILLED TAX LOT 809 ON 9/21/1981.",,2,2554,,0809,2,6000,,,,,,,,,,,6000,,,,,,,,*,913,1,28,4,1981/09/21 00:00:00+00,2554    0809,N,Y,1184,,,133.409114552327,922.220692020806
3852622,2010/06/21 00:00:00+00,,"SEE CONDO BOOK 23, PAGE 22 (CONDOS 2011 - 2024) KILLED TAX LOT 811 ON 3/14/1980.",,2,2554,,0811,2,7200,,,,,,,,,,,7200,,,,,,,,3476,X,1,23,22,1980/03/14 00:00:00+00,2554    0811,N,Y,1183,,,141.234915939208,1106.67518056621
3852623,2010/06/22 00:00:00+00,2005/03/28 00:00:00+00,SEE CONDO BOOK 55 PAGE 14 (CONDOS 2037 - 2038) KILLED TAX LOT 810 ON 10/26/2005.,,2,2837,,0810,2,951,,,,,,,,,,,950,,,,,,,,3818,O,1,55,14,2005/10/26 00:00:00+00,2837    0810,N,Y,1664,,,53.0091399735622,146.240257664503
3852624,2010/06/22 00:00:00+00,2005/03/28 00:00:00+00,SEE CONDO BOOK 55 PAGE 14 (CONDOS 2035 - 2036) KILLED TAX LOT 811 ON 10/26/2005.,,2,2837,,0811,2,952,,,,,,,,,,,950,,,,,,,,3818,O,1,55,14,2005/10/26 00:00:00+00,2837    0811,N,Y,1664,,,53.0346660390085,146.341209715589
3852625,2010/06/22 00:00:00+00,2005/03/28 00:00:00+00,SEE CONDO BOOK 55 PAGE 14 (CONDOS 2033 - 2034) KILLED TAX LOT 812 ON 10/26/2005.,,2,2837,,0812,2,952,,,,,,,,,,,950,,,,,,,,3818,O,1,55,14,2005/10/26 00:00:00+00,2837    0812,N,Y,1664,,,53.0581591753185,146.429183573187
3852626,2010/06/22 00:00:00+00,2005/03/28 00:00:00+00,SEE CONDO BOOK 55 PAGE 14 (CONDOS 2031 - 2032) KILLED TAX LOT 813 ON 10/26/2005.,,2,2837,,0813,2,953,,,,,,,,,,,950,,,,,,,,3818,O,1,55,14,2005/10/26 00:00:00+00,2837    0813,N,Y,1664,,,53.0836358307696,146.529436419889
3852627,2010/06/22 00:00:00+00,2005/03/28 00:00:00+00,SEE CONDO BOOK 55 PAGE 14 (CONDOS 2029 - 2030) KILLED TAX LOT 814 ON 10/26/2005.,,2,2837,,0814,2,954,,,,,,,,,,,950,,,,,,,,3818,O,1,55,14,2005/10/26 00:00:00+00,2837    0814,N,Y,1664,,,53.1105933243599,146.63753947178
3852628,2010/06/22 00:00:00+00,2005/03/28 00:00:00+00,SEE CONDO BOOK 55 PAGE 14 (CONDOS 2027 - 2028) KILLED TAX LOT 815 ON 10/26/2005.,,2,2837,,0815,2,954,,,,,,,,,,,950,,,,,,,,3818,O,1,55,14,2005/10/26 00:00:00+00,2837    0815,N,Y,1664,,,53.1361192869482,146.737778472106
3852629,2010/06/21 00:00:00+00,1984/06/14 00:00:00+00,"SEE CONDO BOOK 33, PAGE 9 (CONDOS 2001 - 2012) KILLED TAX LOT 846 ON 7/11/1984.",,2,2589,,0846,2,7762,,,,,,,,,,,7703,,,,,,,,*,3706,1,33,9,1984/07/11 00:00:00+00,2589    0846,N,Y,1218,,,144.817755775451,1193.45453529908
3852630,2010/06/22 00:00:00+00,2005/03/28 00:00:00+00,SEE CONDO BOOK 55 PAGE 14 KILLED TAX LOT 808 ON 10/26/2005.,,2,2837,,0808,2,16012,,,,,,,,,,,16258,,,,,,,,3818,O,1,55,14,2005/10/26 00:00:00+00,2837    0808,N,Y,1664,,,376.245955643126,2462.17202893215
3852631,2010/06/22 00:00:00+00,2005/03/28 00:00:00+00,SEE CONDO BOOK 55 PAGE 14 (CONDOS 2039 - 2040) KILLED TAX LOT 809 ON 10/26/2005.,,2,2837,,0809,2,1083,,,,,,,,,,,1083,,,,,,,,3818,O,1,55,14,2005/10/26 00:00:00+00,2837    0809,N,Y,1664,,,55.1741509498856,166.588818331963
3852632,2008/08/27 00:00:00+00,2005/09/13 00:00:00+00,"SEE CONDO BOOK 73, PAGE 40 (CONDOS 2322 - 2323) KILLED TAX LOT 833 ON 12/19/2013",,2,2132,,0833,2,142757,,,,,,,,,,,143003,,,,,,,,3821,Z,1,73,40,2013/12/19 00:00:00+00,2132    0833,N,Y,5106,,,586.506765737955,21946.5097667167
3852633,2008/04/29 00:00:00+00,2007/04/25 00:00:00+00,"SEE CONDO BOOK 80, PAGE 41 (CONDOS 2248 - 2253) KILLED TAX LOTS 846 ON 11/13/2013",,2,1045,,0846,2,3452,,,,,,,,,,,3473,,,,,,,,3830,M,1,80,41,2013/11/13 00:00:00+00,1045    0846,N,Y,4174,,,98.7256273951287,530.032984206198
3852634,2006/09/09 00:00:00+00,1921/06/25 00:00:01+00,"SEE CONDO BOOK 73, PAGE 30 (CONDOS 2001 - 2004) KILLED TAX LOT 809 ON 11/4/2010.",,2,0521,,0809,2,896,,,,,,,,,,,896,1,,,,,,,*,1113,1,73,30,2010/11/04 00:00:00+00,0521    0809,N,Y,2997,,,50.1256007367309,137.669829522598
3852635,2006/09/09 00:00:00+00,,"DELIVERY 11 - SEE CONDO BOOK 70, PAGE 10 (CONDOS 2001 - 2004) KILLED TAX LOT 802 ON 2/23/2009.",,2,3563,,0802,2,3687,,,,,,,,,,,3686,1,,,,,,,3209,J,1,70,10,2009/02/23 00:00:00+00,3563    0802,N,Y,1986,,,111.883949858866,566.612398828082
3852636,2006/09/09 00:00:00+00,,PHASE 1 - SEE CONDO BOOK 43 PAGE 21 (CONDO (2073) KILLED TAX LOT 839 ON 3/31/1998.,,2,0013,,0839,2,27110,,,,,,,,,,,15855,1,,,,,,,3698,G,1,43,21,1998/03/31 00:00:00+00,0013    0839,N,Y,1001,,,279.721648781403,4165.47198959157
3852637,2011/04/18 00:00:00+00,2011/04/18 00:00:00+00,"SEE CONDO BOOK 74 PAGE 36 (CONDOS 2001 - 2002) KILLED TAX LOT (842) & AIR RIGHTS LOTS (7001, 7004, & 7010) ON 9/30/2011.",,2,0054,,0842,2,51015,,,,,,,,,,,51015,,,,,,,,3852,G,1,74,36,2011/09/30 00:00:00+00,0054    0842,N,Y,4047,,,373.834492686661,7841.67437493957
3852638,2006/09/09 00:00:00+00,,SEE CONDO BOOK 75 PAGE 14 (CONDOS 2028 & 2029) KILLED TAX LOT 817 ON 9/28/2011.,,2,0477,,0817,2,1867,,,,,,,,,,,1867,1,,,,,,,,,1,75,14,2011/09/28 00:00:00+00,0477    0817,N,Y,4050,,,88.7740103291148,286.955823524309
3852639,2008/02/15 00:00:00+00,2007/06/07 00:00:00+00,SEE CONDO BOOK 73 PAGE 48 (CONDOS 2124-2251) KILLED TAX LOT 820 ON 9/26/2011.,,2,0542,,0820,2,13200,,,,,,,,,,,13200,,,,,,,,3830,V,1,73,48,2011/09/26 00:00:00+00,0542    0820,N,Y,4054,,,219.169503280561,2026.59949620501
3852640,2006/09/09 00:00:00+00,,DELIVERY 5 - SEE CONDO BOOK 74 PAGE 17 (CONDOS 2001 & 2002) KILLED TAX LOT 807 ON 2/11/2011.,,2,0787,,0807,2,1943,,,,,,,,,,,1942,1,,,,,,,,,1,74,17,2011/02/11 00:00:00+00,0787    0807,N,Y,4032,,,91.3007000182216,298.41707777246
3852641,2006/09/09 00:00:00+00,,"MAINTENANCE - SEE CONDO BOOK 79, PAGE 29 (CONDOS 2056 - 2063) KILLED TAX LOT 944 ON 7/17/2013.",,2,0513,,0944,2,4580,,,,,,,,,,,4580,1,,,,,,,3815,P,1,79,29,2013/07/17 00:00:00+00,0513    0944,N,Y,4125,,,114.682902252737,703.835663587618
3852642,2006/09/09 00:00:00+00,,"PHASE 1 - SEE CONDO BOOK 77, PAGE 49 (CONDOS 2064 - 2067) KILLED TAX LOT 877 ON 5/24/2013.",,2,0513,,0877,2,2013,,,,,,,,,,,2013,1,,,,,,,,,1,77,49,2013/05/24 00:00:00+00,0513    0877,N,Y,4126,,,94.7306017514821,309.364799094303
3852643,2009/05/26 00:00:00+00,2009/03/31 00:00:00+00,"SEE CONDO BOOK 80, PAGE 1 (CONDOS 2001 - 2470) KILLED TAX LOT 845 ON 9/11/2013.",,2,0673,,0845,2,57355,,,,,,,,,,,57355,,,,,,,,3842,U,1,80,1,2013/09/11 00:00:00+00,0673    0845,N,Y,4129,,,378.871400945702,8812.46881733935
3852644,2006/09/09 00:00:00+00,,"DELIVERY 5 - SEE CONDO BOOK 79, PAGE 45 (CONDOS 2026 - 2028) KILLED TAX LOT 802 ON 8/21/2013.",,2,1111,,0802,2,1425,,,,,,,,,,,1425,1,,,,,,,,,1,79,45,2013/08/21 00:00:00+00,1111    0802,N,Y,5032,,,73.5844020612217,218.833534518371
3852645,2010/03/01 00:00:00+00,2009/09/28 00:00:00+00,"SEE CONDO BOOK 80, PAGE 21 (CONDOS 2107 - 2216) KILLED TAX (903,905,906,910) & AIR RIGHTS LOTS (7034,7037-7038,7044-7049,7057) ON 9/26/2013.",,2,0374,,0902,2,7347,,,,,,,,,,,7348,,,,,,,,3847,"I,J,K,&L",1,80,21,2013/09/26 00:00:00+00,0374    0902,N,Y,5028,,,280.469810151209,1128.753575962
3852646,2007/07/26 00:00:00+00,2006/05/16 00:00:00+00,"SEE CONDO BOOK 79, PAGE 19 (CONDOS 2022 - 2025) KILLED TAX LOT 806 ON 7/25/2013.",,2,1111,,0806,2,2850,,,,,,,,,,,2850,,,,,,,,3827,A,1,79,19,2013/07/25 00:00:00+00,1111    0806,N,Y,5031,,,88.5086023906634,437.708131563808
3852647,2006/09/09 00:00:00+00,,"DELIVERY 9 - SEE CONDO BOOK 80, PAGE 5 (CONDOS 2001 - 2023) KILLED TAX LOT 839 ON  9/25/2013",,2,2897,,0839,2,7327,,,,,,,,,,,7353,1,,,,,,,2415,*,1,80,5,2013/09/25 00:00:00+00,2897    0839,N,Y,5054,,,142.355209613287,1126.75971723289
3852648,2010/03/01 00:00:00+00,2009/09/28 00:00:00+00,"SEE CONDO BOOK 80, PAGE 21 (CONDOS 2107 - 2216) KILLED TAX (903,905,906,910) & AIR RIGHTS LOTS (7034,7037-7038,7044-7049,7057) ON 9/26/2013.",,2,0374,,0896,2,4575,,,,,,,,,,,4577,,,,,,,,3847,"I,J,K,&L",1,80,21,2013/09/26 00:00:00+00,0374    0896,N,Y,5028,,,175.967125630194,702.822031650931
3852649,2010/03/01 00:00:00+00,2009/09/28 00:00:00+00,"SEE CONDO BOOK 80, PAGE 21 (CONDOS 2107 - 2216) KILLED TAX (903,905,906,910) & AIR RIGHTS LOTS (7034,7037-7038,7044-7049,7057) ON 9/26/2013.",,2,0374,,0900,2,2006,,,,,,,,,,,2006,,,,,,,,3847,"I,J,K,&L",1,80,21,2013/09/26 00:00:00+00,0374    0900,N,Y,5028,,,82.099702927503,308.170402137434
3852650,2011/05/17 00:00:00+00,2011/05/17 00:00:00+00,"SEE CONDO BOOK 77, PAGE 47 (CONDOS 2161 - 2170) KILLED TAX LOTS 807 - 811 ON 11/28/2012",,2,4327,,0809,2,2064,,,,,,,,,,,2064,,,,,,,,3853 & 3854,E & A,1,77,47,2012/11/28 00:00:00+00,4327    0809,N,Y,3200,,,86.1659595364049,317.294126941339
3852651,2006/09/09 00:00:00+00,,"DELIVERY 10 - SEE CONDO BOOK 80, PAGE 14 (CONDOS 2021 - 2026) KILLED TAX LOT 814 ON 9/27/2013",,2,4057,,0814,2,2746,,,,,,,,,,,2704,1,,,,,,,3615,v,1,80,14,2013/09/27 00:00:00+00,4057    0814,N,Y,5065,,,90.0196441738349,421.957462199378
3852652,2011/08/30 00:00:00+00,1969/02/18 00:00:01+00,"SEE CONDO BOOK 66, PAGE 9 (CONDOS 2001 & 2002) KILLED TAX LOT 807 ON 1/14/2008.",,2,0008,,0807,2,38964,,,,,,,,,,,37897,1,,,,,,,3574,C,1,66,9,2008/01/14 00:00:00+00,0008    0807,N,Y,2881,,,381.633115951398,5985.76990424495
3852653,2011/07/01 00:00:00+00,2011/06/27 00:00:00+00,"SEE CONDO BOOK 73, PAGE 49 (CONDOS 2012 - 2013) KILLED AIR RIGHTS LOT 7026 & TAX LOT 870 ON 12/21/2010.",,2,0441,,0870,2,18269,,,,,,,,,,,18269,,,,,,,,3852,H & I,1,73,49,2010/12/21 00:00:00+00,0441    0870,N,Y,2541,,,290.367408118236,2807.73205433644
3852654,2006/09/09 00:00:00+00,,"SEE CONDO BOOK 67, PAGE 13 (CONDOS 2405 - 2438) KILLED TAX LOT 859 ON 3/31/2008.",,2,1264,E,0859,2,24494,,,,,,,,,,,23989,1,,,,,,,3728,V,1,67,13,2008/03/31 00:00:00+00,1264E   0859,N,Y,2910,,,310.642682291035,3706.86456167065
3852655,2006/09/09 00:00:00+00,,DELIVERY 12,,2,5997,,0806,2,2982,,,,,,,,,,,2969,1,,,,,,,3695,i,1,67,15,2008/11/12 00:00:00+00,5997    0806,N,Y,1984,,,89.9637611142353,457.460236329537
3852656,2011/09/09 00:00:00+00,2005/08/31 00:00:00+00,"SEE CONDO BOOK 65, PAGE 24 (CONDOS 2001 - 2012) KILLED TAX LOT 811 ON 11/29/2007.",,2,1171,,0811,2,40902,,,,,,,,,,,41389,,,,,,,,3821,C,1,65,24,2007/11/29 00:00:00+00,1171    0811,N,Y,2893,,,333.803128054946,6283.97735790441
3852657,2010/03/01 00:00:00+00,2009/09/28 00:00:00+00,"SEE CONDO BOOK 80, PAGE 21 (CONDOS 2107 - 2216) KILLED TAX (903,905,906,910) & AIR RIGHTS LOTS (7034,7037-7038,7044-7049,7057) ON 9/26/2013.",,2,0374,,0899,2,264,,,,,,,,,,,264,,,,,,,,3847,"I,J,K,&L",1,80,21,2013/09/26 00:00:00+00,0374    0899,N,Y,5028,,,35.4002013000833,40.5925328669994
3852658,2009/04/13 00:00:00+00,,SEE CONDO BOOK 67 PAGE 49 (CONDOS 2001 - 2094) KILLED TAX LOT 818 ON 6/10/2008.,,2,0071,,0818,2,19897,,,,,,,,,,,19907,1,,,,,,,3815,F,1,67,49,2008/06/10 00:00:00+00,0071    0818,N,Y,3159,,,289.545571455218,3057.10582426856
3852659,2010/04/07 00:00:00+00,1979/06/11 00:00:00+00,SEE CONDO BOOK 27 PAGE 36 (CONDOS 2001 - 2078) KILLED TAX LOT 817 ON 3/27/1981.,,2,1192,,0817,2,28192,,,,,,,,,,,27854,,,,,,,,3652,Y,1,27,36,1981/03/27 00:00:00+00,1192    0817,N,Y,2386,,,303.445000738333,4331.41638959674
3852660,2010/04/07 00:00:00+00,1981/07/21 00:00:00+00,SEE CONDO BOOK 28 PAGE 15 (CONDOS 2001 - 2032) KILLED TAX LOT 841 ON 8/25/1981.,,2,1190,,0841,2,10140,,,,,,,,,,,10099,,,,,,,,3684,Q,1,28,15,1981/08/25 00:00:00+00,1190    0841,N,Y,2385,,,160.692935017243,1557.84992626733
3852661,2011/05/17 00:00:00+00,2011/05/17 00:00:00+00,"SEE CONDO BOOK 78, PAGE 29 (CONDOS 2171 - 2182) KILLED TAX LOTS 812 - 817 ON 3/15/2013",,2,4327,,0812,2,3130,,,,,,,,,,,3130,,,,,,,,3853 & 3854,E & A,1,78,29,2013/03/15 00:00:00+00,4327    0812,N,Y,3200,,,95.9080294622246,481.225273778567
3852662,2011/05/17 00:00:00+00,2011/05/17 00:00:00+00,"SEE CONDO BOOK 77, PAGE 47 (CONDOS 2161 - 2170) KILLED TAX LOTS 807 - 811 ON 11/28/2012",,2,4327,,0811,2,3130,,,,,,,,,,,3130,,,,,,,,3853 & 3854,E & A,1,77,47,2012/11/28 00:00:00+00,4327    0811,N,Y,3200,,,95.9073339113091,481.220328514838
3852663,2011/05/17 00:00:00+00,2011/05/17 00:00:00+00,"SEE CONDO BOOK 78, PAGE 29 (CONDOS 2171 - 2182) KILLED TAX LOTS 812 - 817 ON 3/15/2013",,2,4327,,0817,2,3130,,,,,,,,,,,3130,,,,,,,,3853 & 3854,E & A,1,78,29,2013/03/15 00:00:00+00,4327    0817,N,Y,3200,,,95.9079993005303,481.227357343357
3852664,2011/05/17 00:00:00+00,2011/05/17 00:00:00+00,"SEE CONDO BOOK 78, PAGE 29 (CONDOS 2171 - 2182) KILLED TAX LOTS 812 - 817 ON 3/15/2013",,2,4327,,0816,2,2064,,,,,,,,,,,2064,,,,,,,,3853 & 3854,E & A,1,78,29,2013/03/15 00:00:00+00,4327    0816,N,Y,3200,,,86.1661258793793,317.294927413592
3852665,2011/05/17 00:00:00+00,2011/05/17 00:00:00+00,"SEE CONDO BOOK 78, PAGE 29 (CONDOS 2171 - 2182) KILLED TAX LOTS 812 - 817 ON 3/15/2013",,2,4327,,0813,2,2064,,,,,,,,,,,2064,,,,,,,,3853 & 3854,E & A,1,78,29,2013/03/15 00:00:00+00,4327    0813,N,Y,3200,,,86.1635757025301,317.265831822029
3852666,2011/05/17 00:00:00+00,2011/05/17 00:00:00+00,"SEE CONDO BOOK 78, PAGE 29 (CONDOS 2171 - 2182) KILLED TAX LOTS 812 - 817 ON 3/15/2013",,2,4327,,0814,2,2064,,,,,,,,,,,2064,,,,,,,,3853 & 3854,E & A,1,78,29,2013/03/15 00:00:00+00,4327    0814,N,Y,3200,,,86.1660876552766,317.295703090011
3852667,2011/05/17 00:00:00+00,2011/05/17 00:00:00+00,"SEE CONDO BOOK 78, PAGE 29 (CONDOS 2171 - 2182) KILLED TAX LOTS 812 - 817 ON 3/15/2013",,2,4327,,0815,2,2064,,,,,,,,,,,2064,,,,,,,,3853 & 3854,E & A,1,78,29,2013/03/15 00:00:00+00,4327    0815,N,Y,3200,,,86.1662048459516,317.29648906299
3852668,2011/05/17 00:00:00+00,2011/05/17 00:00:00+00,"SEE CONDO BOOK 77, PAGE 47 (CONDOS 2161 - 2170) KILLED TAX LOTS 807 - 811 ON 11/28/2012",,2,4327,,0808,2,2064,,,,,,,,,,,2064,,,,,,,,3853 & 3854,E & A,1,77,47,2012/11/28 00:00:00+00,4327    0808,N,Y,3200,,,86.1656459816339,317.290037836043
3852669,2011/05/17 00:00:00+00,2011/05/17 00:00:00+00,"SEE CONDO BOOK 77, PAGE 47 (CONDOS 2161 - 2170) KILLED TAX LOTS 807 - 811 ON 11/28/2012",,2,4327,,0807,2,3130,,,,,,,,,,,3130,,,,,,,,3853 & 3854,E & A,1,77,47,2012/11/28 00:00:00+00,4327    0807,N,Y,3200,,,95.9072058872079,481.217487399052
3852670,2010/06/23 00:00:00+00,1917/12/26 00:00:01+00,COMMERCIAL CONDO 2011 KILLED TAX LOTS (980 & 986) ON 12/29/1955.,,2,2875,,0980,2,2077,,,,,,,,,,,2077,,,,,,,,*,851,1,,,1955/12/29 00:00:01+00,2875    0980,N,Y,0026,,,96.9647099786674,319.178862672598
3852671,2010/06/22 00:00:00+00,2005/03/28 00:00:00+00,SEE CONDO BOOK 55 PAGE 14 (CONDOS 2013 - 2014) KILLED TAX LOT 822 ON 10/26/2005.,,2,2837,,0822,2,959,,,,,,,,,,,950,,,,,,,,3818,O,1,55,14,2005/10/26 00:00:00+00,2837    0822,N,Y,1664,,,53.3161656075094,147.443092837947
3852672,2010/07/09 00:00:00+00,2003/12/05 00:00:00+00,SEE CONDO BOOK 48 PAGE 7 (CONDOS 2001 - 2031) KILLED TAX LOT 806 ON 9/30/2003.,,2,5832,,0806,2,74816,,,,,,,,,,,74805,,,,,,,,3811,T & U,1,48,7,2003/09/30 00:00:00+00,5832    0806,N,Y,1535,,,591.568301845303,11479.0734316824
3852673,2010/06/24 00:00:00+00,,"SEE CONDO BOOK 40, PAGE 6 (CONDOS 2001 - 2008) KILLED TAX LOT 824.",,2,3048,,0824,2,3669,,,,,,,,,,,3590,,,,,,,,SUB,8,1,40,6,1991/06/10 00:00:00+00,3083    0824,N,Y,1252,,,95.6420212519824,563.83687159816
3852674,2010/07/09 00:00:00+00,1979/08/01 00:00:00+00,SEE CONDO BOOK 26 PAGE 35 (CONDOS 2001 - 2008) KILLED TAX LOT 804 ON 1/6/1981.,,2,6169,S,0804,2,6000,,,,,,,,,,,6000,,,,,,,,3659,K,1,26,35,1981/01/06 00:00:00+00,6169S   0804,N,Y,1289,,,133.014101014079,919.860361632127
3852675,2010/07/09 00:00:00+00,1980/04/22 00:00:00+00,"SEE CONDO BOOK 24, PAGE 14 (CONDOS 2096 - 2103) KILLED TAX LOT 836 ON 5/27/1980.",,2,0155,,0836,2,3046,,,,,,,,,,,3046,,,,,,,,3660,Z,1,24,14,1980/05/27 00:00:00+00,0155    0836,N,Y,2128,,,96.1200088255901,468.102155353391
3852676,2010/07/09 00:00:00+00,1977/11/03 00:00:00+00,SEE CONDO BOOK 20 PAGE 33 (CONDOS 2036 - 2061) KILLED TAX LOT 805 ON 11/3/1977.,,2,0155,,0805,2,4543,,,,,,,,,,,,,,,,,,,3641,Q,1,20,33,1977/11/03 00:00:00+00,0155    0805,N,Y,2125,,,109.360910138046,698.050662884557
3852677,2010/07/09 00:00:00+00,1962/09/18 00:00:01+00,"SEE CONDO BOOK 26, PAGE 23 (CONDOS 2127 - 2330) KILLED TAX LOT 831 ON 1/8/1981.",,2,0155,,0831,2,16526,,,,,,,,,,,16526,,,,,,,,3492,X,1,26,23,1981/01/08 00:00:00+00,0155    0831,N,Y,2131,,,204.618304898068,2539.55337215353
3852678,2010/07/09 00:00:00+00,1961/10/31 00:00:01+00,"SEE CONDO BOOK 28, PAGE 36 (CONDOS 2230 - 2372) KILLED TAX LOT 837 ON 9/22/1981.",,2,0157,,0837,2,15548,,,,,,,,,,,15547,,,,,,,,3479,A,1,28,36,1981/09/22 00:00:00+00,0157    0837,N,Y,2151,,,198.459149371024,2389.09503628728
3852679,2010/07/09 00:00:00+00,1991/06/14 00:00:00+00,"SEE CONDO BOOK 43, PAGE 22 (CONDOS 2731 - 2866) KILLED TAX LOT 865 ON 7/6/1998.",,2,0157,,0865,2,22526,,,,,,,,,,,22524,,,,,,,,3479,W,1,43,22,1998/07/06 00:00:00+00,0157    0865,N,Y,4019,,,288.077054449618,3461.55846671708
3852680,2010/07/15 00:00:00+00,1983/12/10 00:00:00+00,SEE CONDO BOOK 32 PAGE 43 (CONDOS 2219 - 2265) KILLED TAX LOT 815 ON 2/18/1984.,,2,0179,,0815,2,15043,,,,,,,,,,,15040,,,,,,,,3689,*,1,32,43,1984/02/18 00:00:00+00,0179    0815,N,Y,2176,,,199.341496406238,2311.84461874358
3852681,2010/07/15 00:00:00+00,1988/06/15 00:00:00+00,SEE CONDO BOOK 37 PAGE 23 (CONDOS 2001 - 2130) KILLED TAX LOT 871.,,2,0181,,0871,2,22644,,,,,,,,,,,22644,,,,,,,,3733,H,1,37,23,1988/04/28 00:00:00+00,0181    0871,N,Y,2180,,,270.767323456096,3479.61514742016
3852682,2010/07/15 00:00:00+00,,"SEE CONDO BOOK 34, PAGE 11 (CONDOS 2028 - 2031) KILLED TAX LOT 800 ON 3/1/1985.",,2,0242,N,0800,2,1484,,,,,,,,,,,,,,,,,,,,,1,34,12,1985/03/01 00:00:00+00,0242N   0800,N,Y,2241,,,81.2416608513807,227.997173205363
3852683,2010/07/15 00:00:00+00,1981/05/11 00:00:00+00,"SEE CONDO BOOK 28, PAGE 7 (CONDOS 2001 - 2015) KILLED TAX LOT 819 ON 9/23/1981.",,2,0207,,0819,2,4113,,,,,,,,,,,5896,,,,,,,,3676,V,1,28,7,1981/09/23 00:00:00+00,0207    0819,N,Y,2515,,,105.577907462237,632.118021628499
3852684,2010/07/15 00:00:00+00,1981/05/11 00:00:00+00,"SEE CONDO BOOK 31, PAGE 16 (CONDOS 2016 - 2104) KILLED TAX LOT 820 ON 11/10/1982.",,2,0207,,0820,2,34085,,,,,,,,,,,32313,,,,,,,,3676,V,1,31,16,1982/11/10 00:00:00+00,0207    0820,N,Y,2515,,,332.044222929817,5238.30766286933
3852685,2010/07/15 00:00:00+00,1985/07/24 00:00:00+00,"SEE CONDO BOOK 38, PAGE 17 (CONDOS 2035 - 2038) KILLED TAX LOT 802.",,2,0242,N,0802,2,1490,,,,,,,,,,,1490,1,,,,,,,3712,B,1,38,17,1989/06/15 00:00:00+00,0242N   0802,N,Y,2243,,,79.7902326534899,228.994047648511
3852686,2012/11/01 00:00:00+00,2012/11/01 00:00:00+00,SEE CONDO BOOK 78 PAGE 19 (CONDOS 2045-2049) KILLED AIR RIGHTS LOT 7000 AND TAX LOT 869 ON 1/29/2013.,,2,0211,,0869,2,352,,,,,,,,,,,351,,,,,,,,3857,D,1,78,19,2013/01/29 00:00:00+00,0211    0869,N,Y,4102,,,29.4016019066806,54.0214316042434
3852687,2010/07/08 00:00:00+00,1993/12/02 00:00:00+00,SEE CONDO BOOK 41 PAGE 18 (CONDOS 2034 - 2037) KILLED TAX LOT 828 ON 8/10/1993.,,2,5056,,0828,2,12059,,,,,,,,,,,11981,,,,,,,,,,1,41,18,1993/08/10 00:00:00+00,5056    0828,N,Y,3033,,,194.50016758572,1852.57239975753
3852688,2010/07/08 00:00:00+00,1993/12/01 00:00:00+00,SEE CONDO BOOK 41 PAGE 16 (CONDOS 2025 - 2033) KILLED TAX LOT 826 ON 8/5/1993.,,2,5056,,0826,2,25517,,,,,,,,,,,25565,,,,,,,,,,1,41,16,1993/08/05 00:00:00+00,5056    0826,N,Y,3033,,,391.58008046522,3920.21582270369
3852689,2010/07/08 00:00:00+00,1994/06/08 00:00:00+00,SEE CONDO BOOK 41 PAGE 29 (CONDOS 2038 - 2048) KILLED TAX LOT 830 ON 12/10/1993.,,2,5056,,0830,2,21258,,,,,,,,,,,18298,,,,,,,,,,1,41,29,1993/12/10 00:00:00+00,5056    0830,N,Y,3033,,,259.242409786876,3265.86366233241
3852690,2011/07/01 00:00:00+00,2011/06/27 00:00:00+00,"SEE CONDO BOOK 81, PAGE 22 CONDO 2020 KILLED AIR RIGHTS LOTS (7000 - 7004,7028 - 7031) & TAX LOTS (861, 866 - 867) ON 3/19/2014",,2,0441,,0867,2,4217,,,,,,,,,,,3869,,,,,,,,3852,H & I,1,81,22,2014/03/19 00:00:00+00,0441    0867,N,Y,4182,,,124.822804979274,648.17002817739
3852691,2011/07/01 00:00:00+00,2011/06/27 00:00:00+00,"SEE CONDO BOOK 81, PAGE 22 CONDO 2020 KILLED AIR RIGHTS LOTS (7000 - 7004,7028 - 7031) & TAX LOTS (861, 866 - 867) ON 3/19/2014",,2,0441,,0866,2,410,,,,,,,,,,,410,,,,,,,,3852,H & I,1,81,22,2014/03/19 00:00:00+00,0441    0866,N,Y,4182,,,48.730301060092,62.9385135455393
3852692,2011/07/01 00:00:00+00,2011/06/27 00:00:00+00,"SEE CONDO BOOK 81, PAGE 22 CONDO 2020 KILLED AIR RIGHTS LOTS (7000 - 7004,7028 - 7031) & TAX LOTS (861, 866 - 867) ON 3/19/2014",,2,0441,,0861,2,549,,,,,,,,,,,550,,,,,,,,3852,H & I,1,81,22,2014/03/19 00:00:00+00,0441    0861,N,Y,5086,,,73.6130018621721,84.3511880341909
3852693,2006/09/09 00:00:00+00,,DELIVERY 9,,2,2894,,0910,2,7125,,,,,,,,,,,7125,1,,,,,,,2415,*,0,81,16,2013/12/05 00:00:00+00,2894    0910,N,Y,5108,,,151.112832125594,1095.55171388831
3852694,2006/09/09 00:00:00+00,,"SEE CONDO BOOK 45, PAGE 40 (CONDOS 2176 & 2177) KILLED TAX LOT (857) ON 2/28/2002.",,2,0036,,0857,2,13199,,,,,,,,,,,13199,1,,,,,,,,,1,45,40,2002/02/28 00:00:00+00,0036    0857,N,Y,1489,,,180.453728321766,2027.96909863032
3852695,2011/07/01 00:00:00+00,2011/06/27 00:00:00+00,"SEE CONDO BOOK 81, PAGE 28 CONDOS (2024 & 2025) KILLED AIR RIGHTS LOTS (7001,7033,7036) & TAX LOTS (860,862,863,868,869,875,876) ON 3/19/2014",,2,0441,,0868,2,4077,,,,,,,,,,,4078,,,,,,,,3852,H & I,1,81,28,2014/03/19 00:00:00+00,0441    0868,N,Y,4182,,,110.972726606634,626.49054602589
3852696,2006/09/09 00:00:00+00,,"SEE CONDO BOOK 94, PAGE 3 (CONDOS 2148 - 2161) KILLED TAX LOT 834 ON 1/11/2017",,2,0104,,0834,2,85079,,,,,,,,,,,85879,1,,,,,,,3351,r,1,94,3,2017/01/11 00:00:00+00,0104    0834,Y,Y,0040,,,589.276787273612,13069.1206311124
3852697,2014/12/22 00:00:00+00,2014/12/03 00:00:00+00,"SEE CONDO BOOK 88, PAGE 23 (CONDOS 2022 - 2043) KILLED TAX LOT 831 & AIR RIGHTS LOT 7000 ON 1/19/2016",,2,0202,,0831,2,2606,,,,,,,,,,,2606,,,,,,,,,,1,88,23,2016/01/19 00:00:00+00,0202    0831,Y,Y,4295,,,127.091808029538,400.604985379086
3852698,2010/07/16 00:00:00+00,1980/04/20 00:00:00+00,SEE CONDO BOOK 30 PAGE 33 (CONDOS 2025 - 2193) KILLED TAX LOT 839 ON 8/26/1982.,,2,0281,,0839,2,15831,,,,,,,,,,,15763,,,,,,,,3678,C,1,30,33,1982/08/26 00:00:00+00,0281    0839,N,Y,2255,,,238.35801212566,2432.63644153262
3852699,2010/07/16 00:00:00+00,,SEE CONDO BOOK 33 PAGE 38 (CONDOS 2001 - 2007) KILLED TAX LOT 800 ON 11/23/1984.,,2,0368,,0800,2,3080,,,,,,,,,,,,,,,,,,,,,1,33,38,1984/11/23 00:00:00+00,0368    0800,N,Y,2261,,,108.317603780133,473.223484562273
3852700,2010/07/16 00:00:00+00,,SEE CONDO BOOK 33 PAGE 38 (CONDOS 2008 - 2012) KILLED TAX LOT 801 ON 4/18/1986.,,2,0368,,0801,2,2241,,,,,,,,,,,,,,,,,,,,,1,35,29,1986/04/18 00:00:00+00,0368    0801,N,Y,2262,,,102.352203564574,344.352640944106
3852701,2010/07/16 00:00:00+00,1999/03/02 00:00:00+00,SEE CONDO BOOK 45 PAGE 42 (CONDOS 2089 - 2140) KILLED TAX LOT 816 ON 4/30/2002.,,2,0407,,0816,2,5000,,,,,,,,,,,5000,,,,,,,,3795,I,1,45,42,2002/04/30 00:00:00+00,0407    0816,N,Y,3046,,,117.499103914184,768.04053162364
3852702,2010/07/16 00:00:00+00,1999/03/02 00:00:00+00,SEE CONDO BOOK 43 PAGE 43 (CONDOS 2001 - 2088) KILLED TAX LOT 817 ON 4/29/1999.,,2,0407,,0817,2,10000,,,,,,,,,,,10000,1,,,,,,,,,1,43,43,1999/04/29 00:00:00+00,0407    0817,N,Y,3046,,,156.770005108539,1536.04578032564
3852703,,,SEE CONDO BOOK 40 PAGE 9 (CONDOS 2001 - 2003) KILLED TAX LOTS 802 & 803.,,2,0441,,0802,2,1572,,,,,,,,,,,1572,,,,,,,,*,*,1,40,9,1991/05/10 00:00:00+00,0441    0802,N,Y,2263,,,70.2408017764674,241.597846672013
3852704,,,SEE CONDO BOOK 40 PAGE 9 (CONDOS 2001 - 2003) KILLED TAX LOTS 802 & 803.,,2,0441,,0803,2,1452,,,,,,,,,,,1452,,,,,,,,*,*,1,40,9,1991/05/10 00:00:00+00,0441    0803,N,Y,2263,,,66.3101016692978,223.145205490244
3852705,2008/02/15 00:00:00+00,2007/05/08 00:00:00+00,SEE CONDO BOOK 71 PAGE 10 (CONDOS 2001 - 2201) KILLED TAX LOT 822 & AIR RIGHTS LOTS (7002 & 7003) ON 10/16/2009.,,2,0699,N,0822,2,27182,,,,,,,,,,,27181,,,,,,,,3830,K,1,71,10,2009/10/16 00:00:00+00,0699N   0822,N,Y,2972,,,273.187000689224,4173.25637760695
3852706,2008/04/29 00:00:00+00,2007/04/25 00:00:00+00,"SEE CONDO BOOK 63 PAGE 12 (CONDOS 2001 - 2247) KILLED TAX LOTS (842 - 845) & AIR RIGHTS LOTS (7000, 7001, 7004 - 7007, & 7009) ON 8/21/2007.",,2,1045,,0845,2,8156,,,,,,,,,,,8125,,,,,,,,3830,M,1,63,12,2007/08/21 00:00:00+00,1045    0845,N,Y,2860,,,155.105475965514,1252.25901016011
3852707,2008/02/15 00:00:00+00,2007/06/07 00:00:00+00,SEE CONDO BOOK 70 PAGE 43 (CONDOS 2001 - 2123) KILLED TAX LOT 818 ON 8/6/2009.,,2,0542,,0818,2,13200,,,,,,,,,,,13200,,,,,,,,3830,V,1,70,43,2009/08/06 00:00:00+00,0542    0818,N,Y,2962,,,219.167603291034,2026.56774607971
3852708,2014/03/12 00:00:00+00,2012/12/18 00:00:00+00,"SEE CONDO BOOK 79, PAGE 5 (CONDOS 2050 - 2058) KILLED TAX LOT 866 ON 5/2/2013.",,2,1218,,0866,2,10860,,,,,,,,,,,10587,,,,,,,,,,1,79,5,2013/05/02 00:00:00+00,1218    0866,N,Y,4137,,,223.555041186382,1668.62038304478
3852709,2006/09/09 00:00:00+00,,"SEE CONDO BOOK 51, PAGE 11 (CONDOS 2178 - 2213) KILLED TAX LOT 856 ON 8/24/2005.",,2,0036,,0856,2,9173,,,,,,,,,,,9173,1,,,,,,,3782,u,1,51,11,2005/08/24 00:00:00+00,0036    0856,N,Y,3072,,,150.535223215684,1409.43935037192
3852710,2010/07/19 00:00:00+00,,SEE CONDO BOOK 44 PAGE 58 (CONDOS 2001 - 2033) KILLED TAX LOT 879.,,2,0456,,0879,2,65774,,,,,,,,,,,65782,,,,,,,,*,*,1,44,38,2000/12/15 00:00:00+00,0456    0879,N,Y,3040,,,439.426311323616,10103.7000997137
3852711,2008/06/02 00:00:00+00,2007/07/17 00:00:00+00,SEE CONDO BOOK 71 PAGE 11 (CONDO 2001 - 2003) KILLED TAX LOTS (825 - 827) ON 9/15/2009.,,2,0371,,0827,2,21788,,,,,,,,,,,21668,1,,,,,,,3833,Z,1,71,11,2009/09/15 00:00:00+00,0371    0827,N,Y,1349,,,237.097082158786,3347.50487093563
3852712,2008/06/02 00:00:00+00,2007/07/17 00:00:00+00,SEE CONDO BOOK 71 PAGE 11 (CONDO 2001 - 2003) KILLED TAX LOTS (825 - 827) ON 9/15/2009.,,2,0371,,0826,2,4046,,,,,,,,,,,4037,1,,,,,,,3833,Z,1,71,11,2009/09/15 00:00:00+00,0371    0826,N,Y,1349,,,102.631925306307,621.602978476069
3852713,2010/06/22 00:00:00+00,2005/03/28 00:00:00+00,SEE CONDO BOOK 55 PAGE 14 (CONDOS 2025 - 2026) KILLED TAX LOT 816 ON 10/26/2005.,,2,2837,,0816,2,955,,,,,,,,,,,950,,,,,,,,3818,O,1,55,14,2005/10/26 00:00:00+00,2837    0816,N,Y,1664,,,53.16146231528,146.837019882532
3852714,2010/06/22 00:00:00+00,2005/03/28 00:00:00+00,SEE CONDO BOOK 55 PAGE 14 (CONDOS 2023 - 2024) KILLED TAX LOT 817 ON 10/26/2005.,,2,2837,,0817,2,956,,,,,,,,,,,950,,,,,,,,3818,O,1,55,14,2005/10/26 00:00:00+00,2837    0817,N,Y,1664,,,53.1874700766463,146.936013013041
3852715,2011/10/26 00:00:00+00,2011/10/25 00:00:00+00,"SEE CONDO BOOK 81, PAGE 29 CONDOS 2022 & 2023 KILLED AIR RIGHTS LOTS (7002,7003,7024,7027,7032,7034,7035) & TAX LOTS (871,874,877) ON 3/19/2014",,2,0441,,0874,2,1163,,,,,,,,,,,1163,,,,,,,,3852,H & I,1,81,29,2014/03/19 00:00:00+00,0441    0874,N,Y,4178,,,63.5486632698338,178.689078653482
3852716,2012/03/22 00:00:00+00,2012/03/13 00:00:00+00,"SEE CONDO BOOK 81, PAGE 29 CONDOS 2022 & 2023 KILLED AIR RIGHTS LOTS (7002,7003,7024,7027,7032,7034,7035) & TAX LOTS (871,874,877) ON 3/19/2014",,2,0441,,0877,2,3192,,,,,,,,,,,3193,,,,,,,,3855,K,1,81,29,2014/03/19 00:00:00+00,0441    0877,N,Y,4178,,,125.414327012658,490.539479719758
3852717,2006/09/09 00:00:00+00,,"SEE CONDO BOOK 81, PAGE 35 (CONDOS 2001 - 2004) KILLED TAX LOT 817 ON 2/24/2014.",,2,4076,W,0817,2,3643,,,,,,,,,,,3643,1,,,,,,,3697,Q,1,81,35,2014/02/24 00:00:00+00,4076W   0817,N,Y,5102,,,107.099914340538,559.698312472453
3852718,2011/07/01 00:00:00+00,2011/06/27 00:00:00+00,"SEE CONDO BOOK 81, PAGE 29 CONDOS 2022 & 2023 KILLED AIR RIGHTS LOTS (7002,7003,7024,7027,7032,7034,7035) & TAX LOTS (871,874,877) ON 3/19/2014",,2,0441,,0871,2,210,,,,,,,,,,,210,,,,,,,,3852,H & I,1,81,29,2014/03/19 00:00:00+00,0441    0871,N,Y,4178,,,23.6195006865477,32.3477912577288
3852719,2012/03/22 00:00:00+00,2012/03/13 00:00:00+00,"SEE CONDO BOOK 81, PAGE 28 CONDOS (2024 & 2025) KILLED AIR RIGHTS LOTS (7001,7033,7036) & TAX LOTS (860,862,863,868,869,875,876) ON 3/19/2014",,2,0441,,0876,2,737,,,,,,,,,,,737,,,,,,,,3855,K,1,81,28,2014/03/19 00:00:00+00,0441    0876,N,Y,4182,,,48.5685013150502,113.213853606039
3852720,2011/10/26 00:00:00+00,2011/10/25 00:00:00+00,"SEE CONDO BOOK 81, PAGE 28 CONDOS (2024 & 2025) KILLED AIR RIGHTS LOTS (7001,7033,7036) & TAX LOTS (860,862,863,868,869,875,876) ON 3/19/2014",,2,0441,,0875,2,1737,,,,,,,,,,,1737,,,,,,,,3855,K,1,81,28,2014/03/19 00:00:00+00,0441    0875,N,Y,4182,,,99.3880642498185,267.00640898852
3879297,2011/07/01 00:00:00+00,2011/06/27 00:00:00+00,"SEE CONDO BOOK 81, PAGE 28 CONDOS (2024 & 2025) KILLED AIR RIGHTS LOTS (7001,7033,7036) & TAX LOTS (860,862,863,868,869,875,876) ON 3/19/2014",,2,0441,,0863,2,3869,,,,,,,,,,,3869,,,,,,,,3852,H & I,1,81,28,2014/03/19 00:00:00+00,0441    0863,N,Y,4182,,,165.477704391226,594.676249270819
3879298,2011/07/01 00:00:00+00,2011/06/27 00:00:00+00,"SEE CONDO BOOK 81, PAGE 28 CONDOS (2024 & 2025) KILLED AIR RIGHTS LOTS (7001,7033,7036) & TAX LOTS (860,862,863,868,869,875,876) ON 3/19/2014",,2,0441,,0860,2,2322,,,,,,,,,,,2323,,,,,,,,3852,H & I,1,81,28,2014/03/19 00:00:00+00,0441    0860,N,Y,4182,,,78.3920022099546,356.84535770656
3879299,2011/07/01 00:00:00+00,2011/06/27 00:00:00+00,"SEE CONDO BOOK 81, PAGE 28 CONDOS (2024 & 2025) KILLED AIR RIGHTS LOTS (7001,7033,7036) & TAX LOTS (860,862,863,868,869,875,876) ON 3/19/2014",,2,0441,,0869,2,6448,,,,,,,,,,,6443,,,,,,,,3852,H & I,1,81,28,2014/03/19 00:00:00+00,0441    0869,N,Y,4182,,,165.91380650226,990.90180642326
3879300,2011/07/01 00:00:00+00,2011/06/27 00:00:00+00,"SEE CONDO BOOK 81, PAGE 28 CONDOS (2024 & 2025) KILLED AIR RIGHTS LOTS (7001,7033,7036) & TAX LOTS (860,862,863,868,869,875,876) ON 3/19/2014",,2,0441,,0862,2,3863,,,,,,,,,,,3861,,,,,,,,3852,H & I,1,81,28,2014/03/19 00:00:00+00,0441    0862,N,Y,4182,,,112.774903219627,593.714253921105
3879301,2012/03/01 00:00:00+00,1982/04/27 00:00:00+00,SEE CONDO BOOK 38 PAGE 15 (CONDOS 2007 - 2011) KILLED TAX LOT 823 ON 5/16/1989.,,2,1230,,0823,2,1410,,,,,,,,,,,1426,,,,,,,,3679,K,1,38,15,1989/05/16 00:00:00+00,1230    0823,N,Y,2393,,,61.2803876271664,216.614570186459
3879302,2012/03/01 00:00:00+00,1982/04/27 00:00:00+00,SEE CONDO BOOK 37 PAGE 55 (CONDOS 2001 - 2006) KILLED TAX LOT 824 12/2/1988.,,2,1230,,0824,2,2734,,,,,,,,,,,2867,,,,,,,,3679,K,1,37,55,1988/12/02 00:00:00+00,1230    0824,N,Y,2393,,,100.046067663545,420.17802174462
3879303,2010/06/28 00:00:00+00,1995/05/11 00:00:00+00,SEE CONDO BOOK 42 PAGE 7 (CONDOS 2015 - 2028) KILLED TAX LOT 806.,,2,5043,,0806,2,32312,,,,,,,,,,,32312,,,,,,,,3779,*,1,42,7,1995/05/01 00:00:00+00,5043    0806,N,Y,3033,,,366.576271258182,4963.96525769353
3879304,2010/06/28 00:00:00+00,1995/05/10 00:00:00+00,SEE CONDO BOOK 41 PAGE 48 (CONDOS 2001 - 2004) KILLED TAX LOT 800 ON 12/7/1994.,,2,5043,,0800,2,14193,,,,,,,,,,,14194,,,,,,,,3777,X,1,41,48,1994/12/07 00:00:00+00,5043    0800,N,Y,3033,,,197.470952548482,2180.43649446052
3879305,2010/06/28 00:00:00+00,1995/05/10 00:00:00+00,SEE CONDO BOOK 41 PAGE 49 (CONDOS 2001 - 2008) KILLED TAX LOT 802 ON 1/10/1995.,,2,5043,,0802,2,10404,,,,,,,,,,,10404,,,,,,,,3777,Y,1,41,49,1995/01/10 00:00:00+00,5043    0802,N,Y,3033,,,175.118138189214,1598.30574768254
3879306,2010/06/28 00:00:00+00,1995/05/11 00:00:00+00,SEE CONDO BOOK 42 PAGE 5 (CONDOS 2009 - 2014) KILLED TAX LOT 804 ON 5/1/1995.,,2,5043,,0804,2,11504,,,,,,,,,,,11504,,,,,,,,3779,*,1,42,5,1995/05/01 00:00:00+00,5043    0804,N,Y,3033,,,204.449355767086,1767.25942914241
3879307,2010/06/28 00:00:00+00,1995/11/09 00:00:00+00,SEE CONDO BOOK 42 PAGE 24 (CONDOS 2029 - 2035) KILLED TAX LOT 807 ON 9/26/1995.,,2,5043,,0807,2,12518,,,,,,,,,,,12518,,,,,,,,3782,G,1,42,24,1995/09/26 00:00:00+00,5043    0807,N,Y,3033,,,213.63954115729,1923.05542431161
3879308,2010/06/28 00:00:00+00,1995/11/09 00:00:00+00,SEE CONDO BOOK 42 PAGE 28 (CONDOS 2036 - 2039) KILLED TAX LOT 808.,,2,5043,,0808,2,6156,,,,,,,,,,,6163,,,,,,,,3782,G,1,42,28,1995/02/09 00:00:00+00,5043    0808,N,Y,3033,,,135.905694547829,945.653567641314
3879309,2010/06/28 00:00:00+00,1996/07/25 00:00:00+00,SEE CONDO BOOK 42 PAGE 30 (CONDOS 2040 - 2042) KILLED TAX LOT 810 ON 2/8/1996.,,2,5043,,0810,2,5407,,,,,,,,,,,5407,,,,,,,,3783,Z,1,42,30,1996/02/08 00:00:00+00,5043    0810,N,Y,3033,,,145.973073166432,830.717783953936
3879310,2010/06/28 00:00:00+00,1996/07/25 00:00:00+00,SEE CONDO BOOK 42 PAGE 33 (CONDOS 2043 - 2046) KILLED TAX LOT 811 ON 2/14/1996.,,2,5043,,0811,2,8599,,,,,,,,,,,8600,,,,,,,,3783,Z,1,42,33,1996/02/14 00:00:00+00,5043    0811,N,Y,3033,,,293.658616537101,1321.00044133195
3879311,2010/06/28 00:00:00+00,1996/07/25 00:00:00+00,SEE CONDO BOOK 42 PAGE 33 (CONDOS 2047 - 2050) KILLED TAX LOT 812 ON 2/14/1996.,,2,5043,,0812,2,6464,,,,,,,,,,,6464,,,,,,,,3783,Z,1,42,33,1996/02/14 00:00:00+00,5043    0812,N,Y,3033,,,139.733847364467,993.00899856572
3879312,2010/07/08 00:00:00+00,1993/07/08 00:00:00+00,SEE CONDO BOOK 40 PAGE 50 (CONDOS 2019 - 2024) KILLED TAX LOT 824 ON 12/21/1992.,,2,5056,,0824,2,15195,,,,,,,,,,,13195,,,,,,,,,,1,40,50,1992/12/21 00:00:00+00,5056    0824,N,Y,3033,,,203.497377880176,2334.32770826224
3879313,2010/07/08 00:00:00+00,1994/10/28 00:00:00+00,SEE CONDO BOOK 42 PAGE 25 (CONDOS 2055 - 2058) KILLED TAX LOT 833.,,2,5056,,0833,2,7567,,,,,,,,,,,7581,,,,,,,,,,1,42,25,1995/10/25 00:00:00+00,5056    0833,N,Y,3033,,,174.814404454847,1162.52414680788
3879314,2010/07/08 00:00:00+00,1994/10/28 00:00:00+00,SEE CONDO BOOK 41 PAGE 38 (CONDOS 2049 - 2054) KILLED TAX LOT 832 ON 6/29/1994.,,2,5056,,0832,2,10811,,,,,,,,,,,10772,,,,,,,,,,1,41,38,1994/06/29 00:00:00+00,5056    0832,N,Y,3033,,,181.785153401134,1660.96832293497
3879315,2006/09/09 00:00:00+00,,SEE CONDO BOOK 95 PAGE 47 (CONDOS 2159 & 2160) KILLED TAX LOT 814 ON 5/24/2017,,2,0277,,0814,2,1169,,,,,,,,,,,1172,1,,,,,,,739,*,1,95,47,2017/05/24 00:00:00+00,0277    0814,N,Y,5557,,,56.7212160954839,179.608392093824
3879316,2006/09/09 00:00:00+00,,"SEE CONDO BOOK 88, PAGE 23 (CONDOS 2136 - 2142) KILLED TAX LOT 832 ON 6/27/2017",,2,0205,,0832,2,1505,,,,,,,,,,,1505,1,,,,,,,3172,n,1,95,38,2017/06/27 00:00:00+00,0205    0832,Y,Y,5552,,,74.9156047992182,231.284963924455
3879317,2006/09/09 00:00:00+00,,"SEE CONDO BOOK 91, PAGE 20 (CONDOS 2235 - 2237) KILLED TAX LOT 821 ON 7/1/2016",,2,0207,,0821,2,1611,,,,,,,,,,,1611,1,,,,,,,3673,*,0,91,20,2016/07/01 00:00:00+00,0207    0821,N,Y,5397,,,86.9613061528786,247.52700109274
3879318,2015/05/12 00:00:00+00,2015/05/07 00:00:00+00,"SEE CONDO BOOK 86, PAGE 1 (CONDO 2163) KILLED TAX LOT 838 ON 7/6/2015",,2,0210,,0838,2,12888,,,,,,,,,,,12887,,,,,,,,,,0,86,1,2015/07/06 00:00:00+00,0210    0838,N,Y,2455,,,199.260900206645,1980.4179013106
3879319,2015/01/09 00:00:00+00,2014/12/22 00:00:00+00,"SEE CONDO BOOK 91, PAGE 21 (CONDOS 2001 - 2107) KILLED TAX LOT 885 ON 7/1/2016",,2,0473,,0885,2,36966,,,,,,,,,,,36969,,,,,,,,,,1,91,21,2016/07/01 00:00:00+00,0473    0885,N,Y,5388,,,301.143438466265,5675.08986698331
3879320,2006/09/09 00:00:00+00,,"SEE CONDO BOOK 92, PAGE 25 (CONDOS 2017 & 2018) KILLED TAX LOT 806 ON 9/1/2016",,2,0333,,0806,2,1878,,,,,,,,,,,1878,1,,,,,,,,,1,92,25,2016/09/01 00:00:00+00,0333    0806,N,Y,5402,,,89.1696038515484,288.564575281873
3879321,2015/08/18 00:00:00+00,2015/07/22 00:00:00+00,"SEE CONDO BOOK 92, PAGE 30 (CONDOS 2001 & 2002) KILLED AIR RIGHTS LOTS (7000 & 7001) AND TAX LOT 830 ON 9/30/2016",,2,0340,,0830,2,6447,,,,,,,,,,,6447,,,,,,,,,,1,92,30,2016/09/30 00:00:00+00,0340    0830,N,Y,5309,,,153.846606485229,990.581105784695
3879322,2014/06/19 00:00:00+00,2014/06/17 00:00:00+00,"SEE CONDO BOOK 83, PAGE 5 (CONDOS 2046 - 2050) KILLED TAX LOT 808 ON  7/10/2014",,2,0482,,0808,2,1546,,,,,,,,,,,1546,,,,,,,,,,0,83,5,2014/07/10 00:00:00+00,0482    0808,N,Y,4190,,,81.3222018248144,237.475826950593
3879323,2018/06/01 00:00:00+00,2016/08/24 00:00:00+00,"SEE AMENDMENT CONDO BOOK 94, PAGE 17(CONDOS 2001-2013 & 2015-2026) KILLED TAX LOT 816 ON 2/2/2017",,2,5945,,0816,2,21331,,,,,,,,,,,21171,,,,,,,,3871,Z,1,94,17,2017/02/02 00:00:00+00,5945    0816,N,Y,1334,,,269.271910431001,3271.88011779635
3879324,2016/08/18 00:00:00+00,2016/02/03 00:00:00+00,"SEE CONDO BOOK 92, PAGE 10 (CONDOS 2005 - 2010) KILLED TAX LOT 814 ON  8/23/2016",,2,0508,N,0814,2,1679,,,,,,,,,,,1670,1,,,,,,,,,1,92,10,2016/08/23 00:00:00+00,0508N   0814,N,Y,5319,,,64.1372131848967,258.008645186963
3879325,2011/10/26 00:00:00+00,2011/10/26 00:00:00+00,SEE CONDO BOOK 87 PAGE 31 (CONDOS 2001 - 2235) KILLED TAX LOT 894 ON 9/29/2015,,2,0516,,0894,2,22000,,,,,,,,,,,22000,,,,,,,,3854,G,1,87,31,2015/09/29 00:00:00+00,0516    0894,N,Y,4289,,,232.713604196248,3379.97874320371
3879326,2009/05/26 00:00:00+00,2009/03/31 00:00:00+00,SEE CONDO BOOK 95 PAGE 23 (CONDOS 2471 - 2909) KILLED TAX LOT 844 ON 9/26/2017,,2,0673,,0844,2,49532,,,,,,,,,,,49532,,,,,,,,3842,U,1,95,23,2017/09/26 00:00:00+00,0673    0844,N,Y,5512,,,356.473401085677,7610.51631387766
3879327,2015/06/25 00:00:00+00,2015/06/24 00:00:00+00,SEE CONDO BOOK 93 PAGE 40 (CONDOS 2001 - 2003) KILLED TAX LOTS 802 & 803 ON 1/4/2017,,2,0697,N,0802,2,46413,,,,,,,,,,,46413,,,,,,,,,,1,93,40,2017/01/04 00:00:00+00,0697N   0802,N,Y,5430,,,338.998501290862,7125.95423176297
3879328,2015/06/25 00:00:00+00,2015/06/24 00:00:00+00,SEE CONDO BOOK 93 PAGE 40 (CONDOS 2001 - 2003) KILLED TAX LOTS 802 & 803 ON 1/4/2017,,2,0697,N,0803,2,6775,,,,,,,,,,,6775,,,,,,,,,,1,93,40,2017/01/04 00:00:00+00,0697N   0803,N,Y,5430,,,207.087300857961,1040.2804409544
3879329,2009/10/28 00:00:00+00,2009/09/04 00:00:00+00,SEE CONDO BOOK 95 PAGE 2 (CONDOS 2001 & 2002) KILLED TAX LOT 813 ON 4/26/2017,,2,0910,,0813,2,2000,,,,,,,,,,,2000,,,,,,,,3844,B,1,95,2,2017/04/26 00:00:00+00,0910    0813,N,Y,5549,,,82.2246001761012,307.269987718417
3879330,2008/06/02 00:00:00+00,2007/07/17 00:00:00+00,SEE CONDO BOOK 71 PAGE 11 (CONDO 2001 - 2003) KILLED TAX LOTS (825 - 827) ON 9/15/2009.,,2,0371,,0825,2,182,,,,,,,,,,,182,1,,,,,,,3833,Z,1,71,11,2009/09/15 00:00:00+00,0371    0825,N,Y,1349,,,46.3693488363137,27.9090608429089
3879331,2010/07/19 00:00:00+00,1988/06/06 00:00:00+00,SEE CONDO BOOK 41 PAGE 39 (CONDOS 2001 - 2151) KILLED TAX LOT 819.,,2,0459,,0819,2,44906,,,,,,,,,,,44767,,,,,,,,3733,D,1,39,18,1994/06/23 00:00:00+00,0459    0819,N,Y,3038,,,361.785242972646,6897.44172998988
3879332,2006/09/09 00:00:00+00,,DELIVERY 10 - SEE CONDO BOOK 71 PAGE 34 (CONDOS 2017 - 2020) KILLED TAX LOT 819 ON 7/8/2009.,,2,4057,,0819,2,2716,,,,,,,,,,,2697,1,,,,,,,3615,x,1,71,34,2009/07/08 00:00:00+00,4057    0819,N,Y,1356,,,89.0236828083605,417.337842976861
3879333,2006/09/09 00:00:00+00,,DELIVERY 11,,2,5584,,0826,2,16815,,,,,,,,,,,16813,1,,,,,,,3468,t,1,69,26,2009/02/02 00:00:00+00,5584    0826,N,Y,1991,,,208.580214804712,2581.09079704253
3879334,2012/11/07 00:00:00+00,2012/11/06 00:00:00+00,,,2,1920,,0832,2,94867,,,,,,,,,,,92313,,,,,,,,3858,F,0,84,10,2015/05/18 00:00:00+00,1920    0832,N,Y,5255,,,716.573764320246,14587.9719077182
3879335,2006/09/09 00:00:00+00,,DELIVERY 8 - SEE CONDO BOOK 82 PAGE 3 (CONDOS 2158 & 2164) KILLED TAX LOT 802 ON 3/31/2014.,,2,2536,,0802,2,4229,,,,,,,,,,,4229,1,,,,,,,65,*,1,82,3,2014/03/31 00:00:00+00,2536    0802,N,Y,5068,,,119.582870773897,650.078347111241
3879336,2011/09/26 00:00:00+00,1983/10/03 00:00:00+00,SEE CONDO BOOK 34 PAGE 7 (CONDOS 2001 - 2043) KILLED TAX LOTS 821 - 827 ON 11/26/1985.,,2,1214,,0821,2,8786,,,,,,,,,,,8793,,,,,,,,3687,V,1,34,7,1985/11/26 00:00:00+00,1214    0821,N,Y,2390,,,150.674638303134,1349.99093171673
3879337,2010/05/12 00:00:00+00,1979/11/28 00:00:00+00,SEE CONDO BOOK 24 PAGE 21 (CONDOS 3447 - 3478) KILLED TAX LOT 1074 ON 7/24/1980.,,2,1601,,1074,2,70448,,,,,,,,,,,72091,,,,,,,,3662,W,1,24,21,1980/07/24 00:00:00+00,1601    1074,N,Y,2422,,,417.721988036471,10832.343664857
3879338,2009/06/26 00:00:00+00,,SEE CONDO BOOK 29 PAGE 46 (CONDOS 2049 - 2072) KILLED TAX LOT 805 ON 2/26/1982.,,2,1057,,0805,2,8443,,,,,,,,,,,,,,,,,,,A.O,,1,29,46,1982/02/26 00:00:00+00,1057    0805,N,Y,2645,,,150.181002187568,1296.73077152469
3879339,2006/09/09 00:00:00+00,,SEE CONDO BOOK 37 PAGE 32 (CONDOS 2148 - 2171) KILLED TAX LOT 807.,,2,1057,,0807,2,8272,,,,,,,,,,,8727,1,,,,,,,A.O,,1,37,32,1988/06/29 00:00:00+00,1057    0807,N,Y,2645,,,159.520002148071,1270.37040012868
3879340,2011/09/26 00:00:00+00,1983/10/03 00:00:00+00,SEE CONDO BOOK 34 PAGE 7 (CONDOS 2001 - 2043) KILLED TAX LOTS 821 - 827 ON 11/26/1985.,,2,1214,,0822,2,1998,,,,,,,,,,,2000,,,,,,,,3687,V,1,34,7,1985/11/26 00:00:00+00,1214    0822,N,Y,2390,,,84.3150161632953,306.923932523998
3879341,2012/11/07 00:00:00+00,2012/11/05 00:00:00+00,"AIR RIGHTS LOT (7001) AND TAX LOTS (800, 801, & 803)  KILLED BY CONDO BOOK 84, PAGE 9 (CONDOS 2001 - 2003) ON 12/16/2014",,2,1920,N,0801,2,6103,,,,,,,,,,,6087,,,,,,,,3858,G,1,84,9,2014/12/16 00:00:00+00,1920N   0801,N,Y,5254,,,134.547091974068,938.397091716725
3879342,2006/09/09 00:00:00+00,,"SEE CONDO BOOK 82, PAGE 42 (CONDOS 2008 & 2009) KILLED TAX LOT 838 ON 8/11/2014",,2,1033,,0838,2,1543,,,,,,,,,,,1543,1,,,,,,,3298,m,0,82,42,2014/08/11 00:00:00+00,1033    0838,Y,Y,4195,,,61.5899006690649,237.02085375507
3879343,2012/11/07 00:00:00+00,2012/11/05 00:00:00+00,"AIR RIGHTS LOT (7001) AND TAX LOTS (800, 801, & 803)  KILLED BY CONDO BOOK 84, PAGE 9 (CONDOS 2001 - 2003) ON 12/16/2014",,2,1920,N,0803,2,4539,,,,,,,,,,,4580,,,,,,,,3858,G,1,84,9,2014/12/16 00:00:00+00,1920N   0803,N,Y,5254,,,118.208222740256,698.037793672076
3879344,2012/11/07 00:00:00+00,2012/11/05 00:00:00+00,"AIR RIGHTS LOT (7001) AND TAX LOTS (800, 801, & 803)  KILLED BY CONDO BOOK 84, PAGE 9 (CONDOS 2001 - 2003) ON 12/16/2014",,2,1920,N,0800,2,22458,,,,,,,,,,,22762,,,,,,,,3858,G,1,84,9,2014/12/16 00:00:00+00,1920N   0800,N,Y,5254,,,360.702523502588,3453.52382316969
3879345,2010/06/22 00:00:00+00,2005/03/28 00:00:00+00,SEE CONDO BOOK 55 PAGE 14 (CONDOS 2011 - 2012) KILLED TAX LOT 823 ON 10/26/2005.,,2,2837,,0823,2,960,,,,,,,,,,,950,,,,,,,,3818,O,1,55,14,2005/10/26 00:00:00+00,2837    0823,N,Y,1664,,,53.3415898518335,147.542367359858
3879346,2010/06/22 00:00:00+00,2005/03/28 00:00:00+00,SEE CONDO BOOK 55 PAGE 14 (CONDOS 2009 - 2010) KILLED TAX LOT 824 ON 10/26/2005.,,2,2837,,0824,2,960,,,,,,,,,,,950,,,,,,,,3818,O,1,55,14,2005/10/26 00:00:00+00,2837    0824,N,Y,1664,,,53.3670645115705,147.642630616647
3879347,2010/06/22 00:00:00+00,2005/03/28 00:00:00+00,SEE CONDO BOOK 55 PAGE 14 (CONDOS 2001 - 2008) KILLED TAX LOT 825 ON 10/26/2005.,,2,2837,,0825,2,2668,,,,,,,,,,,2644,,,,,,,,3818,O,1,55,14,2005/10/26 00:00:00+00,2837    0825,N,Y,1664,,,83.0018197058533,410.330005746063
3879348,2010/06/23 00:00:00+00,1917/02/26 00:00:01+00,COMMERCIAL CONDO 2004 KILLED TAX LOTS (988 & 992).,,2,2875,,0988,2,1558,,,,,,,,,,,1558,,,,,,,,*,851,1,,,,2875    0988,N,Y,0026,,,93.0380667917795,239.405966101892
3879349,2010/07/20 00:00:00+00,1980/07/01 00:00:00+00,SEE CONDO BOOK 24 PAGE 24 (CONDOS 2103 - 2231) KILLED TAX LOT 816 ON 7/1/1980.,,2,0546,,0816,2,47574,,,,,,,,,,,47574,,,,,,,,3673,L,1,24,24,1980/07/23 00:00:00+00,0546    0816,N,Y,2282,,,413.432207245443,7303.45128788579
3879350,2010/07/20 00:00:00+00,1980/07/01 00:00:00+00,SEE CONDO BOOK 24 PAGE 24 (CONDOS 2381 - 2527) KILLED TAX LOT 818 ON 9/22/1981.,,2,0546,,0818,2,74569,,,,,,,,,,,74569,,,,,,,,3673,L,1,24,24,1981/09/22 00:00:00+00,0546    0818,N,Y,2282,,,580.545709259618,11448.1335665297
3879351,2010/07/20 00:00:00+00,1980/07/01 00:00:00+00,SEE CONDO BOOK 24 PAGE 24 (CONDOS 2232 - 2380) KILLED TAX LOT 817 ON 9/22/1981.,,2,0546,,0817,2,116662,,,,,,,,,,,117106,,,,,,,,3673,L,1,24,24,1981/09/22 00:00:00+00,0546    0817,N,Y,2282,,,805.013699695447,17909.8109967142
3879352,2010/06/23 00:00:00+00,1917/02/26 00:00:01+00,COMMERCIAL CONDO 2004 KILLED TAX LOTS (988 & 992).,,2,2875,,0992,2,1558,,,,,,,,,,,1558,,,,,,,,*,851,1,,,,2875    0992,N,Y,0026,,,93.0367925217016,239.379967928808
3879353,2010/06/23 00:00:00+00,1917/12/26 00:00:01+00,COMMERCIAL CONDO 2011 KILLED TAX LOTS (980 & 986) ON 12/29/1955.,,2,2875,,0986,2,1558,,,,,,,,,,,1558,,,,,,,,*,851,1,,,1955/12/29 00:00:01+00,2875    0986,N,Y,0026,,,93.0374129493816,239.404202022328
3879354,2006/09/09 00:00:00+00,,SEE CONDO BOOK 67 PAGE 44 (CONDOS 2322 - 2476) KILLED TAX LOT 803 ON 6/5/2008.,,2,0751,,0803,2,19704,,,,,,,,,,,19704,1,,,,,,,3815,S,1,67,44,2008/06/05 00:00:00+00,0751    0803,N,Y,2930,,,220.087900075282,3027.21091466535
3879355,2006/09/09 00:00:00+00,,SEE CONDO BOOK 67 PAGE 29 (CONDOS 2001 - 2044) KILLED TAX LOT 801 ON 7/24/2008.,,2,0751,,0801,2,50579,,,,,,,,,,,50579,1,,,,,,,3815,S,1,67,29,2008/07/24 00:00:00+00,0751    0801,N,Y,2918,,,448.826500191813,7770.32638070844
3879356,2010/05/12 00:00:00+00,1980/12/20 00:00:00+00,SEE CONDO BOOK 28 PAGE 38 (CONDOS 3523 - 3550) KILLED TAX LOT 1078 ON 2/25/1982.,,2,1601,,1078,2,49722,,,,,,,,,,,46241,,,,,,,,3704,D,1,28,38,1982/02/25 00:00:00+00,1601    1078,N,Y,2422,,,387.131826931986,7645.52790702358
3879357,2006/09/09 00:00:00+00,,SEE CONDO BOOK 43 PAGE 11 (CONDOS 2053 - 2082) KILLED TAX LOTS (800 & 801) ON 8/19/1997.,,2,0778,,0800,2,991,,,,,,,,,,,991,1,,,,,,,,,1,43,11,1997/08/19 00:00:00+00,0778    0800,N,Y,2298,,,51.2838000048485,152.172856773902
3879358,2010/05/10 00:00:00+00,1983/12/10 00:00:00+00,SEE CONDO BOOK 32 PAGE 44 (CONDOS 2106 - 2154) KILLED TAX LOT 895 ON 3/9/1984.,,2,1356,,0895,2,25757,,,,,,,,,,,25392,,,,,,,,3691,F,1,32,44,1984/03/09 00:00:00+00,1356    0895,N,Y,2412,,,276.353899076856,3957.7237562375
3879359,2010/05/12 00:00:00+00,1980/12/20 00:00:00+00,SEE CONDO BOOK 28 PAGE 38 (CONDOS 3523 - 3550) KILLED TAX LOT 1078 ON 2/25/1982.,,2,1601,,1077,2,34212,,,,,,,,,,,33868,,,,,,,,3704,D,1,27,9,1981/01/22 00:00:00+00,1601    1077,N,Y,2422,,,297.516289537523,5260.73742448226
3879360,2010/05/13 00:00:00+00,1989/08/02 00:00:00+00,SEE CONDO BOOK 38 PAGE 12 (CONDOS 2001 - 2005) KILLED TAX LOT 816 ON 5/18/1989.,,2,1661,,0816,2,5419,,,,,,,,,,,5419,,,,,,,,3740,S,1,38,12,1989/05/18 00:00:00+00,1661    0816,N,Y,3002,,,136.313557409229,833.933871825565
3879361,2010/05/24 00:00:00+00,1985/12/14 00:00:00+00,SEE CONDO BOOK 35 PAGE 15 (CONDOS 2001 - 2024) KILLED TAX LOT 802,,2,1821,,0802,2,21425,,,,,,,,,,,21356,,,,,,,,3716,J,1,35,15,1985/12/23 00:00:00+00,1821    0802,N,Y,1657,,,253.627600846807,3295.07713777996
3879362,2006/09/09 00:00:00+00,,SEE CONDO BOOK 46 PAGE 19 (CONDOS 2001 - 2012) KILLED TAX LOT 811.,,2,5316,,0811,2,12000,,,,,,,,,,,12000,1,,,,,,,3812,D,1,46,19,2002/09/30 00:00:00+00,5316    0811,N,Y,1505,,,172.385065409194,1842.56330827985
3879363,2006/09/09 00:00:00+00,,SEE CONDO BOOK 48 PAGE 16 (CONDOS 2013 - 2024) KILLED TAX LOT 812 ON 11/21/2003.,,2,5316,,0812,2,12015,,,,,,,,,,,12000,1,,,,,,,3812,D,1,48,16,2003/11/21 00:00:00+00,5316    0812,N,Y,1554,,,172.504537355349,1844.92198261974
3879364,2006/09/09 00:00:00+00,,SEE CONDO BOOK 68 PAGE 43 (CONDOS 2033 - 2036) KILLED TAX LOT 805 ON 6/8/2009.,,2,5316,,0805,2,3200,,,,,,,,,,,3200,1,,,,,,,3444,Y,1,68,43,2009/06/08 00:00:00+00,5316    0805,N,Y,1284,,,103.55128432091,491.355251237651
3879365,2006/09/09 00:00:00+00,,SEE CONDO BOOK 68 PAGE 43 (CONDOS 2025 - 2028) KILLED TAX LOT 807 ON 6/8/2009.,,2,5316,,0807,2,3200,,,,,,,,,,,3200,1,,,,,,,3444,Y,1,68,43,2009/06/08 00:00:00+00,5316    0807,N,Y,1284,,,103.550830917614,491.34780376345
3879366,2006/09/09 00:00:00+00,,SEE CONDO BOOK 51 PAGE 31 (CONDOS 2001 - 2004) KILLED TAX LOT 806 ON 1/18/2005.,,2,4523,,0806,2,2788,,,,,,,,,,,2763,1,,,,,,,3711,f,1,24,31,2005/01/18 00:00:00+00,4523    0806,N,Y,2657,,,92.7769093292906,428.20561342385
3879367,2010/05/05 00:00:00+00,1982/08/09 00:00:00+00,SEE CONDO BOOK 31 PAGE 39 (CONDOS 2112 - 2126) KILLED TAX LOT 857 ON 6/6/1984.,,2,1301,,0957,2,7235,,,,,,,,,,,7235,,,,,,,,3685,A,1,31,39,1984/06/06 00:00:00+00,1301    0957,N,Y,2407,,,149.988068912813,1112.30048947488
3879368,2010/05/05 00:00:00+00,1982/08/09 00:00:00+00,SEE CONDO BOOK 31 PAGE 39 (CONDOS 2176 - 2183) KILLED TAX LOT 858 ON 6/6/1984.,,2,1301,,0958,2,1523,,,,,,,,,,,1523,,,,,,,,3685,A,1,31,39,1984/06/06 00:00:00+00,1301    0958,N,Y,2407,,,77.8008268579,234.139881058208
3879369,2009/03/30 00:00:00+00,1981/09/30 00:00:00+00,SEE CONDO BOOK 29 PAGE 4 (CONDOS 2350 - 2059) KILLED TAX LOT 806 ON 12/7/1981.,,2,4325,,0806,2,22639,,,,,,,,,,,22585,,,,,,,,3707,S,1,29,4,1981/12/07 00:00:00+00,4325    0806,N,Y,3031,,,251.138802315541,3480.57128477312
3879370,2006/09/09 00:00:00+00,,SEE CONDO BOOK 61 PAGE 17 (CONDOS 2021 - 2026) KILLED TAX LOT 816 ON 12/18/2006.,,2,4547,,0816,2,7007,,,,,,,,,,,7007,1,,,,,,,3817,N,1,61,17,2006/12/18 00:00:00+00,4547    0816,N,Y,2616,,,138.347403892942,1076.37848100474
3879371,2009/03/30 00:00:00+00,1982/09/27 00:00:00+00,SEE CONDO BOOK 32 PAGE 16 (CONDOS 2370 - 2089) KILLED TAX LOT 809 ON 9/28/1983.,,2,4325,,0809,2,42963,,,,,,,,,,,42396,,,,,,,,3693,O,1,32,16,1983/09/28 00:00:00+00,4325    0809,N,Y,3031,,,337.341841730097,6605.52402902917
3879372,2009/03/30 00:00:00+00,1982/09/27 00:00:00+00,SEE CONDO BOOK 31 PAGE 14 (CONDOS 2360 - 2069) KILLED TAX LOT 808 ON 9/27/1982.,,2,4325,,0808,2,24303,,,,,,,,,,,24310,,,,,,,,3693,O,1,31,14,1982/09/27 00:00:00+00,4325    0808,N,Y,3031,,,342.918388893357,3736.53960020458
3879373,2006/09/09 00:00:00+00,1988/01/11 00:00:00+00,SEE CONDO BOOK 36 PAGE 59 (CONDOS 2421 - 2432) KILLED TAX LOT 815 ON 1/11/1988.,,2,4325,,0815,2,31019,,,,,,,,,,,31401,1,,,,,,,3732,Y,1,36,59,1988/01/11 00:00:00+00,4325    0815,N,Y,3031,,,309.505856935213,4768.83789995487
3879374,2006/09/09 00:00:00+00,,SEE CONDO BOOK 65 PAGE 37 (CONDOS 2009 - 2014) KILLED TAX LOT 816 ON 1/31/2008.,,2,4445,,0816,2,3111,,,,,,,,,,,3111,1,,,,,,,3241,a,1,65,37,2008/01/31 00:00:00+00,4445    0816,N,Y,1924,,,98.2963029069816,478.006877258555
3879375,2006/09/09 00:00:00+00,,SEE CONDO BOOK 55 PAGE 15 (CONDOS 2005 - 2016) KILLED TAX LOT 807 ON 12/19/2005.,,2,4523,,0807,2,6176,,,,,,,,,,,6139,1,,,,,,,3711,f,1,55,15,2005/12/19 00:00:00+00,4523    0807,N,Y,2737,,,130.54192542788,948.666461891591
3879376,2006/09/09 00:00:00+00,,SEE CONDO BOOK 49 PAGE 20 (CONDOS 2011 - 2016) KILLED TAX LOT 815 ON 6/10/2004.,,2,4547,,0815,2,5663,,,,,,,,,,,5663,1,,,,,,,3817,N,1,24,20,2004/06/10 00:00:00+00,4547    0815,N,Y,2616,,,120.869903267827,869.810298600691
3879377,2010/06/22 00:00:00+00,2005/03/28 00:00:00+00,SEE CONDO BOOK 55 PAGE 14 (CONDOS 2015 - 2016) KILLED TAX LOT 821 ON 10/26/2005.,,2,2837,,0821,2,958,,,,,,,,,,,950,,,,,,,,3818,O,1,55,14,2005/10/26 00:00:00+00,2837    0821,N,Y,1664,,,53.2890549880216,147.334302803839
3879378,2011/09/26 00:00:00+00,1983/10/03 00:00:00+00,SEE CONDO BOOK 34 PAGE 7 (CONDOS 2001 - 2043) KILLED TAX LOTS 821 - 827 ON 11/26/1985.,,2,1214,,0823,2,1998,,,,,,,,,,,2000,,,,,,,,3687,V,1,34,7,1985/11/26 00:00:00+00,1214    0823,N,Y,2390,,,84.3149159716683,306.92221357011
3879379,2011/09/26 00:00:00+00,1983/10/03 00:00:00+00,SEE CONDO BOOK 34 PAGE 7 (CONDOS 2001 - 2043) KILLED TAX LOTS 821 - 827 ON 11/26/1985.,,2,1214,,0824,2,1998,,,,,,,,,,,2000,,,,,,,,3687,V,1,34,7,1985/11/26 00:00:00+00,1214    0824,N,Y,2390,,,84.3150159105669,306.923533735691
3879380,2011/09/26 00:00:00+00,1983/10/03 00:00:00+00,SEE CONDO BOOK 34 PAGE 7 (CONDOS 2001 - 2043) KILLED TAX LOTS 821 - 827 ON 11/26/1985.,,2,1214,,0825,2,1998,,,,,,,,,,,2000,,,,,,,,3687,V,1,34,7,1985/11/26 00:00:00+00,1214    0825,N,Y,2390,,,84.8695565974491,306.922156590125
3879381,2011/09/26 00:00:00+00,1983/10/03 00:00:00+00,SEE CONDO BOOK 34 PAGE 7 (CONDOS 2001 - 2043) KILLED TAX LOTS 821 - 827 ON 11/26/1985.,,2,1214,,0826,2,1995,,,,,,,,,,,2002,,,,,,,,3687,V,1,34,7,1985/11/26 00:00:00+00,1214    0826,N,Y,2390,,,88.9695271760292,306.566118838241
3879382,2011/09/26 00:00:00+00,1983/10/03 00:00:00+00,SEE CONDO BOOK 34 PAGE 7 (CONDOS 2001 - 2043) KILLED TAX LOTS 821 - 827 ON 11/26/1985.,,2,1214,,0827,2,13578,,,,,,,,,,,13563,,,,,,,,3687,V,1,34,7,1985/11/26 00:00:00+00,1214    0827,N,Y,2390,,,227.609999671816,2086.19115788273
3879383,2006/09/09 00:00:00+00,,"SEE CONDO BOOK 57, PAGE 3 (CONDOS 2001 - 2044) KILLED TAX LOT 817 ON 3/23/2006.",,2,1935,,0817,2,30627,,,,,,,,,,,30607,1,,,,,,,3810,O,1,57,3,2006/03/23 00:00:00+00,1935    0817,N,Y,1708,,,284.693215913014,4708.23859261992
3879384,2009/03/26 00:00:00+00,1989/06/17 00:00:00+00,"SEE CONDO BOOKS 37, 38 PAGES 48, 7 (CONDOS 2359 - 2380) KILLED TAX LOT 814 ON 6/17/1989.",,2,3499,,0814,2,35392,,,,,,,,,,,35458,,,,,,,,3741,V,1,37,48,1989/06/17 00:00:00+00,3499    0814,N,Y,3020,,,396.255898067714,5441.45620251738
3879385,2009/03/25 00:00:00+00,,SEE CONDO BOOK 31 PAGE 11 (CONDOS 2105 - 2128) KILLED TAX LOT 803 ON 9/30/1983.,,2,3499,,0803,2,29815,,,,,,,,,,,,,,,,,,,3706,Y,1,31,11,1983/09/30 00:00:00+00,3499    0803,N,Y,3020,,,353.163977331997,4584.08620155806
3879386,2010/05/11 00:00:00+00,,SEE CONDO BOOK 30 PAGE 45 (CONDOS 3743 - 4053) KILLED TAX LOT 1070 ON 12/3/1982.,,2,1601,,1070,2,116462,,,,,,,,,,,,,,,,,,,3691,L,1,30,45,1982/12/03 00:00:00+00,1601    1070,N,Y,2461,,,637.832265953428,17908.2316016263
3879387,2006/09/09 00:00:00+00,,SEE CONDO BOOK 37 PAGE 43 (CONDOS 2433 - 2444) KILLED TAX LOT 816.,,2,4325,,0816,2,30433,,,,,,,,,,,30433,1,,,,,,,3732,Y,1,37,43,1988/08/17 00:00:00+00,4325    0816,N,Y,3031,,,294.491283327151,4678.83377679834
3879388,2006/09/09 00:00:00+00,,SEE CONDO BOOK 68 PAGE 24 (CONDOS 2065 - 2089) KILLED TAX LOT 827 ON 9/25/2008.,,2,2668,,0827,2,6408,,,,,,,,,,,6408,1,,,,,,,1310,*,1,68,24,2008/09/25 00:00:00+00,2668    0827,N,Y,1961,,,148.55458879464,985.201237461177
3879389,2008/03/24 00:00:00+00,2007/01/25 00:00:00+00,SEE CONDO BOOK 67 PAGE 18 (CONDOS 2021 - 2024) KILLED TAX LOT 801 ON 7/25/2008.,,2,4051,,0801,2,2720,,,,,,,,,,,2720,,,,,,,,3828,M,1,67,18,2008/07/25 00:00:00+00,4051    0801,N,Y,1950,,,91.716914018429,417.96819741731
3879390,2008/03/24 00:00:00+00,2007/01/25 00:00:00+00,SEE CONDO BOOK 67 PAGE 18 (CONDOS 2025 - 2028) KILLED TAX LOT 800 ON 7/25/2008.,,2,4051,,0800,2,2720,,,,,,,,,,,2720,,,,,,,,3828,L,1,67,18,2008/07/25 00:00:00+00,4051    0800,N,Y,1950,,,91.7174510266994,417.964117988202
3879391,2006/09/09 00:00:00+00,,"SEE CONDO BOOKS (26, 29, 30, 33) PAGES (11, 34, 41, 24) (CONDOS 2001 - 2084) KILLED TAX LOT 823 ON 1/5/1981.",,2,3180,,0823,2,187166,,,,,,,,,,,187231,1,,,,,,,,,1,26,11,1981/01/05 00:00:00+00,3180    0823,N,Y,3016,,,722.414768527558,28817.9450236543
3879392,2009/03/24 00:00:00+00,1982/11/16 00:00:00+00,SEE CONDO BOOKS 29 PAGES 34 (CONDOS 2028 - 2051) KILLED TAX LOT 825 ON 11/16/1982.,,2,3180,,0825,2,92636,,,,,,,,,,,92636,1,,,,,,,3692,W,1,29,34,1982/11/16 00:00:00+00,3180    0825,N,Y,3016,,,686.523111055744,14263.1926679322
3879393,2009/03/24 00:00:00+00,1981/01/06 00:00:00+00,SEE CONDO BOOKS 26 PAGES 11 (CONDOS 2001 - 2027) KILLED TAX LOT 824 ON 1/6/1981.,,2,3180,,0824,2,53876,,,,,,,,,,,53876,1,,,,,,,3706,U,1,26,11,1981/01/06 00:00:00+00,3180    0824,N,Y,3016,,,408.510676432212,8295.40731152291
3879394,2009/03/24 00:00:00+00,1983/08/11 00:00:00+00,SEE CONDO BOOKS 30 PAGES 41 (CONDOS 2052 - 2066) KILLED TAX LOT 828 ON 8/11/1983.,,2,3180,,0828,2,19985,,,,,,,,,,,19985,1,,,,,,,3692,X,1,30,41,1983/08/11 00:00:00+00,3180    0828,N,Y,3016,,,273.967310786305,3077.13344647332
3879395,2009/03/24 00:00:00+00,1985/11/18 00:00:00+00,SEE CONDO BOOKS 33 PAGES 24 (CONDOS 2067 - 2084) KILLED TAX LOT 827 ON 11/18/1985.,,2,3180,,0827,2,20669,,,,,,,,,,,20667,1,,,,,,,3686,U,1,33,24,1985/11/18 00:00:00+00,3180    0827,N,Y,3016,,,275.253920189658,3182.2729859528
3879396,2009/03/26 00:00:00+00,1989/06/17 00:00:00+00,SEE CONDO BOOK 38 PAGES 37 (CONDOS 2381 - 2398) KILLED TAX LOT 815 ON 6/17/1989.,,2,3499,,0815,2,22052,,,,,,,,,,,22059,,,,,,,,3741,V,1,38,37,1989/06/17 00:00:00+00,3499    0815,N,Y,3020,,,251.110611802693,3390.50763149682
3879397,2007/06/15 00:00:00+00,2006/05/15 00:00:00+00,SEE CONDO BOOK 65 PAGE 39 (CONDOS 2009 - 2012) KILLED TAX LOTS (815 & 816) ON 7/2/2008.,,2,0829,,0815,2,1800,,,,,,,,,,,1800,,,,,,,,3825,W,1,65,39,2008/07/02 00:00:00+00,0829    0815,N,Y,2920,,,92.6376000064415,276.54854243075
3879398,2007/06/15 00:00:00+00,2006/05/15 00:00:00+00,SEE CONDO BOOK 65 PAGE 39 (CONDOS 2009 - 2012) KILLED TAX LOTS (815 & 816) ON 7/2/2008.,,2,0829,,0816,2,1800,,,,,,,,,,,1800,,,,,,,,3825,W,1,65,39,2008/07/02 00:00:00+00,0829    0816,N,Y,2920,,,92.6401000126603,276.599251749027
3879399,2009/03/25 00:00:00+00,1980/06/13 00:00:00+00,SEE CONDO BOOK 25 PAGE 20 (CONDOS 2001 - 2104) KILLED TAX LOT 800 ON 6/30/1980.,,2,3499,,0800,2,256245,,,,,,,,,,,258651,,,,,,,,3675,F,1,25,20,1980/06/30 00:00:00+00,3499    0800,N,Y,3020,,,1257.0645473287,39396.6546025871
3879400,2006/09/09 00:00:00+00,,SEE CONDO BOOK 66 PAGE 16 (CONDOS 2030 - 2371) KILLED TAX LOT 800 ON 3/27/2008. ,,2,3551,,0800,2,15500,,,,,,,,,,,15500,1,,,,,,,,,1,66,16,2008/03/27 00:00:00+00,3551    0800,N,Y,3157,,,200.051000016676,2382.81340239228
3879401,2006/09/09 00:00:00+00,,SEE CONDO BOOK 61 PAGE 43 (CONDOS 2001 - 2016) KILLED TAX LOTS 800 & 801 ON 8/14/2007.,,2,3564,,0800,2,2684,,,,,,,,,,,2698,1,,,,,,,118,*,1,61,43,2007/08/14 00:00:00+00,3564    0800,N,Y,1867,,,99.5016291824964,412.537839451225
3879402,2006/09/09 00:00:00+00,,SEE CONDO BOOK 61 PAGE 43 (CONDOS 2001 - 2016) KILLED TAX LOTS 800 & 801 ON 8/14/2007.,,2,3564,,0801,2,2400,,,,,,,,,,,2400,1,,,,,,,118,*,1,61,43,2007/08/14 00:00:00+00,3564    0801,N,Y,1867,,,97.1058000342253,368.871042307251
3879403,2009/03/25 00:00:00+00,1987/04/16 00:00:00+00,SEE CONDO BOOK 39 PAGE 41 (CONDOS 2399 - 2559) KILLED TAX LOT 807 ON 7/20/1990.,,2,3499,,0807,2,281704,,,,,,,,,,,281339,,,,,,,,3727,K,1,39,41,1990/07/20 00:00:00+00,3499    0807,N,Y,0042,,,1042.98127410894,43312.5334408534
3879404,2009/03/26 00:00:00+00,1988/06/21 00:00:00+00,SEE CONDO BOOK 37 PAGE 8 (CONDOS 2322 - 2339) KILLED TAX LOT 808 ON 6/21/1988.,,2,3499,,0808,2,22024,,,,,,,,,,,22021,,,,,,,,3735,*,1,37,8,1988/06/21 00:00:00+00,3499    0808,N,Y,3020,,,244.084046495113,3386.19083395386
3879405,2009/12/30 00:00:00+00,1977/01/04 00:00:00+00,SEE CONDO BOOK 21 PAGE 16 (CONDOS 2130 - 2205) KILLED TAX LOT 842 ON 9/28/2008.,,2,2567,,0842,2,59250,,,,,,,,,,,55369,,,,,,,,3641,M,1,21,16,1979/02/09 00:00:00+00,2567    0842,N,Y,1210,,,476.074121686944,9107.14792793959
3879406,2009/03/26 00:00:00+00,1988/08/11 00:00:00+00,SEE CONDO BOOK 37 PAGE 34 (CONDOS 2340 - 2349) KILLED TAX LOT 810 ON 8/11/1988.,,2,3499,,0810,2,20582,,,,,,,,,,,20582,,,,,,,,3735,A,1,37,34,1988/08/11 00:00:00+00,3499    0810,N,Y,3020,,,278.130147062885,3164.46834051878
3879407,2006/09/09 00:00:00+00,,SEE CONDO BOOK 68 PAGE 43 (CONDOS 2110 - 2126) KILLED TAX LOT 868,,2,2660,,0868,2,6969,,,,,,,,,,,6941,1,,,,,,,1330,*,1,70,39,2009/08/03 00:00:00+00,2660    0868,N,Y,1328,,,146.948401972595,1071.10142707189
3879408,2010/05/10 00:00:00+00,1972/02/09 00:00:00+00,"SEE CONDO BOOK 1 PAGE 14 (CONDOS 2001 - 2075, 2078 - 2083, 2086 - 2096, 2099 - 2260) KILLED TAX LOT 814 ON 10/2/1973.",,2,1601,,0814,2,62326,,,,,,,,,,,62249,,,,,,,,3597,M,1,1,14,1973/10/02 00:00:00+00,1601    0814,N,Y,2421,,,430.262982465212,9583.38343378104
3879409,2009/12/30 00:00:00+00,1977/01/04 00:00:00+00,SEE CONDO BOOK 20 PAGE 22 (CONDOS 2046 - 2108) KILLED TAX LOT 840 ON 9/28/2008.,,2,2567,,0840,2,61139,,,,,,,,,,,61146,,,,,,,,3641,M,1,20,22,1977/08/24 00:00:00+00,2567    0840,N,Y,1210,,,578.76945202828,9397.48379380096
3879410,2009/12/30 00:00:00+00,1978/01/27 00:00:00+00,SEE CONDO BOOK 20 PAGE 40 (CONDOS 2109 - 2129) KILLED TAX LOT 844 ON 9/28/2008.,,2,2567,,0844,2,26091,,,,,,,,,,,24600,,,,,,,,3642,Q,1,20,40,1978/02/15 00:00:00+00,2567    0844,N,Y,1210,,,275.343000218926,4010.39064202128
3879411,2006/09/09 00:00:00+00,,SEE CONDO BOOK 66 PAGE 45 (CONDOS 2069 & 2070) KILLED AIR RIGHTS LOTS (7015 - 7021) AND TAX LOT 883 ON 9/30/2008.,,2,0456,,0883,2,21244,,,,,,,,,,,,1,,,,,,,3813,Q,1,66,45,2008/09/30 00:00:00+00,0456    0883,N,Y,1960,,,243.542806079686,3263.34016211424
3879412,2008/09/16 00:00:00+00,2007/04/18 00:00:00+00,"SEE CONDO BOOK 69, PAGE 25 (CONDOS 3224 - 3226) KILLED TAX LOTS (861 & 862) ON 10/23/2008.",,2,0515,,0861,2,7401,,,,,,,,,,,7400,,,,,,,,3828,V,1,69,25,2008/10/23 00:00:00+00,0515    0861,N,Y,2876,,,147.903295139642,1136.99933906591
3879413,2006/09/09 00:00:00+00,,SEE CONDO BOOK 51 PAGE 20 (CONDOS 2001 - 2014) KILLED TAX LOT 817 ON 11/16/2004.,,2,5084,,0817,2,15412,,,,,,,,,,,15412,1,,,,,,,3565,x,1,51,20,2004/11/16 00:00:00+00,5084    0817,N,Y,3069,,,209.494140774347,2367.07517221078
3879414,2009/12/30 00:00:00+00,1978/01/27 00:00:00+00,SEE CONDO BOOK 21 PAGE 31 (CONDOS 2206 - 2247) KILLED TAX LOT 845 ON 9/28/2008.,,2,2567,,0845,2,33514,,,,,,,,,,,35577,,,,,,,,3642,Q,1,21,31,2009/02/27 00:00:00+00,2567    0845,N,Y,1210,,,453.731897645462,5151.47955748927
3879415,2009/03/26 00:00:00+00,1988/12/16 00:00:00+00,SEE CONDO BOOK 37 PAGE 41 (CONDOS 2350 - 2358) KILLED TAX LOT 812 ON 12/16/1988.,,2,3499,,0812,2,12524,,,,,,,,,,,17257,,,,,,,,3737,P,1,37,41,1988/12/16 00:00:00+00,3499    0812,N,Y,3020,,,181.371848752998,1925.44302130522
3879416,2006/09/09 00:00:00+00,,SEE CONDO BOOK 62 PAGE 41 (CONDOS 2015 - 2035) KILLED TAX LOT 803 ON 3/29/2007.,,2,3638,,0803,2,7475,,,,,,,,,,,7475,1,,,,,,,3741,W,1,62,41,2007/03/29 00:00:00+00,3638    0803,N,Y,3131,,,141.071699998141,1149.14652339271
3879417,2006/09/09 00:00:00+00,,SEE CONDO BOOK 53 PAGE 18 (CONDOS 2015 - 2028) KILLED TAX LOT 818 ON 4/22/2005.,,2,5084,,0818,2,21110,,,,,,,,,,,21110,1,,,,,,,3565,x,1,53,18,2005/04/22 00:00:00+00,5084    0818,N,Y,3069,,,296.317556949046,3242.12713489184
3879418,2006/09/09 00:00:00+00,,SEE CONDO BOOK 54 PAGE 8 (CONDOS 2029 - 2042) KILLED TAX LOT 819 ON 7/1/2005.,,2,5084,,0819,2,14517,,,,,,,,,,,14517,1,,,,,,,3565,x,1,54,8,2005/07/01 00:00:00+00,5084    0819,N,Y,3069,,,202.087062442431,2229.64113312168
3879419,2006/09/09 00:00:00+00,,SEE CONDO BOOK 56 PAGE 8 (CONDOS 2001 - 2036) KILLED TAX LOT 809 ON 2/15/2006.,,2,5579,,0809,2,16899,,,,,,,,,,,16894,1,,,,,,,2409,*,1,56,8,2006/02/15 00:00:00+00,5579    0809,N,Y,1692,,,230.240852670699,2594.07042285933
3879420,2006/09/09 00:00:00+00,,SEE CONDO BOOK 60 PAGE 2 (CONDOS 2001 - 2077) KILLED TAX LOT 824 ON 8/16/2006.,,2,5844,,0824,2,30721,,,,,,,,,,,31002,1,,,,,,,3500,f,1,60,2,2006/08/16 00:00:00+00,5844    0824,N,Y,1750,,,374.652824980213,4713.42237466025
3879421,2009/04/13 00:00:00+00,,SEE CONDO BOOK 54 PAGE 30 (CONDOS 2001 - 2057) KILLED TAX LOT 806 ON 9/30/2005.,,2,0048,,0806,2,16829,,,,,,,,,,,16824,1,,,,,,,3763,l,1,54,30,2005/09/30 00:00:00+00,0048    0806,N,Y,1650,,,217.316731443395,2586.05023488531
3879422,2006/09/09 00:00:00+00,,"SEE CONDO BOOK 69 PAGE 34 (CONDOS 2438 - 2592) KILLED TAX LOTS 819, 820, & 821 ON 9/18/2008.",,2,0209,,0921,2,3456,,,,,,,,,,,3456,1,,,,,,,3745,m,1,68,42,2008/09/18 00:00:00+00,0209    0921,N,Y,2932,,,103.395507318807,531.097100944868
3879423,2006/09/09 00:00:00+00,,"SEE CONDO BOOK 69 PAGE 34 (CONDOS 2438 - 2592) KILLED TAX LOTS 819, 820, & 821 ON 9/18/2008.",,2,0209,,0919,2,13696,,,,,,,,,,,13697,1,,,,,,,3745,m,1,68,42,2008/09/18 00:00:00+00,0209    0919,N,Y,2932,,,203.952114349157,2104.70924497732
3879424,2006/09/09 00:00:00+00,,"SEE CONDO BOOK 69 PAGE 34 (CONDOS 2438 - 2592) KILLED TAX LOTS 819, 820, & 821 ON 9/18/2008.",,2,0209,,0920,2,9148,,,,,,,,,,,9148,1,,,,,,,3745,m,1,68,42,2008/09/18 00:00:00+00,0209    0920,N,Y,2932,,,153.296510635894,1405.66330128802
3879425,2006/09/09 00:00:00+00,,SEE CONDO BOOK 47 PAGE 7 (CONDOS 2001 - 2003) KILLED TAX LOT 831 ON 3/31/2003.,,2,0486,,0831,2,23843,,,,,,,,,,,23843,1,,,,,,,3804,j,1,47,7,2003/03/31 00:00:00+00,0486    0831,N,Y,3050,,,286.828706337201,3662.87634663637
3879426,2006/09/09 00:00:00+00,,SEE CONDO BOOK 67 PAGE 44 (CONDOS 2045 - 2321) KILLED TAX LOT 802 ON 6/5/2008.,,2,0751,,0802,2,34472,,,,,,,,,,,34472,1,,,,,,,3815,S,1,67,44,2008/06/05 00:00:00+00,0751    0802,N,Y,2930,,,352.665000204098,5295.86288431174
3879427,2006/09/09 00:00:00+00,,SEE CONDO BOOK 43 PAGE 11 (CONDOS 2053 - 2082) KILLED TAX LOTS (800 & 801) ON 8/19/1997.,,2,0778,,0801,2,991,,,,,,,,,,,991,1,,,,,,,,,1,43,11,1997/08/19 00:00:00+00,0778    0801,N,Y,2298,,,51.2839000127593,152.173845702923
3879428,2006/09/09 00:00:00+00,,"SEE CONDO BOOK 47, PAGE 17 (CONDOS 2001 - 2046) KILLED TAX LOT 851 ON 3/18/2004.",,2,1038,,0851,2,25347,,,,,,,,,,,26403,1,,,,,,,3806,w,1,49,17,2004/03/18 00:00:00+00,1038    0851,N,Y,2605,,,271.908388721603,3892.55933159717
3879429,2006/09/09 00:00:00+00,,"SEE CONDO BOOK 67, PAGE 10 (CONDOS 2219 - 2223) KILLED TAX LOT 827 ON 3/31/2008.",,2,0514,,0827,2,1993,,,,,,,,,,,1993,1,,,,,,,,,1,67,10,2008/03/31 00:00:00+00,0514    0827,N,Y,2906,,,82.2065017440973,306.209495632241
3879430,2006/09/09 00:00:00+00,,"SEE CONDO BOOK 66, PAGE 42 (CONDOS 2219 - 2223) KILLED TAX LOT 857 ON 3/27/2008.",,2,0514,,0857,2,2100,,,,,,,,,,,2100,1,,,,,,,2392,*,1,66,42,2008/03/27 00:00:00+00,0514    0857,N,Y,2907,,,94.9862015583924,322.672708444571
3879431,2006/09/09 00:00:00+00,,"SEE CONDO BOOK 45, PAGE 50 (CONDOS 2003 - 2004) KILLED TAX LOT 813",,2,0967,,0813,2,816,,,,,,,,,,,810,1,,,,,,,3799,c,1,45,50,2006/09/09 00:00:00+00,0967    0813,N,Y,2547,,,54.4731001833073,125.366624006141
3879432,2006/09/09 00:00:00+00,,"SEE CONDO BOOK 57, PAGE 14 (CONDOS 2017 - 2020) KILLED TAX LOT 816 ON 3/31/2006.",,2,1086,,0816,2,2488,,,,,,,,,,,2488,1,,,,,,,3793,h,1,57,14,2006/03/31 00:00:00+00,1086    0816,N,Y,2749,,,104.1363022664,382.113225073094
3879433,2006/09/09 00:00:00+00,,"SEE CONDO BOOK 65, PAGE 19 (CONDOS 2029 - 2036) KILLED TAX LOTS 836 & 837 ON 9/29/2007.",,2,1096,,0837,2,2662,,,,,,,,,,,2663,1,,,,,,,3423,n,1,65,19,2007/09/29 00:00:00+00,1096    0837,N,Y,2878,,,86.5441019829517,408.888795840048
3879434,2006/09/09 00:00:00+00,,"SEE CONDO BOOK 65, PAGE 19 (CONDOS 2029 - 2036) KILLED TAX LOTS 836 & 837 ON 9/29/2007.",,2,1096,,0836,2,2931,,,,,,,,,,,2931,1,,,,,,,3423,n,1,65,19,2007/09/29 00:00:00+00,1096    0836,N,Y,2878,,,89.357902046555,450.155471754192
3879435,2006/09/09 00:00:00+00,,"SEE CONDO BOOK 48, PAGE 12 (CONDOS 2002 - 2004) KILLED TAX LOTS 825 & 826 ON 9/24/2003.",,2,1098,,0825,2,2066,,,,,,,,,,,2066,1,,,,,,,3772,w,1,48,12,2003/09/24 00:00:00+00,1098    0825,N,Y,2582,,,93.4497024127516,317.31172986316
3879436,2006/09/09 00:00:00+00,,"SEE CONDO BOOK 48, PAGE 12 (CONDOS 2002 - 2004) KILLED TAX LOTS 825 & 826 ON 9/24/2003.",,2,1098,,0826,2,2066,,,,,,,,,,,2066,1,,,,,,,3772,w,1,48,12,2003/09/24 00:00:00+00,1098    0826,N,Y,2582,,,93.4444023090133,317.289874817915
3879437,2009/04/06 00:00:00+00,,SEE CONDO BOOK 66 PAGE 30 (CONDOS 2252 - 2272) KILLED TAX LOT 862 ON 2/21/2008.,,2,2662,,0862,2,7500,,,,,,,,,,,7500,1,,,,,,,1568,*,1,66,30,2008/02/21 00:00:00+00,2662    0862,N,Y,1915,,,156.987704514562,1152.89974408611
3879438,2006/09/09 00:00:00+00,,SEE CONDO BOOK 53 PAGE 47 (CONDOS 2042 - 2043) KILLED TAX LOT 819 ON 6/22/2005.,,2,0208,,0819,2,1852,,,,,,,,,,,1853,1,,,,,,,3794,k,1,53,47,2005/06/22 00:00:00+00,0208    0819,N,Y,2685,,,89.8936059095894,284.706440547476
3879439,2006/09/09 00:00:00+00,,SEE CONDO BOOK 52 PAGE 4 (CONDOS 2001 - 2002) KILLED TAX LOT 831 ON 1/26/2005.,,2,0858,,0831,2,2200,,,,,,,,,,,2200,1,,,,,,,,,1,52,4,2005/01/26 00:00:00+00,0858    0831,N,Y,2656,,,101.765200076672,337.984922921276
3879440,2006/09/09 00:00:00+00,,SEE CONDO BOOK 52 PAGE 26 (CONDOS 2185 - 2196) KILLED TAX LOT 873 ON 5/24/2005.,,2,2662,,0873,2,7500,,,,,,,,,,,7500,1,,,,,,,,,1,52,26,2005/05/24 00:00:00+00,2662    0873,N,Y,1624,,,156.985172810582,1152.90795015192
3879441,2006/09/09 00:00:00+00,,SEE CONDO BOOK 48 PAGE 17 (CONDOS 2045 - 2077) KILLED TAX LOT 873 ON 9/30/2003.,,2,5871,,0873,2,32887,,,,,,,,,,,31963,1,,,,,,,3810,Y,1,48,17,2003/09/30 00:00:00+00,5871    0873,N,Y,1500,,,357.322086939092,5046.31062169127
3879442,2009/03/17 00:00:00+00,2002/07/08 00:00:00+00,"SEE CONDO BOOK 45, PAGE 28 (CONDOS 2109 - 2319) KILLED TAX LOT 828",,2,2132,,0828,2,38309,,,,,,,,,,,38290,1,,,,,,,3807,H,1,45,28,2001/12/14 00:00:00+00,2132    0828,N,Y,1491,,,312.739767975747,5889.15703222781
3879443,2006/09/09 00:00:00+00,,"SEE CONDO BOOK 62, PAGE 27 (CONDOS 2221 - 2224) KILLED TAX LOT 917",,2,2528,,0917,2,5905,,,,,,,,,,,5905,1,,,,,,,3816,A,1,62,27,2007/03/30 00:00:00+00,2528    0917,N,Y,1843,,,162.062311231956,907.584665774146
3879444,2006/09/09 00:00:00+00,,"SEE CONDO BOOK 47, PAGE 11 (CONDOS 2025 - 2032) KILLED TAX LOT 813 ON 3/31/2003.",,2,2532,,0813,2,4250,,,,,,,,,,,4250,1,,,,,,,3810,P,1,47,11,2003/03/31 00:00:00+00,2532    0813,N,Y,1514,,,105.904014282966,653.169825118337
3879445,2006/09/09 00:00:00+00,,"SEE CONDO BOOK 46, PAGE 36 (CONDOS 2057 - 2060) KILLED TAX LOT 810.",,2,2549,,0810,2,2423,,,,,,,,,,,2422,1,,,,,,,66,*,1,46,36,2002/12/05 00:00:00+00,2549    0810,N,Y,1533,,,110.831462633939,372.406682936711
3879446,2009/03/18 00:00:00+00,,"SEE CONDO BOOK 37, PAGE 44 (CONDOS 2016 - 2020) KILLED TAX LOT 885 ON 6/15/1988.",,2,2560,,0885,2,4417,,,,,,,,,,,4416,1,,,,,,,3734,R,1,37,44,1988/06/15 00:00:00+00,2560    0885,N,Y,1202,,,130.939744738259,678.984053160513
3879447,2009/03/18 00:00:00+00,,"SEE CONDO BOOK 37, PAGE 5 (CONDOS 2001 - 2015) KILLED TAX LOT 884 ON 6/15/1988.",,2,2560,,0884,2,183,,,,,,,,,,,182,1,,,,,,,3734,R,1,37,5,1988/06/15 00:00:00+00,2560    0884,N,Y,1201,,,27.5873012960759,28.0860204130285
3879448,2006/09/09 00:00:00+00,,"SEE CONDO BOOK 61, PAGE 23 (CONDOS 2001 - 2017) KILLED TAX LOT 837.",,2,2595,,0837,2,5589,,,,,,,,,,,5603,1,,,,,,,2414,*,1,61,23,2006/12/18 00:00:00+00,2595    0837,N,Y,1795,,,154.522847129355,859.340149524868
3879449,2006/09/09 00:00:00+00,,"SEE CONDO BOOK 46, PAGE 8 (CONDOS 2015 - 2018) KILLED TAX LOT 886.",,2,2660,,0886,2,4930,,,,,,,,,,,4646,1,,,,,,,3808,P,1,46,8,2002/07/02 00:00:00+00,2660    0886,N,Y,1503,,,171.874100106398,757.77874419645
3879450,2006/09/09 00:00:00+00,,"SEE CONDO BOOK 47, PAGE 19 (CONDOS 2019 - 2023) KILLED TAX LOTS 887 & 888 ON 4/16/2003.",,2,2660,,0887,2,3369,,,,,,,,,,,3370,1,,,,,,,3808,P,1,47,19,2003/04/16 00:00:00+00,2660    0887,N,Y,1503,,,92.0308726419679,517.86326476156
3879451,2006/09/09 00:00:00+00,,"DELIVERY 15 - TAX LOT KILLED BY CONDO BOOK 47, PAGE 19 (CONDOS 2019 - 2023) AND INTO LCE ONLY ON 4/16/2003.",,2,2660,,0888,2,928,,,,,,,,,,,967,1,,,,,,,3808,P,1,47,19,2003/04/16 00:00:00+00,2660    0888,N,Y,1503,,,80.3089601935147,142.610612890108
3879452,2009/03/19 00:00:00+00,,"SEE CONDO BOOK 44, PAGE 29 (CONDOS 2055 - 2100) KILLED TAX LOT 823 ON 9/29/2000.",,2,2662,,0823,2,7500,,,,,,,,,,,7500,1,,,,,,,80,*,1,44,29,2000/09/29 00:00:00+00,2662    0823,N,Y,1311,,,156.984296596833,1152.86721846858
3879453,2006/09/09 00:00:00+00,,"SEE CONDO BOOK 47, PAGE 23 (CONDOS 2141 - 2170) KILLED TAX LOT 824 ON 5/2/2003.",,2,2662,,0824,2,7500,,,,,,,,,,,7500,1,,,,,,,80,*,1,47,3,2003/05/02 00:00:00+00,2662    0824,N,Y,1517,,,156.98682900066,1152.91783373193
3879454,2006/09/09 00:00:00+00,,"SEE CONDO BOOK 53, PAGE 28 (CONDOS 2001 - 2010) KILLED TAX LOT 802 ON 5/19/2005.",,2,2699,,0802,2,3633,,,,,,,,,,,3630,1,,,,,,,1568,*,1,53,28,2005/05/19 00:00:00+00,2699    0802,N,Y,3078,,,119.458039146266,558.831918156304
3879455,2006/09/09 00:00:00+00,,"SEE CONDO BOOK 54, PAGE 15 (CONDOS 2011 - 2026) KILLED TAX LOT 804 ON 7/27/2005.",,2,2699,,0804,2,6651,,,,,,,,,,,6651,1,,,,,,,3819,K,1,24,15,2005/07/27 00:00:00+00,2699    0804,N,Y,3079,,,128.673108609908,1022.98766219462
3879456,2009/03/20 00:00:00+00,1920/07/21 00:00:01+00,"SEE CONDO BOOK 60, PAGE 23 (CONDOS 2005 - 2021) KILLED TAX LOT 847 ON 12/20/2006.",,2,2831,,0847,2,2574,,,,,,,,,,,2576,1,,,,,,,1022,*,1,60,23,2006/12/20 00:00:00+00,2831    0847,N,Y,1811,,,94.0063603737491,395.752256002693
3879457,2006/09/09 00:00:00+00,,"SEE CONDO BOOK 53, PAGE 41 (CONDOS 2001 - 2048) KILLED TAX LOTS (807, 811, 817, 818, & 829) ON 8/17/2005.",,2,2865,,0811,2,450,,,,,,,,,,,450,1,,,,,,,688,*,1,53,41,2005/08/17 00:00:00+00,2865    0811,N,Y,1641,,,35.3110017756276,69.1759624845545
3879458,2008/04/29 00:00:00+00,2007/04/25 00:00:00+00,"SEE CONDO BOOK 63 PAGE 12 (CONDOS 2001 - 2247) KILLED TAX LOTS (842 - 845) & AIR RIGHTS LOTS (7000, 7001, 7004 - 7007, & 7009) ON 8/21/2007.",,2,1045,,0844,2,969,,,,,,,,,,,969,,,,,,,,3830,M,1,63,12,2007/08/21 00:00:00+00,1045    0844,N,Y,2860,,,49.0040422523599,148.764237036169
3879459,2007/08/29 00:00:00+00,2003/12/12 00:00:00+00,"SEE CONDO BOOK 51, PAGE 15 (CONDOS 2111 - 2199) KILLED TAX LOT 828 ON 11/22/2004.",,2,0341,,0828,2,15952,,,,,,,,,,,15918,,,,,,,,3811,Y,1,51,15,2004/11/22 00:00:00+00,0341    0828,N,Y,2648,,,240.173869001492,2450.88957247404
3879460,2006/09/09 00:00:00+00,,PILOT - SEE CONDO BOOK 74 PAGE 44 (CONDOS 2032-2044) KILLED TAX LOT 826 ON 6/15/2011.,,2,2831,,0826,2,5431,,,,,,,,,,,5431,1,,,,,,,1108,*,1,74,44,2011/06/15 00:00:00+00,2831    0826,N,Y,1413,,,127.202067909605,835.16846078872
3879461,2011/10/26 00:00:00+00,2011/10/25 00:00:00+00,SEE CONDO BOOK 75 PAGE 24 (CONDOS 2001-2028) KILLED AIR RIGHTS LOT (7000) AND TAX LOT 822 ON 9/30/2011.,,2,2840,,0822,2,4992,,,,,,,,,,,4992,,,,,,,,3853,Y,1,75,24,2011/09/30 00:00:00+00,2840    0822,N,Y,1429,,,199.949804654504,767.539487657571
3879462,2006/09/09 00:00:00+00,,SEE CONDO BOOK 68 PAGE 40 (CONDOS 2001 - 2006) KILLED TAX LOT 801 ON 9/17/2008.,,2,1089,,0801,2,3088,,,,,,,,,,,3087,1,,,,,,,3799,D,1,68,40,2008/09/17 00:00:00+00,1089    0801,N,Y,2940,,,107.343601663976,474.115458253773
3879463,2006/09/09 00:00:00+00,,SEE CONDO BOOK 35 PAGE 17 (CONDOS 2001 - 2078) KILLED TAX LOTS 818 & 819 ON 6/11/1986.,,2,1173,,0819,2,94,,,,,,,,,,,94,1,,,,,,,,,1,35,17,1986/06/11 00:00:00+00,1173    0819,N,Y,2380,,,17.3635063449607,14.4697838117477
3879464,2006/09/09 00:00:00+00,,SEE CONDO BOOK 35 PAGE 17 (CONDOS 2001 - 2078) KILLED TAX LOTS 818 & 819 ON 6/11/1986.,,2,1173,,0818,2,336,,,,,,,,,,,336,1,,,,,,,,,1,35,17,1986/06/11 00:00:00+00,1173    0818,N,Y,2380,,,28.8276089103054,51.5908335901419
3879465,2006/09/09 00:00:00+00,,SEE CONDO BOOK 33 PAGE 4 (CONDOS 2330 - 2355) KILLED TAX LOT 811 ON 10/28/1983.,,2,1187,,0811,2,5604,,,,,,,,,,,5303,1,,,,,,,,,1,33,4,1983/10/28 00:00:00+00,1187    0811,N,Y,2382,,,141.310104206281,861.047828463616
3879466,2009/03/30 00:00:00+00,1981/07/07 00:00:00+00,SEE CONDO BOOK 27 PAGE 10 (CONDOS 2340 - 2049) KILLED TAX LOT 804 ON 9/22/1981.,,2,4325,,0804,2,20921,,,,,,,,,,,20874,,,,,,,,3675,Q,1,27,10,1981/09/22 00:00:00+00,4325    0804,N,Y,3031,,,235.75937804401,3216.53467862466
3879467,2006/09/09 00:00:00+00,,SEE CONDO BOOK 37 PAGE 31 (CONDOS 2173 - 2196) KILLED TAX LOT 806.,,2,1057,,0806,2,17495,,,,,,,,,,,17249,1,,,,,,,A.O,,1,37,31,1988/06/29 00:00:00+00,1057    0806,N,Y,2645,,,318.236989927191,2687.05155174046
3879468,2009/06/26 00:00:00+00,,SEE CONDO BOOK 29 PAGE 44 (CONDOS 2001 - 2048) KILLED TAX LOT 804 ON 2/26/1982.,,2,1057,,0804,2,37031,,,,,,,,,,,,,,,,,,,A.O,,1,29,44,1982/02/26 00:00:00+00,1057    0804,N,Y,2645,,,374.919205606814,5687.42713352369
3879469,2006/09/09 00:00:00+00,,SEE CONDO BOOK 47 PAGE 4 (CONDOS 2023 - 2044) KILLED TAX LOT 872,,2,5871,,0872,2,37232,,,,,,,,,,,38171,1,,,,,,,3810,Y,1,47,14,2003/03/31 00:00:00+00,5871    0872,N,Y,1500,,,383.96438771094,5713.09349994675
3879470,2006/09/09 00:00:00+00,,SEE CONDO BOOK 46 PAGE 9 (CONDOS 2001 - 2022) KILLED TAX LOT 871,,2,5871,,0871,2,34244,,,,,,,,,,,34229,1,,,,,,,3810,Y,1,46,9,2002/08/01 00:00:00+00,5871    0871,N,Y,1500,,,328.723530478567,5254.50671740302
3879471,2008/04/29 00:00:00+00,2007/04/25 00:00:00+00,"SEE CONDO BOOK 63 PAGE 12 (CONDOS 2001 - 2247) KILLED TAX LOTS (842 - 845) & AIR RIGHTS LOTS (7000, 7001, 7004 - 7007, & 7009) ON 8/21/2007.",,2,1045,,0842,2,82770,,,,,,,,,,,82521,,,,,,,,3830,M,1,63,12,2007/08/21 00:00:00+00,1045    0842,N,Y,2860,,,568.383301920612,12708.6018486685
3879472,2010/06/22 00:00:00+00,2005/03/28 00:00:00+00,SEE CONDO BOOK 55 PAGE 14 (CONDOS 2021 - 2022) KILLED TAX LOT 818 ON 10/26/2005.,,2,2837,,0818,2,956,,,,,,,,,,,950,,,,,,,,3818,O,1,55,14,2005/10/26 00:00:00+00,2837    0818,N,Y,1664,,,53.2130237929569,147.036303793427
3879473,2010/06/22 00:00:00+00,2005/03/28 00:00:00+00,SEE CONDO BOOK 55 PAGE 14 (CONDOS 2019 - 2020) KILLED TAX LOT 819 ON 10/26/2005.,,2,2837,,0819,2,957,,,,,,,,,,,950,,,,,,,,3818,O,1,55,14,2005/10/26 00:00:00+00,2837    0819,N,Y,1664,,,53.2376235009195,147.135041899066
3879474,2010/06/22 00:00:00+00,2005/03/28 00:00:00+00,SEE CONDO BOOK 55 PAGE 14 (CONDOS 2017 - 2018) KILLED TAX LOT 820 ON 10/26/2005.,,2,2837,,0820,2,958,,,,,,,,,,,950,,,,,,,,3818,O,1,55,14,2005/10/26 00:00:00+00,2837    0820,N,Y,1664,,,53.2629157189373,147.234302918482
3879475,2006/09/09 00:00:00+00,,"DELIVERY 11 - SEE CONDO BOOK 76, PAGE 16 (CONDOS 2001 - 2017) KILLED TAX LOT 800 ON 3/12/2012.",,2,3391,,0800,2,8736,,,,,,,,,,,8737,1,,,,,,,,,1,76,16,2012/03/12 00:00:00+00,3391    0800,N,Y,3194,,,153.576488080677,1344.22075989435
3879476,2011/09/21 00:00:00+00,2011/09/19 00:00:00+00,SEE CONDO BOOK 74 PAGE 29 (CONDOS 2001 - 2003) KILLED TAX LOT (850) AND AIR RIGHTS LOT (7000) ON 10/21/2011.,,2,3559,,0850,2,2853,,,,,,,,,,,2853,,,,,,,,3853,L,1,75,29,2011/10/21 00:00:00+00,3559    0850,N,Y,3192,,,111.279178864235,438.554377503152
3879477,2006/09/09 00:00:00+00,,"SEE CONDO BOOK 67, PAGE 47 (CONDOS 2040 - 2049) KILLED TAX LOT 863 ON 2/28/2008.",,2,0514,,0863,2,3794,,,,,,,,,,,3795,1,,,,,,,3758,r,1,67,47,2006/06/14 00:00:00+00,0514    0863,N,Y,2810,,,118.085410539985,583.024202901364
3879478,2010/05/17 00:00:00+00,1984/09/28 00:00:00+00,SEE CONDO BOOK 35 PAGE 38 (CONDOS 2001 - 2040) KILLED TAX LOT 800 ON 6/9/1986.,,2,1819,,0800,2,33752,,,,,,,,,,,32031,,,,,,,,3709,E,1,35,38,1986/06/09 00:00:00+00,1819    0800,N,Y,1657,,,380.811971477433,5190.50539702968
3879479,2006/09/09 00:00:00+00,,"SEE CONDO BOOK 56, PAGE 44 (CONDOS 2089 - 2108) KILLED TAX LOT 809 ON 1/31/2006.",,2,0133,,0809,2,6000,,,,,,,,,,,6000,1,,,,,,,,,1,56,44,2006/01/31 00:00:00+00,0133    0809,N,Y,2732,,,133.177414151418,922.107449214042
3879480,2007/09/14 00:00:00+00,2002/08/26 00:00:00+00,"SEE CONDO BOOK 50, PAGE 16 (CONDOS 2074 - 2126) KILLED TAX LOT 928 ON 8/25/2004.",,2,0209,,0928,2,12015,,,,,,,,,,,11975,,,,,,,,3810,C,1,50,16,2004/08/25 00:00:00+00,0209    0928,N,Y,2636,,,176.302611419988,1846.30844344893
3879481,2007/09/14 00:00:00+00,2006/01/06 00:00:00+00,"SEE CONDO BOOK 57, PAGE 31 (CONDOS 2310 - 2380) KILLED TAX LOT 931 ON 3/31/2006.",,2,0209,,0931,2,12600,,,,,,,,,,,12600,,,,,,,,3823,I,1,57,31,2006/03/31 00:00:00+00,0209    0931,N,Y,2761,,,180.244011365531,1936.24093425399
3879482,2007/09/14 00:00:00+00,2006/01/06 00:00:00+00,"SEE CONDO BOOK 58, PAGE 7 (CONDOS 2381 - 2437) KILLED TAX LOT 932 ON 6/22/2006.",,2,0209,,0932,2,10115,,,,,,,,,,,10115,,,,,,,,3823,I,1,58,7,2006/06/22 00:00:00+00,0209    0932,N,Y,2794,,,195.955411975291,1554.32216404031
3879483,2006/09/09 00:00:00+00,,"SEE CONDO BOOK 51, PAGE 46 (CONDOS 2366 - 2536) KILLED TAX LOT 932 ON 2/3/2005.",,2,0212,,0853,2,19683,,,,,,,,,,,19683,1,,,,,,,3810,D,1,51,46,2005/02/03 00:00:00+00,0212    0853,N,Y,2674,,,221.94689248517,3024.34012945362
3879484,2007/07/27 00:00:00+00,2005/09/30 00:00:00+00,"SEE CONDO BOOK 64, PAGE 40 (CONDOS 2006 - 2215) KILLED TAX LOT 830 ON 7/20/2007.",,2,0235,,0830,2,43276,,,,,,,,,,,43276,,,,,,,,3823,K,1,64,3,2007/07/20 00:00:00+00,0235    0830,N,Y,2851,,,362.510022315386,6651.82530157474
3879485,2006/09/09 00:00:00+00,,"SEE CONDO BOOK 44, PAGE 47 (CONDOS 2112 - 2151) KILLED TAX LOTS 806 & 807 ON 6/18/2003.",,2,0315,,0807,2,2254,,,,,,,,,,,2254,1,,,,,,,,,1,44,47,2003/06/18 00:00:00+00,0315    0807,N,Y,2578,,,74.5483034506269,346.336943305493
3879486,2007/07/27 00:00:00+00,2005/09/30 00:00:00+00,"SEE CONDO BOOK 64, PAGE 40 (CONDOS 2216 - 2274) KILLED TAX LOT 831 ON 9/28/2007.",,2,0235,,0831,2,33708,,,,,,,,,,,33077,,,,,,,,3823,K,1,64,40,2007/09/28 00:00:00+00,0235    0831,N,Y,2866,,,303.303230008639,5181.03406747148
3879487,2006/09/09 00:00:00+00,,"SEE CONDO BOOK 48, PAGE 41 (CONDOS 2206 - 2283) KILLED TAX LOT 832 ON 12/12/2003.",,2,0281,,0832,2,14186,,,,,,,,,,,14117,1,,,,,,,3404,k,1,48,41,2003/12/12 00:00:00+00,0281    0832,N,Y,2557,,,193.209709918783,2179.81207776747
3879488,2006/09/09 00:00:00+00,,"SEE CONDO BOOK 44, PAGE 47 (CONDOS 2112 - 2151) KILLED TAX LOTS 806 & 807 ON 6/18/2003.",,2,0315,,0806,2,2500,,,,,,,,,,,2500,1,,,,,,,,,1,44,47,2003/06/18 00:00:00+00,0315    0806,N,Y,2578,,,78.3959036376774,384.118262689257
3879489,2007/09/18 00:00:00+00,2005/08/29 00:00:00+00,"SEE CONDO BOOK 53, PAGE 23 (CONDOS 2001 - 2134) KILLED TAX LOT 840 ON 6/10/2005.",,2,0317,,0840,2,12218,,,,,,,,,,,12214,,,,,,,,3820,V,1,53,23,2005/06/10 00:00:00+00,0317    0840,N,Y,3086,,,174.201911026227,1877.19085521783
3879490,2007/09/19 00:00:00+00,2005/03/22 00:00:00+00,"SEE CONDO BOOK 60, PAGE 15 (CONDOS 2064 - 2214) KILLED TAX LOT 855 ON 9/28/2006.",,2,0377,,0855,2,17342,,,,,,,,,,,17350,,,,,,,,3816,F,1,60,15,2006/09/28 00:00:00+00,0377    0855,N,Y,3119,,,210.21380783884,2664.01660940633
3879491,2008/05/08 00:00:00+00,2007/04/05 00:00:00+00,"SEE CONDO BOOK 62, PAGE 17 (CONDOS 2001 - 2107) KILLED TAX LOT 808 ON 2/21/2007.",,2,1663,,0808,2,55071,,,,,,,,,,,55837,,,,,,,,3829,L,1,62,17,2007/02/21 00:00:00+00,1663    0808,N,Y,3127,,,421.365071619709,8474.9489940108
3879492,2006/09/09 00:00:00+00,,"SEE CONDO BOOK 50, PAGE 3 (CONDOS 2001 - 2070) KILLED TAX LOT 836 ON 7/26/2004.",,2,1184,,0836,2,42769,,,,,,,,,,,42749,1,,,,,,,3799,e,1,50,3,2004/07/26 00:00:00+00,1184    0836,N,Y,2624,,,462.36944664499,6571.26103958532
3879493,2008/12/09 00:00:00+00,,"SEE CONDO BOOK 38, PAGEs 5, 43, 45 (CONDOS 2163-2189, 2192, 2194-2199, 2201-2271, 2274-2277) KILLED TAX LOT 917.",,2,1299,,0917,2,26399,,,,,,,,,,,,,,,,,,,,,1,38,5,1989/07/26 00:00:00+00,1299    0917,N,Y,1060,,,300.171958870215,4057.77894803479
3879494,2006/09/09 00:00:00+00,,"SEE CONDO BOOK 37, PAGE 22 (CONDOS 2001 - 2162) KILLED TAX LOT 1025.",,2,1299,,1025,2,40412,,,,,,,,,,,40598,1,,,,,,,,,1,37,22,1988/04/21 00:00:00+00,1299    1025,N,Y,1059,,,420.730883799032,6211.53519773887
3879495,2006/09/09 00:00:00+00,,"SEE CONDO BOOK 46, PAGE 45 (CONDOS 2099 - 2121) KILLED TAX LOT 835 ON 1/3/2003.",,2,1923,,0835,2,10997,,,,,,,,,,,11098,1,,,,,,,,,1,46,45,2003/01/03 00:00:00+00,1923    0835,N,Y,1532,,,185.780186569092,1690.90311812844
3879496,2006/09/09 00:00:00+00,,"SEE CONDO BOOK 46, PAGE 45 (CONDOS 2145 - 2163) KILLED TAX LOT 837 ON 1/3/2003.",,2,1923,,0837,2,10632,,,,,,,,,,,10632,1,,,,,,,,,1,46,45,2003/01/03 00:00:00+00,1923    0837,N,Y,1532,,,182.935127039791,1634.66552863015
3879497,2006/09/09 00:00:00+00,,"SEE CONDO BOOK 46, PAGE 45 (CONDOS 2122 - 2144) KILLED TAX LOT 836 ON 1/3/2003.",,2,1923,,0836,2,10655,,,,,,,,,,,10655,1,,,,,,,,,1,46,45,2003/01/03 00:00:00+00,1923    0836,N,Y,1532,,,183.225977813312,1638.23311105162
3879498,2006/09/09 00:00:00+00,,"SEE CONDO BOOK 46, PAGE 45 (CONDOS 2189 - 2221) KILLED TAX LOT 813 ON 1/3/2003.",,2,1923,,0813,2,8503,,,,,,,,,,,8528,1,,,,,,,925,*,1,46,45,2003/01/03 00:00:00+00,1923    0813,N,Y,1532,,,172.400402715675,1307.31480854111
3879499,2006/09/09 00:00:00+00,,"SEE CONDO BOOK 31, PAGE 45 (CONDOS 2100 - 2205) KILLED TAX LOT 822 ON 7/26/1983.",,2,2535,,0822,2,47233,,,,,,,,,,,,1,,,,,,,,,1,31,45,1983/07/26 00:00:00+00,2535    0822,N,Y,1115,,,348.199094511807,7259.7770592652
3879500,2007/10/02 00:00:00+00,2005/09/16 00:00:00+00,"SEE CONDO BOOK 62, PAGE 9 (CONDOS 2054 - 2214) KILLED TAX LOT 870 ON 3/30/2007.",,2,2848,,0870,2,53482,,,,,,,,,,,53721,,,,,,,,3822,D,1,62,9,2007/03/30 00:00:00+00,2848    0870,N,Y,1848,,,400.028866835975,8222.93423675267
3879501,2006/09/09 00:00:00+00,,"SEE CONDO BOOK 60, PAGE 22 (CONDOS 2001 - 2004) KILLED TAX LOT 805 ON 11/16/2006.",,2,2852,,0805,2,3000,,,,,,,,,,,3000,1,,,,,,,95,*,1,60,22,2006/11/16 00:00:00+00,2852    0805,N,Y,1802,,,113.563570767979,461.245165197277
3879502,2006/09/09 00:00:00+00,,"SEE CONDO BOOK 57, PAGE 21 (CONDOS 2004 - 2010) KILLED TAX LOT 823 ON 8/9/2006.",,2,2855,,0823,2,2634,,,,,,,,,,,2634,1,,,,,,,380,*,1,57,21,2006/08/09 00:00:00+00,2855    0823,N,Y,1767,,,123.799206789684,404.916127909652
3879503,2006/09/09 00:00:00+00,,"SEE CONDO BOOK 53, PAGE 41 (CONDOS 2001 - 2048) KILLED TAX LOTS (807, 811, 817, 818, & 829) ON 8/17/2005.",,2,2865,,0818,2,570,,,,,,,,,,,570,1,,,,,,,752,*,1,53,41,2005/08/17 00:00:00+00,2865    0818,N,Y,1641,,,52.6121026437819,87.6204653173635
3879504,2006/09/09 00:00:00+00,,"SEE CONDO BOOK 53, PAGE 41 (CONDOS 2001 - 2048) KILLED TAX LOTS (807, 811, 817, 818, & 829) ON 8/17/2005.",,2,2865,,0817,2,2280,,,,,,,,,,,2280,1,,,,,,,752,*,1,53,41,2005/08/17 00:00:00+00,2865    0817,N,Y,1641,,,76.0888038474346,350.481978471496
3879505,2006/09/09 00:00:00+00,,"SEE CONDO BOOK 53, PAGE 41 (CONDOS 2001 - 2048) KILLED TAX LOTS (807, 811, 817, 818, & 829) ON 8/17/2005.",,2,2865,,0807,2,450,,,,,,,,,,,450,1,,,,,,,611,*,1,53,41,2005/08/17 00:00:00+00,2865    0807,N,Y,1641,,,35.3112017697757,69.1770416513343
3879506,2006/09/09 00:00:00+00,,"SEE CONDO BOOK 53, PAGE 41 (CONDOS 2001 - 2048) KILLED TAX LOTS (807, 811, 817, 818, & 829) ON 8/17/2005.",,2,2865,,0829,2,7354,,,,,,,,,,,7354,1,,,,,,,1395,*,1,53,41,2005/08/17 00:00:00+00,2865    0829,N,Y,1641,,,154.834268013611,1130.51515787757
3879507,2006/09/09 00:00:00+00,,"SEE CONDO BOOK 51, PAGE 44 (CONDOS 2051 - 2054) KILLED TAX LOT 819 ON 1/18/2005.",,2,2866,,0819,2,4060,,,,,,,,,,,4060,1,,,,,,,80,*,1,51,44,2005/01/18 00:00:00+00,2866    0819,N,Y,1587,,,175.158909645442,624.123055976046
3879508,2006/09/09 00:00:00+00,,"SEE CONDO BOOK 57, PAGE 33 (CONDOS 2003 - 2004) KILLED TAX LOT 815 ON 9/14/2006.",,2,3117,,0815,2,1667,,,,,,,,,,,1667,1,,,,,,,107,*,1,57,33,2006/09/14 00:00:00+00,3117    0815,N,Y,1761,,,91.6113006715999,256.170291845482
3879509,2006/09/09 00:00:00+00,,SEE CONDO BOOK 66 PAGE 38 (CONDOS 2005 - 2008) KILLED TAX LOT 821 ON 2/28/2008.,,2,3260,,0821,2,3288,,,,,,,,,,,3361,1,,,,,,,3680,Q,1,66,38,2008/02/28 00:00:00+00,3260    0821,N,Y,3154,,,127.601388955215,505.848140150402
3879510,2006/09/09 00:00:00+00,,"SEE CONDO BOOK 48, PAGE 3 (CONDOS 2001 - 2492) KILLED TAX LOTS 875 & 876 ON 9/15/2003.",,2,0517,,0875,2,21804,,,,,,,,,,,21799,1,,,,,,,3689,s,1,48,3,2003/09/15 00:00:00+00,0517    0875,N,Y,3053,,,254.514532316134,3349.71150343798
3879511,2006/09/09 00:00:00+00,,"SEE CONDO BOOK 48, PAGE 3 (CONDOS 2001 - 2492) KILLED TAX LOTS 875 & 876 ON 9/15/2003.",,2,0517,,0876,2,22842,,,,,,,,,,,23028,1,,,,,,,3689,s,1,48,3,2003/09/15 00:00:00+00,0517    0876,N,Y,3053,,,235.092963000339,3509.27683258022
3879512,2006/09/09 00:00:00+00,,"SEE CONDO BOOK 51, PAGE 5 (CONDOS 2329 - 2479) KILLED TAX LOT 844 ON 11/22/2004.",,2,0540,,0844,2,62315,,,,,,,,,,,62312,1,,,,,,,3813,S,1,51,5,2004/11/22 00:00:00+00,0540    0844,N,Y,2661,,,451.051607417675,9568.09103880618
3879513,2006/09/09 00:00:00+00,,"SEE CONDO BOOK 52, PAGE 32 (CONDOS 2480 - 2630) KILLED TAX LOT 845",,2,0540,,0845,2,46048,,,,,,,,,,,46049,1,,,,,,,3813,S,1,52,32,2006/09/09 00:00:00+00,0540    0845,N,Y,2661,,,347.426305688939,7070.24276585873
3879514,2006/09/09 00:00:00+00,,"SEE CONDO BOOK 62, PAGE 42 (CONDOS 2631 - 3026) KILLED TAX LOT 842 ON 3/30/2007.",,2,0540,,0842,2,93025,,,,,,,,,,,93028,1,,,,,,,3807,S,1,62,42,2007/03/30 00:00:00+00,0540    0842,N,Y,2838,,,643.512311213561,14283.1668642401
3879515,2010/05/10 00:00:00+00,1978/08/29 00:00:00+00,SEE CONDO BOOK 25 PAGE 4 (CONDOS 3479 - 3502) KILLED TAX LOT 827 ON 7/24/1980.,,2,1601,,0827,2,37070,,,,,,,,,,,37894,,,,,,,,3654,C,1,25,4,1980/07/24 00:00:00+00,1601    0827,N,Y,2422,,,316.257261072327,5700.14015464968
3879516,2008/04/29 00:00:00+00,2007/04/25 00:00:00+00,"SEE CONDO BOOK 63 PAGE 12 (CONDOS 2001 - 2247) KILLED TAX LOTS (842 - 845) & AIR RIGHTS LOTS (7000, 7001, 7004 - 7007, & 7009) ON 8/21/2007.",,2,1045,,0843,2,144,,,,,,,,,,,144,,,,,,,,3830,M,1,63,12,2007/08/21 00:00:00+00,1045    0843,N,Y,2860,,,27.9483305890552,22.1500907314841
3879517,2006/09/09 00:00:00+00,,"SEE CONDO BOOK 37 PAGE 33 (CONDOS 2125 - 2147, & 2172) KILLED TAX LOT 808.",,2,1057,,0808,2,10562,,,,,,,,,,,10563,1,,,,,,,A.O,,1,37,33,1988/06/29 00:00:00+00,1057    0808,N,Y,2645,,,168.048087800404,1622.24797680976
3879518,2009/06/26 00:00:00+00,,SEE CONDO BOOK 31 PAGE 24 (CONDOS 2073 - 2124) KILLED TAX LOT 809 ON 5/19/1983.,,2,1057,,0809,2,42131,,,,,,,,,,,,,,,,,,,A.O,,1,31,24,1982/05/19 00:00:00+00,1057    0809,N,Y,2645,,,415.331505967981,6470.54444093793
3879519,2006/09/09 00:00:00+00,,SEE CONDO BOOK 62 PAGE 36 (CONDOS 2065 - 2067) KILLED TAX LOT 813 ON 3/30/2007.,,2,2696,,0813,2,2550,,,,,,,,,,,2550,1,,,,,,,,,1,24,36,2007/03/30 00:00:00+00,2696    0813,N,Y,1847,,,90.1132058931204,392.198230651746
3879520,2006/09/09 00:00:00+00,,SEE CONDO BOOK 69 PAGE 29 (CONDOS 2022 - 2029) KILLED TAX LOT 828.,,2,2831,,0828,2,4986,,,,,,,,,,,4985,1,,,,,,,978,*,1,69,29,2008/12/01 00:00:00+00,2831    0828,N,Y,1977,,,119.871708628554,766.78490163469
3879521,2006/09/09 00:00:00+00,,SEE CONDO BOOK 69 PAGE 44 (CONDOS 2005 - 2027) KILLED TAX LOT 804.,,2,2832,,0804,2,6501,,,,,,,,,,,6622,1,,,,,,,1282,*,1,69,44,2009/01/09 00:00:00+00,2832    0804,N,Y,1978,,,143.914211940144,999.750382583226
3879522,,,SEE CONDO BOOK 33 PAGE 13 (CONDOS 2128 - 2189) KILLED TAX LOT 859 ON 2/14/1984.,,2,1200,,0859,2,32,,,,,,,,,,,,,,,,,,,,,1,33,13,1984/02/14 00:00:00+00,1200    0859,N,Y,2387,,,9.09859502000136,4.95914742464097
3879523,2010/04/05 00:00:00+00,1984/06/19 00:00:00+00,SEE CONDO BOOK 36 PAGE 1 (CONDOS 2001 - 2035) KILLED TAX LOT 832 ON 9/16/1986.,,2,0873,,0832,2,8269,,,,,,,,,,,8269,,,,,,,,3702,B,1,36,1,1986/09/16 00:00:00+00,0873    0832,N,Y,2336,,,146.488294235066,1269.85538557712
3879524,,,SEE CONDO BOOK 33 PAGE 13 (CONDOS 2190 - 2234) KILLED TAX LOT 860 ON 2/14/1984.,,2,1200,,0860,2,32,,,,,,,,,,,,,,,,,,,,,1,33,13,1984/02/14 00:00:00+00,1200    0860,N,Y,2387,,,9.09859501640387,4.95914742317833
3879525,2010/04/13 00:00:00+00,1982/03/18 00:00:00+00,SEE CONDO BOOK 30 PAGE 9 (CONDOS 2079 - 2127) KILLED TAX LOTS 853 & 854 ON 10/21/1982.,,2,1200,,0854,2,63,,,,,,,,,,,63,,,,,,,,3679,H,1,30,9,1982/10/21 00:00:00+00,1200    0854,N,Y,2387,,,12.5471030171164,9.67994155242481
3879526,2010/04/13 00:00:00+00,1982/03/18 00:00:00+00,SEE CONDO BOOK 30 PAGE 9 (CONDOS 2079 - 2127) KILLED TAX LOTS 853 & 854 ON 10/21/1982.,,2,1200,,0853,2,61,,,,,,,,,,,61,,,,,,,,3679,H,1,30,9,1982/10/21 00:00:00+00,1200    0853,N,Y,2387,,,12.4246050452096,9.3843192604915
3879527,2010/05/10 00:00:00+00,1978/08/29 00:00:00+00,SEE CONDO BOOK 29 PAGE 23A (CONDOS 3551 - 3742) KILLED TAX LOT 828 ON 2/18/1982.,,2,1601,,0828,2,177637,,,,,,,,,,,173393,,,,,,,,3654,C,1,29,23,1982/02/18 00:00:00+00,1601    0828,N,Y,2424,,,746.249130127491,27314.7341596048
3879528,2010/05/12 00:00:00+00,1979/11/28 00:00:00+00,SEE CONDO BOOK 24 PAGE 2 (CONDOS 2337 - 2356) KILLED TAX LOT 1073 ON 4/30/1980.,,2,1601,,1073,2,35700,,,,,,,,,,,37366,,,,,,,,3662,W,1,24,2,1980/04/30 00:00:00+00,1601    1073,N,Y,2422,,,322.838867849158,5489.34175606483
3879529,2006/09/09 00:00:00+00,,"SEE CONDO BOOK 51, PAGE 26 (CONDOS 2151 - 2192) KILLED TAX LOT 841 ON 11/29/2004.",,2,0455,,0841,2,292,,,,,,,,,,,292,1,,,,,,,3813 & 3823,"P & (L,M,N,O,P,&Q)",1,51,26,2004/11/29 00:00:00+00,0455    0841,N,Y,3075,,,35.5739749997691,44.8547254693001
3879530,2006/09/09 00:00:00+00,,"SEE CONDO BOOK 60, PAGE 34 (CONDOS 2001 - 2002) KILLED TAX LOT 825 ON 12/7/2006.",,2,0616,,0825,2,1800,,,,,,,,,,,1800,1,,,,,,,,,1,60,34,2006/12/07 00:00:00+00,0616    0825,N,Y,2821,,,86.3526007297469,276.599547119009
3879531,2006/09/09 00:00:00+00,,"SEE CONDO BOOK 57, PAGE 34 (CONDOS 2001 - 2004) KILLED TAX LOT 801 ON 3/24/2006.",,2,0779,,0801,2,932,,,,,,,,,,,932,1,,,,,,,,,1,57,34,2006/03/24 00:00:00+00,0779    0801,N,Y,2748,,,51.5454000000326,143.147636575619
3879532,2006/09/09 00:00:00+00,,"SEE CONDO BOOK 51, PAGE 26 (CONDOS 2001 - 2150) KILLED TAX LOT 840 ON 11/29/2004.",,2,0455,,0840,2,1805,,,,,,,,,,,1857,1,,,,,,,3813 & 3823,"P & (L,M,N,O,P,&Q)",1,51,26,2004/11/29 00:00:00+00,0455    0840,N,Y,3075,,,98.3484712134783,277.226423369919
3879533,2006/09/09 00:00:00+00,,"SEE CONDO BOOK 51, PAGE 12 (CONDOS 2063 - 2068) KILLED TAX LOT 880 ON 11/22/2004.",,2,0456,,0880,2,59002,,,,,,,,,,,58980,1,,,,,,,3802,v,1,51,12,2004/11/22 00:00:00+00,0456    0880,N,Y,3068,,,431.398812052943,9063.49761594757
3879534,2006/09/09 00:00:00+00,,"SEE CONDO BOOK 48, PAGE 9 (CONDOS 2034 - 2062) KILLED TAX LOT 882 ON 9/30/2003.",,2,0456,,0882,2,9360,,,,,,,,,,,9360,1,,,,,,,3812,*,1,48,9,2003/09/30 00:00:00+00,0456    0882,N,Y,3055,,,172.174004791595,1437.82171163853
3879535,2006/09/09 00:00:00+00,,"SEE CONDO BOOK 51, PAGE 2 (CONDOS 2001 - 2173) KILLED TAX LOT 878 & Air Rights Lot 7004 ON 9/30/2004.",,2,0457,,0878,2,4838,,,,,,,,,,,4862,1,,,,,,,3813 & 3823,"R & (R,S,T,&U)",1,50,29,2004/09/30 00:00:00+00,0457    0878,N,Y,3066,,,209.191446668654,743.074905832383
3879536,2006/09/09 00:00:00+00,,"SEE CONDO BOOK 51, PAGE 3 (CONDOS 2174 - 2428) KILLED TAX LOT 877 & Air Rights Lot 7003 ON 9/30/2004.",,2,0457,,0877,2,23016,,,,,,,,,,,23092,1,,,,,,,3813 & 3823,"R & (R,S,T,&U)",1,51,2,2004/09/30 00:00:00+00,0457    0877,N,Y,3067,,,545.129498083086,3535.43767901465
3879537,2006/09/09 00:00:00+00,,"CANCELLED 7/2/2013 - SEE CONDO BOOK 54, PAGE 5 (CONDOS 2001 - 2004) KILLED TAX LOT 817 ON 7/6/2005.",,2,0480,,0817,2,1767,,,,,,,,,,,1768,1,,,,,,,,,0,54,5,2005/07/06 00:00:00+00,0480    0817,N,Y,2695,,,84.8542019092764,271.587902510638
3879538,2007/10/03 00:00:00+00,2004/12/16 00:00:00+00,"SEE CONDO BOOK 54, PAGE 3 (CONDOS 2001 - 2377) KILLED TAX LOT 837 ON 7/18/2005.",,2,0484,,0837,2,22222,,,,,,,,,,,22218,,,,,,,,3817,Z,1,54,3,2005/07/18 00:00:00+00,0484    0837,N,Y,2714,,,251.593207937559,3413.32643784531
3879539,2010/06/24 00:00:00+00,1917/02/26 00:00:01+00,"COMMERCIAL CONDO 2033 KILLED TAX LOTS (946, 948, 950, 960, 964, 972, 1094 -1098) BY A.O. (73307) ON 2/1/1983.",,2,2875,,0950,2,1357,,,,,,,,,,,1358,1,,,,,,,*,851,1,AO73307,,1983/02/01 00:00:00+00,2875    0950,N,Y,0026,,,90.1583679637655,208.624207634387
3879540,2010/06/24 00:00:00+00,1917/02/26 00:00:01+00,"COMMERCIAL CONDO 2033 KILLED TAX LOTS (946, 948, 950, 960, 964, 972, 1094 -1098) BY A.O. (73307) ON 2/1/1983.",,2,2875,,1096,2,2037,,,,,,,,,,,2037,1,,,,,,,*,851,1,AO73307,,1983/02/01 00:00:00+00,2875    1096,N,Y,0026,,,95.4018493087219,313.058443193324
3879541,2010/06/25 00:00:00+00,,CONDOS (2001 - 2006) KILLED TAX LOT 818 BY OTR OFFICE ORDER ON 4/18/1983.,,2,3276,,0818,2,12442,,,,,,,,,,,,,,,,,,,,,1,Office Order,,1983/04/18 00:00:00+00,3276    0818,N,Y,3018,,,173.388381690282,1915.47931773875
3879542,2010/04/02 00:00:00+00,1982/04/07 00:00:00+00,SEE CONDO BOOK 30 PAGE 24 (CONDOS 2007 - 2030) KILLED TAX LOTS (820 & 821) ON 12/20/1984,,2,0778,,0820,2,5024,,,,,,,,,,,5023,,,,,,,,3678,S,1,30,24,1984/12/20 00:00:00+00,0778    0820,N,Y,2297,,,116.9270999987,771.688034589863
3879543,2010/07/16 00:00:00+00,1991/09/17 00:00:00+00,SEE CONDO BOOK 40 PAGE 11 (CONDOS 5001 - 5105) KILLED TAX LOT 834 ON 8/19/1991.,,2,0408,,0836,2,39986,,,,,,,,,,,38695,,,,,,,,3757,B,1,40,11,1991/08/19 00:00:00+00,0408    0836,N,Y,3036,,,324.080496575446,6141.90488929861
3879544,2006/09/09 00:00:00+00,,SEE CONDO BOOK 100 PAGE 22 (CONDOS 2074 - 2080) KILLED TAX LOT 811 ON 4/25/2018.,,2,2696,,0811,2,2550,,,,,,,,,,,2550,1,,,,,,,3793,q,1,100,22,2018/04/25 00:00:00+00,2696    0811,N,Y,9999,,,90.1130059711585,392.194905210336
3879545,2006/09/09 00:00:00+00,,SEE CONDO BOOK 100 PAGE 21 (CONDOS 2068 - 2073) KILLED TAX LOT 814 ON 4/25/2018.,,2,2696,,0814,2,2550,,,,,,,,,,,2550,1,,,,,,,,,1,100,21,2018/04/25 00:00:00+00,2696    0814,N,Y,9999,,,90.1131059386577,392.197641927652
3879546,2006/09/09 00:00:00+00,,SEE CONDO BOOK 30 PAGE 24 (CONDOS 2007 - 2030) KILLED TAX LOTS (820 & 821) ON 12/20/1984,,2,0778,,0821,2,256,,,,,,,,,,,256,1,,,,,,,3678,S,1,30,24,1984/12/20 00:00:00+00,0778    0821,N,Y,2297,,,44.1750999995309,39.3718590636949
3879547,2006/09/09 00:00:00+00,,SEE CONDO BOOK 109 PAGE 28 (CONDOS 2005 - 2010) KILLED TAX LOT 810 ON 3/31/2020,,2,4062,,0810,2,2944,,,,,,,,,,,2805,1,,,,,,,3680,e,1,109,28,2020/03/31 00:00:00+00,4062    0810,N,Y,9999,,,94.4764341792766,452.283647809666
3879548,2010/05/05 00:00:00+00,,SEE CONDO BOOK 31 PAGE 39 (CONDOS 2139 - 2151 & 2166 - 2175) KILLED TAX LOT 1309 ON 6/6/1984.,,2,1301,,1309,2,18568,,,,,,,,,,,,,,,,,,,3703,R,1,31,39,1984/06/06 00:00:00+00,1301    1309,N,Y,2407,,,369.068066192412,2854.43135911731
3879549,2010/05/05 00:00:00+00,1982/08/09 00:00:00+00,SEE CONDO BOOK 31 PAGE 39 (CONDOS 2152 - 2165) KILLED TAX LOT 859 ON 6/6/1984.,,2,1301,,0959,2,4872,,,,,,,,,,,4872,,,,,,,,3685,B,1,31,39,1984/06/06 00:00:00+00,1301    0959,N,Y,2407,,,111.041400613385,748.971633949755
3879550,2010/05/05 00:00:00+00,1982/08/09 00:00:00+00,SEE CONDO BOOK 31 PAGE 39 (CONDOS 2127 - 2138) KILLED TAX LOT 860 ON 6/6/1984.,,2,1301,,0960,2,5049,,,,,,,,,,,5049,,,,,,,,3685,B,1,31,39,1984/06/06 00:00:00+00,1301    0960,N,Y,2407,,,111.544897093407,776.135280474252
3879551,2010/05/05 00:00:00+00,,SEE CONDO BOOK 30 PAGE 40 (CONDOS 2001 - 2099) KILLED TAX LOT 1308 ON 6/7/1982.,,2,1301,,1308,2,56574,,,,,,,,,,,,,,,,,,,3703,R,1,30,40,1982/12/10 00:00:00+00,1301    1308,N,Y,2407,,,667.234318185219,8697.09692460021
3879552,2010/05/05 00:00:00+00,,SEE CONDO BOOK 31 PAGE 39 (CONDOS 2100 - 2111) KILLED TAX LOT 1312 ON 6/6/1984.,,2,1301,,1312,2,3079,,,,,,,,,,,,,,,,,,,3703,R,1,31,39,1984/06/06 00:00:00+00,1301    1312,N,Y,2407,,,93.2131688554156,473.357358520696
3879553,2010/05/04 00:00:00+00,1987/06/25 00:00:00+00,SEE CONDO BOOK 36 PAGE 40 (CONDOS 2001 - 2011) KILLED TAX LOT 821,,2,1227,,0821,2,4800,,,,,,,,,,,4800,1,,,,,,,3726,E,1,36,40,1987/04/29 00:00:00+00,1227    0821,N,Y,2391,,,115.947771791815,737.570883487208
3879554,2010/05/24 00:00:00+00,1985/12/14 00:00:00+00,SEE CONDO BOOK 35 PAGE 45 (CONDOS 2147 - 2186) KILLED TAX LOT 806,,2,1821,,0806,2,55408,,,,,,,,,,,55804,,,,,,,,3716,J,1,35,45,1986/08/07 00:00:00+00,1821    0806,N,Y,1657,,,394.535015237474,8520.90694441617
3879555,2010/05/24 00:00:00+00,1985/12/14 00:00:00+00,SEE CONDO BOOK 35 PAGE 45 (CONDOS 2187 - 2220) KILLED TAX LOT 807,,2,1821,,0807,2,20882,,,,,,,,,,,20888,,,,,,,,3716,J,1,35,45,1986/08/07 00:00:00+00,1821    0807,N,Y,1657,,,244.36920338394,3211.34804852073
3879556,2010/05/24 00:00:00+00,1985/12/14 00:00:00+00,SEE CONDO BOOK 35 PAGE 45 (CONDOS 2221 - 2254) KILLED TAX LOT 808,,2,1821,,0808,2,21925,,,,,,,,,,,21930,,,,,,,,3716,J,1,35,45,1986/08/07 00:00:00+00,1821    0808,N,Y,1657,,,241.46185871032,3371.7777872476
3879557,2010/05/24 00:00:00+00,1985/12/14 00:00:00+00,SEE CONDO BOOK 36 PAGE 18 (CONDOS 2255 - 2288) KILLED TAX LOT 809,,2,1821,,0809,2,30252,,,,,,,,,,,29603,,,,,,,,3716,J,1,36,18,1986/12/24 00:00:00+00,1821    0809,N,Y,1657,,,366.454863052831,4652.5137104938
3879558,2008/09/16 00:00:00+00,2007/04/18 00:00:00+00,"SEE CONDO BOOK 69, PAGE 25 (CONDOS 3224 - 3226) KILLED TAX LOTS (861 & 862) ON 10/23/2008.",,2,0515,,0862,2,104260,,,,,,,,,,,107689,,,,,,,,3828,V,1,69,25,2008/10/23 00:00:00+00,0515    0862,N,Y,2876,,,870.617509306516,16018.5643823466
3879559,2008/09/16 00:00:00+00,2007/04/18 00:00:00+00,"SEE CONDO BOOK 64, PAGE 26 (CONDOS 2001 - 2149) KILLED TAX LOT 860 & AIR RIGHTS LOT 7000 ON 9/4/2007.",,2,0515,,0860,2,19779,,,,,,,,,,,19779,,,,,,,,3828,V,1,64,26,2007/09/04 00:00:00+00,0515    0860,N,Y,2875,,,229.399704132391,3038.77200861259
3879560,2008/09/16 00:00:00+00,2007/04/18 00:00:00+00,"SEE CONDO BOOK 66, PAGE 47 (CONDOS 2932 - 3223) KILLED TAX LOTS (863 & 864) AND AIR RIGHTS LOTS (7004, 7005, 7006, 7011) ON 2/28/2008.",,2,0515,,0863,2,2792,,,,,,,,,,,2792,,,,,,,,3828,V,1,66,47,2008/02/28 00:00:00+00,0515    0863,N,Y,2898,,,93.6451016920475,428.881691420185
3879561,2008/09/16 00:00:00+00,2007/04/18 00:00:00+00,"SEE CONDO BOOK 66, PAGE 47 (CONDOS 2932 - 3223) KILLED TAX LOTS (863 & 864) AND AIR RIGHTS LOTS (7004, 7005, 7006, 7011) ON 2/28/2008.",,2,0515,,0864,2,138,,,,,,,,,,,138,,,,,,,,3828,V,1,66,47,2008/02/28 00:00:00+00,0515    0864,N,Y,2898,,,18.5898003489047,21.2297967992979
3879562,2018/12/20 00:00:00+00,2018/10/25 00:00:00+00,"SEE CONDO BOOK 103, PAGE 29 (CONDOS 2040 & 2053) KILLED TAX LOTS (921, 923, 925) AND AIR RIGHTS LOTS (7001& 7004) ON 12/19/2018",,2,2892,,0923,2,10578,,,,,,,,,,,10496,,,,,,,,3879,Y,1,103,29,,2892    0923,N,Y,,,,192.427175518382,1626.55505870947
3879563,2006/09/09 00:00:00+00,,"SEE CONDO BOOK 61, PAGE 37 (CONDOS 2001 - 2002) KILLED TAX LOT 808 ON 12/19/2006.",,2,3087,,0808,2,1078,,,,,,,,,,,1017,1,,,,,,,107,*,1,61,37,2006/12/19 00:00:00+00,3087    0808,N,Y,1805,,,61.0610156423543,165.678031439377
3879564,2006/09/09 00:00:00+00,,DELIVERY 9 - SEE CONDO BOOK 106 PAGE 20 (CONDOS 2161 - 2165) KILLED TAX LOT 817 ON 9/17/2019,,1,2552,,0817,2,2060,,,,,,,,,,,2060,1,,,,,,,3647,J,1,106,20,,2552    0817,N,Y,,,,107.726311836471,316.751508019817
3879565,2006/09/09 00:00:00+00,,"SEE CONDO BOOK 125, PAGE 35 (CONDOS 2053 & 2068) KILLED TAX LOT 867 ON 11/9/2023",,2,3393,,0867,2,5750,,,,,,,,,,,5750,1,,,,,,,3437,u,1,125,35,2023/11/09 00:00:00+00,3393    0867,N,Y,9999,,,123.494400964521,884.743489487409
3879566,2018/12/20 00:00:00+00,2018/10/25 00:00:00+00,"SEE CONDO BOOK 103, PAGE 29 (CONDOS 2040 & 2053) KILLED TAX LOTS (921, 923, 925) AND AIR RIGHTS LOTS (7001& 7004) ON 12/19/2018",,2,2892,,0925,2,366,,,,,,,,,,,368,,,,,,,,3879,Z,1,103,29,,2892    0925,N,Y,,,,45.2066755486316,56.3037001554348
3879567,2012/01/03 00:00:00+00,2011/12/29 00:00:00+00,"SEE CONDO BOOK 103, PAGE 29 (CONDOS 2040 & 2053) KILLED TAX LOTS (921, 923, 925) AND AIR RIGHTS LOTS (7001& 7004) ON 12/19/2018",,2,2892,,0921,2,167,,,,,,,,,,,167,,,,,,,,3854,R,1,103,29,,2892    0921,N,Y,,,,21.9441532604399,25.6947247245273
3879568,2006/09/09 00:00:00+00,,"SEE CONDO BOOK 112, PAGE 32 (CONDOS 2007 & 2008) KILLED TAX LOT 831 ON 9/25/2020",,2,3033,,0831,2,1995,,,,,,,,,,,1995,1,,,,,,,,,1,,,2020/09/25 00:00:00+00,3033    0831,N,Y,,,,94.1980339156668,306.781314098853
3879569,2012/04/19 00:00:00+00,2012/04/17 00:00:00+00,SEE CONDO BOOK 77 PAGE 26 (CONDOS 2001 &2 2002) KILLED TAX LOTS 816 ON 8/31/2012,,2,3044,,0816,2,1800,,,,,,,,,,,1800,,,,,,,,3855,O,1,77,26,2012/08/31 00:00:00+00,3044    0816,N,Y,,,,91.3793274913681,276.800694432543
3879570,2012/11/07 00:00:00+00,2012/11/05 00:00:00+00,"AIR RIGHTS LOTS (7000, 7002, & 7004) AND TAX LOTS (802 & 804)  KILLED BY CONDO BOOK 85, PAGE 22 (CONDOS 2004 - 2127) ON 3/3/2016",,2,1920,N,0804,2,5981,,,,,,,,,,,6008,,,,,,,,3858,G,1,85,22,2016/03/03 00:00:00+00,1920N   0804,N,Y,5253,,,142.153742791546,919.669549388199
3879571,2006/09/09 00:00:00+00,,"SEE CONDO BOOK 105, PAGE 30 (CONDOS 2101 - 2104) KILLED TAX LOT 808 ON 5/3/2019.",,2,2665,,0808,2,2084,,,,,,,,,,,2084,1,,,,,,,3292,O,1,105,30,2019/05/03 00:00:00+00,2665    0808,N,Y,9999,,,111.262506454196,320.304779083862
3879572,2006/09/09 00:00:00+00,,"DELIVERY 15 - SEE CONDO BOOK 80, PAGE 34 (CONDOS 2001 - 2002) KILLED TAX LOT 806 ON 11/21/2013.",,2,3530,,0806,2,1592,,,,,,,,,,,1617,1,,,,,,,118,*,1,80,34,2013/11/21 00:00:00+00,3530    0806,N,Y,5096,,,69.6154387829568,244.619257214399
3879573,2006/09/09 00:00:00+00,,"SEE CONDO BOOK 113, PAGE 14 (CONDOS 2017 - 2023) KILLED TAX LOT 812 ON 9/29/2020",,2,3820,,0812,2,3217,,,,,,,,,,,3217,1,,,,,,,3105,j,0,113,14,2020/09/29 00:00:00+00,3820    0812,N,Y,9999,,,95.2594918639768,494.843407038719
3879574,2006/09/09 00:00:00+00,,"SEE CONDO BOOK 109, PAGE 48 (CONDOS 2013 - 2016) KILLED TAX LOT 804 ON 3/10/2020",,2,3820,,0804,2,2975,,,,,,,,,,,2975,1,,,,,,,3105,j,0,109,48,2020/03/10 00:00:00+00,3820    0804,N,Y,9999,,,94.0545443142581,457.52206151588
3879575,2012/11/07 00:00:00+00,2012/11/05 00:00:00+00,"AIR RIGHTS LOTS (7000, 7002, & 7004) AND TAX LOTS (802 & 804)  KILLED BY CONDO BOOK 85, PAGE 22 (CONDOS 2004 - 2127) ON 3/3/2016",,2,1920,N,0802,2,1693,,,,,,,,,,,1694,,,,,,,,3858,G,1,85,22,2016/03/03 00:00:00+00,1920N   0802,N,Y,5253,,,66.5230917011042,260.366054581157
3879576,2006/09/09 00:00:00+00,,"SEE CONDO BOOK 46, PAGE 45 (CONDOS 2164 - 2188) KILLED TAX LOT 838 ON 1/3/2003.",,2,1923,,0838,2,8557,,,,,,,,,,,8558,1,,,,,,,,,1,46,45,,1923    0838,N,Y,,,,173.245866131313,1315.7792961573
3879577,2007/05/15 00:00:00+00,2003/01/22 00:00:00+00,"SEE CONDO BOOK 50, PAGE 23 (CONDOS 2014 - 2110) KILLED TAX (927) ON 9/7/2004",,2,0341,,0827,2,16837,,,,,,,,,,,16837,,,,,,,,3808,X,1,50,23,2004/09/07 00:00:00+00,0341    0827,N,Y,2634,,,268.684653659824,2588.20703370282
3879578,2006/09/09 00:00:00+00,,PHASE 1,,2,0275,,0808,2,2040,,,,,,,,,,,2040,1,,,,,,,,,1,109,32,2020/03/31 00:00:00+00,0275    0808,N,Y,9999,,,91.8130047706017,313.529627420894
3879579,2019/10/17 00:00:00+00,2019/08/26 00:00:00+00,"SEE CONDO BOOK 108, PAGE 21 (CONDOS 2003 - 2025) KILLED TAX LOT 869 AND AIR RIGHTS LOTS (7005 & 7006, 7009 - 7012) ON 12/16/2019",,2,0858,,0869,2,1197,,,,,,,,,,,1196,,,,,,,,3883,I,1,108,21,2019/12/16 00:00:00+00,0858    0869,N,Y,9999,,,67.1889109351983,183.846451254535
3879580,2006/09/09 00:00:00+00,,"SEE CONDO BOOK 31, PAGE 8 (CONDOS 2001 - 2009) KILLED TAX LOT 808 ON 10/19/1982.",,2,0177,N,0808,2,1217,,,,,,,,,,,,,,,,,,,3688,Z,1,31,8,1982/10/19 00:00:00+00,0177N   0808,N,Y,2167,,,63.3472302916564,187.042591848778
3879581,2006/09/09 00:00:00+00,,"SEE CONDO BOOK 104, PAGE 17 (CONDOS 2044 - 2047) KILLED TAX LOT 801 ON 2/26/2019",,2,0819,,0801,2,1104,,,,,,,,,,,1140,1,,,,,,,,,0,,,2019/02/26 00:00:00+00,0819    0801,N,Y,,,,84.9054000760859,169.485162746236
3879582,2006/09/09 00:00:00+00,,"SEE CONDO BOOK 100, PAGE 24 (CONDOS 2622 - 2625) KILLED TAX LOT 865 ON 8/7/2018",,2,0209,,0865,2,1612,,,,,,,,,,,1612,1,,,,,,,,,1,100,24,2018/08/07 00:00:00+00,0209    0865,N,Y,9999,,,91.176406265932,247.753158029038
3879583,2011/12/15 00:00:00+00,2011/12/14 00:00:00+00,"SEE CONDO BOOK 87, PAGE 36 (COMMERCIAL CONDO 2153 & 2154) KILLED TAX LOTS (833 - 839) ON 9/30/2015",,2,3657,,0838,2,861,,,,,,,,,,,862,,,,,,,,3854,Z,1,87,36,2015/09/30 00:00:00+00,3657    0838,N,Y,3227,,,49.3790739171733,132.463808334774
3879584,2011/12/15 00:00:00+00,2011/12/14 00:00:00+00,"SEE CONDO BOOK 87, PAGE 37 (CONDO 2001 - 2152) KILLED TAX LOT (832) AND AIR RIGHTS LOTS (7000 & 7001) ON 9/30/2015",,2,3657,,0832,2,54134,,,,,,,,,,,55001,,,,,,,,3854,Z,1,87,37,2015/09/30 00:00:00+00,3657    0832,N,Y,3226,,,1222.10806870604,8324.16284240852
3879585,2011/12/15 00:00:00+00,2011/12/14 00:00:00+00,"SEE CONDO BOOK 87, PAGE 36 (COMMERCIAL CONDO 2153 & 2154) KILLED TAX LOTS (833 - 839) ON 9/30/2015",,2,3657,,0839,2,1971,,,,,,,,,,,1971,,,,,,,,3854,Z,1,87,36,2015/09/30 00:00:00+00,3657    0839,N,Y,3227,,,90.9526391527252,303.136109906458
3879586,2011/12/15 00:00:00+00,2011/12/14 00:00:00+00,"SEE CONDO BOOK 87, PAGE 36 (COMMERCIAL CONDO 2153 & 2154) KILLED TAX LOTS (833 - 839) ON 9/30/2015",,2,3657,,0833,2,3623,,,,,,,,,,,3628,,,,,,,,3854,Z,1,87,36,2015/09/30 00:00:00+00,3657    0833,N,Y,3227,,,116.625011530223,557.181688036745
3879587,2006/09/09 00:00:00+00,,"SEE CONDO BOOK 94, PAGE 27 (CONDOS 2015 - 2019) KILLED TAX LOT 829 ON 7/17/2017",,2,4059,,0829,2,2292,,,,,,,,,,,2292,1,,,,,,,1757,*,1,94,27,2017/07/17 00:00:00+00,4059    0829,N,Y,5453,,,80.4149501172203,352.095593738627
3879588,2006/09/09 00:00:00+00,,"SEE CONDO BOOK 88, PAGE 19 (CONDOS 2005 - 2010) KILLED TAX LOT 809 ON 12/10/2015",,2,4062,,0809,2,2911,,,,,,,,,,,2804,1,,,,,,,3680,e,1,88,19,2015/12/10 00:00:00+00,4062    0809,N,Y,5248,,,94.0824625561186,447.149672179493
3879589,2006/09/09 00:00:00+00,,"SEE CONDO BOOK 82, PAGE 37 (CONDOS 2001 - 2004) KILLED TAX LOT 810 ON 10/28/2014",,2,3820,,0810,2,2975,,,,,,,,,,,2975,1,,,,,,,3105,j,1,82,37,2014/10/28 00:00:00+00,3820    0810,N,Y,3209,,,94.0555541171996,457.52968573251
3879590,2006/09/09 00:00:00+00,,"SEE CONDO BOOK 96, PAGE 30 (CONDOS 2029 - 2032) KILLED TAX LOT 815 ON 9/29/2017",,2,4057,,0815,2,2743,,,,,,,,,,,2704,1,,,,,,,3615,v,1,93,30,2017/09/29 00:00:00+00,4057    0815,Y,Y,5580,,,89.9423341069392,421.446651269926
3879591,2006/09/09 00:00:00+00,,"SEE CONDO BOOK 82, PAGE 27 (CONDOS 2004 - 2008) KILLED TAX LOT 811 ON 6/2/2014",,2,4048,,0811,2,1885,,,,,,,,,,,1791,1,,,,,,,3530,o,1,82,27,2014/06/02 00:00:00+00,4048    0811,N,Y,5135,,,71.5757271427769,289.717045103029
3879592,2006/09/09 00:00:00+00,,"SEE CONDO BOOK 96, PAGE 45 (CONDOS 2010 - 2013) KILLED TAX LOT 815 ON 9/6/2017",,2,4076,W,0815,2,3428,,,,,,,,,,,3420,1,,,,,,,3183,J,1,96,48,2017/09/06 00:00:00+00,4076W   0815,N,Y,5601,,,100.557577839509,526.713193461643
3879593,2013/04/10 00:00:00+00,2013/04/09 00:00:00+00,,,2,4376,,0819,2,959,,,,,,,,,,,957,,,,,,,,3859,N,1,90,33,2016/05/13 00:00:00+00,4376    0819,N,Y,5660,,,55.8783046183396,147.469390361527
3879594,2015/01/08 00:00:00+00,2014/12/19 00:00:00+00,"SEE CONDO BOOK 85, PAGE 30 (CONDOS 2015 - 2020) KILLED TAX LOT 806 ON 4/15/2015",,2,4550,,0806,2,5074,,,,,,,,,,,5099,,,,,,,,,,1,85,30,2015/04/15 00:00:00+00,4550    0806,N,Y,4262,,,121.79063106226,779.379787605412
3879595,2015/04/30 00:00:00+00,2015/04/22 00:00:00+00,"SEE CONDO BOOK 85, PAGE 31 (CONDOS 2001 - 2004) KILLED TAX LOT 808 ON 6/2/2015.  LCE LOT",,2,4550,,0808,2,3808,,,,,,,,,,,3808,,,,,,,,,,1,85,31,2015/06/02 00:00:00+00,4550    0808,Y,Y,2486,,,119.960604216826,584.843895305985
3879596,2012/06/19 00:00:00+00,2009/09/23 00:00:00+00,"SEE CONDO BOOK 82, PAGE 12 (CONDOS 2069 - 2103) KILLED TAX LOT 1140 ON 3/31/2014",,2,5869,,1140,2,8497,,,,,,,,,,,9363,,,,,,,,3847,C & D,1,82,12,2014/03/31 00:00:00+00,5869    1140,N,Y,5098,,,168.291670204935,1303.92507843757
3879597,2012/06/19 00:00:00+00,2009/09/23 00:00:00+00,"SEE CONDO BOOK 82, PAGE 11 (CONDOS 2078 - 2089) KILLED TAX LOTS 1138 & 1139 ON 3/31/2014",,2,5869,,1138,2,14807,,,,,,,,,,,14543,,,,,,,,3847,C & D,1,82,11,2014/03/31 00:00:00+00,5869    1138,N,Y,5098,,,530.044697374403,2272.25139650981
3879598,2012/06/19 00:00:00+00,2009/09/23 00:00:00+00,"SEE CONDO BOOK 82, PAGE 11 (CONDOS 2078 - 2089) KILLED TAX LOTS 1138 & 1139 ON 3/31/2014",,2,5869,,1139,2,8094,,,,,,,,,,,8088,,,,,,,,3847,C & D,1,82,11,2014/03/31 00:00:00+00,5869    1139,N,Y,5098,,,161.883260061961,1242.14839181127
3879599,2012/06/19 00:00:00+00,2009/09/23 00:00:00+00,"SEE CONDO BOOK 82, PAGE 10 (CONDOS 2066 - 2077) KILLED TAX LOT 1142 ON 3/31/2014",,2,5869,,1142,2,7997,,,,,,,,,,,7996,,,,,,,,3847,B,1,82,10,2014/03/31 00:00:00+00,5869    1142,N,Y,5098,,,161.900395751726,1227.12046828926
3879600,2014/12/17 00:00:00+00,2014/11/28 00:00:00+00,"SEE CONDO BOOK 87, PAGE 22 (CONDOS 2108 - 2123) KILLED TAX LOTS 1144, 1145, & 1146 ON 9/2/2015",,2,5869,,1146,2,7621,,,,,,,,,,,7621,,,,,,,,,,1,87,22,2015/09/02 00:00:00+00,5869    1146,N,Y,5228,,,160.1235420956,1169.49264718436
3879601,2014/12/17 00:00:00+00,2014/11/28 00:00:00+00,"SEE CONDO BOOK 87, PAGE 22 (CONDOS 2108 - 2123) KILLED TAX LOTS 1144, 1145, & 1146 ON 9/2/2015",,2,5869,,1145,2,7619,,,,,,,,,,,7619,,,,,,,,,,1,87,22,2015/09/02 00:00:00+00,5869    1145,N,Y,5228,,,159.917977188447,1169.10372287572
3879602,2014/12/17 00:00:00+00,2014/11/28 00:00:00+00,"SEE CONDO BOOK 87, PAGE 22 (CONDOS 2108 - 2123) KILLED TAX LOTS 1144, 1145, & 1146 ON 9/2/2015",,2,5869,,1144,2,14661,,,,,,,,,,,14660,,,,,,,,,,1,87,22,2015/09/02 00:00:00+00,5869    1144,N,Y,5228,,,577.247253335473,2249.70047907041
3879603,2006/09/09 00:00:00+00,,"SEE CONDO BOOK 99, PAGE 44 (CONDOS 2039 - 2044) KILLED TAX LOT 801 ON 3/12/2018",,2,0177,,0801,2,2000,,,,,,,,,,,2000,1,,,,,,,,,1,99,44,2018/03/12 00:00:00+00,0177    0801,N,Y,5706,,,93.9606077591768,307.382831670022
3879604,2006/09/09 00:00:00+00,,"SEE CONDO BOOK 98, PAGE 20 (CONDOS 2044 - 2048) KILLED TAX LOT 816 ON 11/30/2017",,2,0202,,0816,2,1284,,,,,,,,,,,1286,1,,,,,,,,,1,98,20,2017/11/30 00:00:00+00,0202    0816,N,Y,5644,,,68.309452530053,197.433988029805
3879605,2018/10/12 00:00:00+00,2014/09/02 00:00:00+00,"SEE CONDO BOOK 99, PAGE 2 (CONDOS 2258 - 2264) KILLED TAX LOT 871 AND AIR RIGHTS LOT 7000 ON 1/17/2018",,2,0514,,0871,2,1869,,,,,,,,,,,1869,,,,,,,,,,1,99,2,2018/01/17 00:00:00+00,0514    0871,N,Y,5663,,,76.3961015714084,287.132126461728
3879606,2018/10/01 00:00:00+00,2018/08/28 00:00:00+00,"SEE CONDO BOOK 101, PAGE 50 CREATED 6 CONDO LOTS AND KILLED TAX LOT 834 ON 9/20/2018",,2,2964,,0834,2,3788,,,,,,,,,,,3788,,,,,,,,,,1,101,50,2018/09/20 00:00:00+00,2964    0834,N,Y,5709,,,97.063403915493,583.170511088083
3879607,2018/10/01 00:00:00+00,2018/08/28 00:00:00+00,"SEE CONDO BOOK 101, PAGE 31 CREATED 21 CONDO LOTS (2025-2051) AND KILLED TAX LOT 835 ON 9/20/2018. 7201-7213 GEORGIA AVE NW",,2,2964,,0835,2,8293,,,,,,,,,,,8293,,,,,,,,,,1,101,31,2018/09/20 00:00:00+00,2964    0835,N,Y,5709,,,158.150521214997,1276.81044731035
3879608,2012/06/19 00:00:00+00,2009/09/23 00:00:00+00,"SEE CONDO BOOK 76, PAGE 48 (CONDOS 2052 & 2065) KILLED TAX LOTS (1141 & 1143) ON 12/4/2012.  A&T PLAT (3847-B) REFERENCED FOR THIS LOT",,2,5869,,1141,2,9137,,,,,,,,,,,9147,,,,,,,,3847,B,1,76,48,2012/12/04 00:00:00+00,5869    1141,N,Y,5002,,,179.365807301484,1402.17137276442
3879609,2013/04/10 00:00:00+00,2013/04/09 00:00:00+00,"SEE CONDO BOOK 98, PAGE 39 (CONDOS 2003 - 2006) KILLED TAX LOTs (820 & 821) ON 5/8/2018",,2,4376,,0821,2,1280,,,,,,,,,,,1275,,,,,,,,3859,N,1,98,39,2018/05/08 00:00:00+00,4376    0821,N,Y,5660,,,60.4902122503603,196.673208076562
3879610,2013/04/10 00:00:00+00,2013/04/09 00:00:00+00,"SEE CONDO BOOK 98, PAGE 39 (CONDOS 2003 - 2006) KILLED TAX LOTs (820 & 821) ON 5/8/2018",,2,4376,,0820,2,959,,,,,,,,,,,957,,,,,,,,3859,N,1,98,39,2018/05/08 00:00:00+00,4376    0820,N,Y,5660,,,55.8787603242148,147.478805128131
3879611,2006/09/09 00:00:00+00,,"SEE CONDO BOOK 96, PAGE 29 (CONDOS 2017 - 2023) KILLED TAX LOT 804 ON 3/15/2018",,2,4445,,0804,2,4094,,,,,,,,,,,4094,1,,,,,,,2285,*,1,96,29,2018/03/15 00:00:00+00,4445    0804,N,Y,5726,,,102.88020344227,629.00193735823
3879612,2012/06/19 00:00:00+00,2009/09/23 00:00:00+00,"SEE CONDO BOOK 76, PAGE 48 (CONDOS 2052 & 2065) KILLED TAX LOTS (1141 & 1143) ON 12/4/2012.  A&T PLAT (3847-B) REFERENCED FOR THIS LOT",,2,5869,,1143,2,17337,,,,,,,,,,,16588,,,,,,,,3847,B,1,76,48,2012/12/04 00:00:00+00,5869    1143,N,Y,5002,,,528.211350064474,2660.54713054355
3879613,2017/09/05 00:00:00+00,2017/03/31 00:00:00+00,"SEE CONDO BOOK 97, PAGE 11 (CONDOS 2126 - 2196) KILLED TAX LOT 864 & AIR RIGHTS LOTS (7022,7029,7030,7031,7032,7034,& 7036) ON 9/26/2017",,2,0037,,0864,2,9469,,,,,,,,,,,9468,,,,,,,,,,1,97,11,2017/09/26 00:00:00+00,0037    0864,N,Y,5616,,,353.730074128237,1454.87188287379
3879614,2020/08/14 00:00:00+00,2020/06/19 00:00:00+00,"CONDO LOTS 2001-2111 KILLED THIS LOT ON 9/3/2021 PER CONDO BOOK 112, PAGE 8",,2,0701,,0879,2,1113,,,,,,,,,,,1113,,,,,,,,3886,R,1,112,8,2021/09/03 00:00:00+00,0701    0879,N,Y,9999,,,58.9773001398025,170.816416608141
3879615,2021/04/14 00:00:00+00,2020/10/06 00:00:00+00,,,2,0399,,0846,2,3696,,,,,,,,,,,3696,,,,,,,,3888,H,1,123,14,2023/11/01 00:00:00+00,0399    0846,N,Y,6659,,,103.850006819786,567.987265976606
3879616,2016/07/08 00:00:00+00,2016/02/04 00:00:00+00,SEE CONDO BOOK 102 PAGE 46 (CONDOS 2004 - 2009) KILLED TAX LOT 823 ON 9/17/2019.,,2,0864,,0823,2,5777,,,,,,,,,,,5681,1,,,,,,,,,0,102,46,2019/09/17 00:00:00+00,0864    0823,N,Y,9999,,,119.474367081695,887.397157991612
3879617,2006/09/09 00:00:00+00,,,,2,3117,,0826,2,1667,,,,,,,,,,,1667,1,,,,,,,107,*,1,,,1998/09/21 00:00:00+00,3117    0826,N,Y,1885,,,91.6113005578023,256.170291127062
3879618,2010/06/23 00:00:00+00,,COMMERCIAL CONDO 2029 KILLED TAX LOTS (800 & 801) BY A.O. (73297) ON 3/1/1982.,,2,2875,,0800,2,1046,,,,,,,,,,,,,,,,,,,*,93,1,AO73297,,1982/03/01 00:00:00+00,2875    0800,N,Y,0026,,,66.6131466020752,160.762777016877
3879619,2010/06/23 00:00:00+00,,COMMERCIAL CONDO 2029 KILLED TAX LOTS (800 & 801) BY A.O. (73297) ON 3/1/1982.,,2,2875,,0801,2,94,,,,,,,,,,,,,,,,,,,*,93,1,AO73297,,1982/03/01 00:00:00+00,2875    0801,N,Y,0026,,,50.8016944438034,14.3795695742576
3879620,2010/06/24 00:00:00+00,1917/02/26 00:00:01+00,"COMMERCIAL CONDO 2033 KILLED TAX LOTS (946, 948, 950, 960, 964, 972, 1094 -1098) BY A.O. (73307) ON 2/1/1983.",,2,2875,,0960,2,2077,,,,,,,,,,,2077,,,,,,,,*,851,1,AO73307,,1983/02/01 00:00:00+00,2875    0960,N,Y,0026,,,96.9668106368326,319.206641857946
3879621,2010/06/24 00:00:00+00,1917/02/26 00:00:01+00,"COMMERCIAL CONDO 2033 KILLED TAX LOTS (946, 948, 950, 960, 964, 972, 1094 -1098) BY A.O. (73307) ON 2/1/1983.",,2,2875,,0972,2,2077,,,,,,,,,,,2077,,,,,,,,*,851,1,AO73307,,1983/02/01 00:00:00+00,2875    0972,N,Y,0026,,,96.9659025572222,319.204588919111
3879622,2010/06/24 00:00:00+00,1917/02/26 00:00:01+00,"COMMERCIAL CONDO 2033 KILLED TAX LOTS (946, 948, 950, 960, 964, 972, 1094 -1098) BY A.O. (73307) ON 2/1/1983.",,2,2875,,1098,2,2077,,,,,,,,,,,2077,,,,,,,,*,851,1,AO73307,,1983/02/01 00:00:00+00,2875    1098,N,Y,0026,,,96.9671100016154,319.209456418876
3879623,2010/06/24 00:00:00+00,1917/02/26 00:00:01+00,"COMMERCIAL CONDO 2033 KILLED TAX LOTS (946, 948, 950, 960, 964, 972, 1094 -1098) BY A.O. (73307) ON 2/1/1983.",,2,2875,,0964,2,2077,,,,,,,,,,,2077,,,,,,,,*,851,1,AO73307,,1983/02/01 00:00:00+00,2875    0964,N,Y,0026,,,96.9657025633897,319.203803223001
3879624,2010/06/24 00:00:00+00,1917/02/26 00:00:01+00,"COMMERCIAL CONDO 2033 KILLED TAX LOTS (946, 948, 950, 960, 964, 972, 1094 -1098) BY A.O. (73307) ON 2/1/1983.",,2,2875,,1095,2,2037,,,,,,,,,,,2037,1,,,,,,,*,851,1,AO73307,,1983/02/01 00:00:00+00,2875    1095,N,Y,0026,,,95.4018654736081,313.058766633231
3879625,2010/06/24 00:00:00+00,1917/02/26 00:00:01+00,"COMMERCIAL CONDO 2033 KILLED TAX LOTS (946, 948, 950, 960, 964, 972, 1094 -1098) BY A.O. (73307) ON 2/1/1983.",,2,2875,,1097,2,2057,,,,,,,,,,,2057,1,,,,,,,*,851,1,AO73307,,1983/02/01 00:00:00+00,2875    1097,N,Y,0026,,,96.223077570822,316.119117415085
3879626,2010/06/24 00:00:00+00,1917/02/26 00:00:01+00,"COMMERCIAL CONDO 2033 KILLED TAX LOTS (946, 948, 950, 960, 964, 972, 1094 -1098) BY A.O. (73307) ON 2/1/1983.",,2,2875,,1094,2,2037,,,,,,,,,,,2037,1,,,,,,,*,851,1,AO73307,,1983/02/01 00:00:00+00,2875    1094,N,Y,0026,,,95.4017499175269,313.058062635723
3879627,2020/08/14 00:00:00+00,2020/06/19 00:00:00+00,"CONDO LOTS 2001-2111 KILLED THIS LOT ON 9/3/2021 PER CONDO BOOK 112, PAGE 8",,2,0701,,0876,2,3573,,,,,,,,,,,3571,,,,,,,,3886,R,1,112,8,2021/09/03 00:00:00+00,0701    0876,N,Y,6116,,,113.300403501944,548.440543569419
3879628,2010/06/24 00:00:00+00,1917/02/26 00:00:01+00,"COMMERCIAL CONDO 2033 KILLED TAX LOTS (946, 948, 950, 960, 964, 972, 1094 -1098) BY A.O. (73307) ON 2/1/1983.",,2,2875,,0946,2,1358,,,,,,,,,,,1359,1,,,,,,,*,851,1,AO73307,,1983/02/01 00:00:00+00,2875    0946,N,Y,0026,,,90.1685665014769,208.806486533722
3879629,2010/06/24 00:00:00+00,1917/02/26 00:00:01+00,"COMMERCIAL CONDO 2033 KILLED TAX LOTS (946, 948, 950, 960, 964, 972, 1094 -1098) BY A.O. (73307) ON 2/1/1983.",,2,2875,,0948,2,1357,,,,,,,,,,,1358,1,,,,,,,*,851,1,AO73307,,1983/02/01 00:00:00+00,2875    0948,N,Y,0026,,,90.1597741971683,208.652091941231
3879630,2006/09/09 00:00:00+00,,"SEE CONDO BOOK 85, PAGE 13 (CONDOS 2011 - 2013) KILLED TAX LOT 838 ON 3/25/2015",,2,2908,,0838,2,2970,,,,,,,,,,,2970,1,,,,,,,,,1,85,13,2015/03/25 00:00:00+00,2908    0838,N,Y,5173,,,96.5639049462374,456.759470075035
3879631,2006/09/09 00:00:00+00,,"SEE CONDO BOOK 85, PAGE 4 (CONDOS 2011 & 2012) KILLED TAX LOT 834 ON 3/23/2015",,2,3117,,0834,2,2001,,,,,,,,,,,2001,1,,,,,,,394,*,1,85,4,2015/03/23 00:00:00+00,3117    0834,N,Y,5172,,,94.0027005052722,307.555596952886
3879632,2008/11/25 00:00:00+00,2008/02/07 00:00:00+00,"SEE CONDO BOOK 88, PAGE 38 (CONDOS 2071 - 2082) KILLED TAX LOT 825 AND AIR RIGHTS LOTS (7000 & 7002) ON 10/19/2016",,2,3153,,0825,2,4563,,,,,,,,,,,4563,,,,,,,,3836,R,1,88,38,2016/10/19 00:00:00+00,3153    0825,N,Y,5510,,,110.320572363065,702.111355706312
3879633,2006/09/09 00:00:00+00,,"SEE CONDO BOOK 83, PAGE 29 (CONDOS 2030 - 2035) KILLED TAX LOTs (815 & 816) ON 9/18/2014",,2,3154,,0816,2,2824,,,,,,,,,,,2824,1,,,,,,,1131,*,1,83,29,2014/09/18 00:00:00+00,3154    0816,N,Y,3213,,,109.853961298051,434.493614358635
3879634,2006/09/09 00:00:00+00,,"SEE CONDO BOOK 83, PAGE 29 (CONDOS 2030 - 2035) KILLED TAX LOTs (815 & 816) ON 9/18/2014",,2,3154,,0815,2,3180,,,,,,,,,,,3181,1,,,,,,,1131,*,0,83,29,2014/09/18 00:00:00+00,3154    0815,N,Y,3213,,,121.078927671149,489.400954396783
3879635,2011/12/06 00:00:00+00,2011/12/06 00:00:00+00,"SEE CONDO BOOK 87, PAGE 32 (COMMERCIAL CONDO 2001) KILLED TAX LOTS (803 & 804) AND AIR RIGHTS LOTS (7004 & 7005) ON 9/30/2015",,2,3655,,0804,2,16297,,,,,,,,,,,16296,,,,,,,,3855,*,1,87,32,2015/09/30 00:00:00+00,3655    0804,N,Y,3225,,,273.437760699453,2505.91790735899
3879636,2011/12/06 00:00:00+00,2011/12/06 00:00:00+00,"SEE CONDO BOOK 87, PAGE 32 (COMMERCIAL CONDO 2001) KILLED TAX LOTS (803 & 804) AND AIR RIGHTS LOTS (7004 & 7005) ON 9/30/2015",,2,3655,,0803,2,14122,,,,,,,,,,,14124,,,,,,,,3855,*,1,87,32,2015/09/30 00:00:00+00,3655    0803,N,Y,3225,,,238.900025744234,2171.52996049137
3879637,2011/12/06 00:00:00+00,2011/12/06 00:00:00+00,"SEE CONDO BOOK 87, PAGE 33 (CONDOS 2002 - 2313) KILLED TAX LOT (802) AND AIR RIGHTS LOTS (7000 - 7003) ON 9/30/2015",,2,3655,,0802,2,106926,,,,,,,,,,,106926,,,,,,,,3855,*,1,87,33,2015/09/30 00:00:00+00,3655    0802,N,Y,3262,,,1121.1526215111,16441.1137677776
3879638,2011/12/15 00:00:00+00,2011/12/14 00:00:00+00,"SEE CONDO BOOK 87, PAGE 36 (COMMERCIAL CONDO 2153 & 2154) KILLED TAX LOTS (833 - 839) ON 9/30/2015",,2,3657,,0836,2,2750,,,,,,,,,,,2750,,,,,,,,3854,Z,1,87,36,2015/09/30 00:00:00+00,3657    0836,N,Y,3227,,,118.986530639062,422.877517291489
3879639,2010/04/19 00:00:00+00,1981/05/12 00:00:00+00,SEE CONDO BOOK 28 PAGE 18 (CONDOS 2001 - 2071) KILLED TAX LOT 833 ON 5/11/1981.,,2,1206,,0833,2,22336,,,,,,,,,,,22318,,,,,,,,3679,I,1,28,18,1981/09/21 00:00:00+00,1206    0833,N,Y,2388,,,306.802455992414,3431.95390478456
3879640,2010/05/24 00:00:00+00,1985/12/14 00:00:00+00,SEE CONDO BOOK 35 PAGE 15 (CONDOS 2025 - 2072) KILLED TAX LOT 803,,2,1821,,0803,2,52434,,,,,,,,,,,52761,,,,,,,,3716,J,1,35,15,1985/12/23 00:00:00+00,1821    0803,N,Y,1657,,,524.045350793162,8063.88851207471
3879641,2010/05/24 00:00:00+00,1985/12/14 00:00:00+00,SEE CONDO BOOK 35 PAGE 45 (CONDOS 2107 - 2146) KILLED TAX LOT 805,,2,1821,,0805,2,34858,,,,,,,,,,,34169,,,,,,,,3716,J,1,35,45,1986/08/07 00:00:00+00,1821    0805,N,Y,1657,,,332.502859705781,5360.73335983458
3879642,2006/09/09 00:00:00+00,,SEE CONDO BOOK 68 PAGE 19 (CONDOS 2005 - 2006) KILLED TAX LOT 836 ON 7/16/2008.,,2,3208,,0836,2,2250,,,,,,,,,,,2250,1,,,,,,,1597,*,1,68,19,2008/07/16 00:00:00+00,3208    0836,N,Y,3163,,,90.1157782482754,346.192576014058
3879643,2010/05/10 00:00:00+00,1978/08/29 00:00:00+00,SEE CONDO BOOK 22 PAGE 29 (CONDOS 2261 - 2336) KILLED TAX LOT 824 ON 6/15/1979.,,2,1601,,0824,2,174102,,,,,,,,,,,175790,,,,,,,,3654,C,1,22,29,1979/06/15 00:00:00+00,1601    0824,N,Y,2422,,,823.900188834817,26770.6538306555
3879644,2010/06/11 00:00:00+00,1986/01/11 00:00:00+00,SEE CONDO BOOK 38 PAGE 8 (CONDOS 2207 - 2276) KILLED TAX LOT 809 ON 3/13/1989.,,2,2208,,0809,2,19502,,,,,,,,,,,19362,,,,,,,,3718,C,1,38,8,1989/03/13 00:00:00+00,2208    0809,N,Y,1089,,,224.98339758935,2998.11610472463
3879645,2010/06/18 00:00:00+00,,"SEE CONDO BOOK 32, PAGE 45 (CONDOS 2029 & 2101) KILLED TAX LOT 822 ON 12/8/1987.",,2,2548,,0822,2,27999,,,,,,,,,,,28000,,,,,,,,3732,B,1,32,45,1987/12/08 00:00:00+00,2548    0822,N,Y,1152,,,283.64394517261,4304.18541326648
3879646,2010/06/18 00:00:00+00,1983/02/01 00:00:00+00,SEE CONDO BOOK 39 PAGE 34 (CONDOS 2102 - 2110) KILLED TAX LOT 819.,,2,2550,,0819,2,6591,,,,,,,,,,,6512,,,,,,,,*,2413,1,39,34,1990/09/18 00:00:00+00,2550    0819,N,Y,1165,,,142.700831442035,1013.15628821429
3879647,2010/06/16 00:00:00+00,1995/11/28 00:00:00+00,SEE CONDO BOOK 42 PAGE 2 (CONDOS 2021 - 2040) KILLED TAX LOT 819 ON 3/10/1995.,,2,2545,,0819,2,10973,,,,,,,,,,,10991,,,,,,,,3780,P,1,42,2,1995/03/10 00:00:00+00,2545    0819,N,Y,1139,,,187.672247446675,1686.68815631681
3879648,2010/06/18 00:00:00+00,,SEE CONDO BOOK 28 PAGE 2 (CONDOS 2079 - 2097) KILLED TAX LOT 805 ON 9/21/1981.,,2,2550,,0805,2,6645,,,,,,,,,,,,,,,,,,,*,66,1,28,2,1981/09/21 00:00:00+00,2550    0805,N,Y,1163,,,143.549716424889,1021.48940863038
3879649,2006/09/09 00:00:00+00,,PHASE 1,,1,0399,,0066,1,15093,,,,,,,,,,,15093,1,,,,,,0,174,41,1,108,7,,0399    0066,Y,Y,9999,,,199.496206672506,2319.11580331602
3879650,2011/12/08 00:00:00+00,2011/12/07 00:00:00+00,"SEE CONDO BOOK 87, PAGE 34 (CONDO 2001) KILLED TAX LOT (802) 9/30/2015",,2,3656,,0802,2,15244,,,,,,,,,,,15477,,,,,,,,3855,A,1,87,34,2015/09/30 00:00:00+00,3656    0802,N,Y,3228,,,471.200715049083,2344.06885562044
3879651,2011/12/08 00:00:00+00,2011/12/07 00:00:00+00,"SEE CONDO BOOK 87, PAGE 35 (CONDO 2002 - 2101) KILLED TAX LOT (801) AND AIR RIGHTS LOTS (7000 - 7001) ON 9/30/2015",,2,3656,,0801,2,16381,,,,,,,,,,,16108,,,,,,,,3855,A,1,87,35,2015/09/30 00:00:00+00,3656    0801,N,Y,3229,,,808.781452556472,2518.76715664991
3879652,2011/12/15 00:00:00+00,2011/12/14 00:00:00+00,"SEE CONDO BOOK 87, PAGE 36 (COMMERCIAL CONDO 2153 & 2154) KILLED TAX LOTS (833 - 839) ON 9/30/2015",,2,3657,,0835,2,5440,,,,,,,,,,,5440,,,,,,,,3854,Z,1,87,36,2015/09/30 00:00:00+00,3657    0835,N,Y,3227,,,190.19960035269,836.492133045339
3879653,2011/12/15 00:00:00+00,2011/12/14 00:00:00+00,"SEE CONDO BOOK 87, PAGE 36 (COMMERCIAL CONDO 2153 & 2154) KILLED TAX LOTS (833 - 839) ON 9/30/2015",,2,3657,,0834,2,2444,,,,,,,,,,,2444,,,,,,,,3854,Z,1,87,36,2015/09/30 00:00:00+00,3657    0834,N,Y,3227,,,97.5014655875343,375.74924064796
3879654,2011/12/15 00:00:00+00,2011/12/14 00:00:00+00,"SEE CONDO BOOK 87, PAGE 36 (COMMERCIAL CONDO 2153 & 2154) KILLED TAX LOTS (833 - 839) ON 9/30/2015",,2,3657,,0837,2,6149,,,,,,,,,,,6149,,,,,,,,3854,Z,1,87,36,2015/09/30 00:00:00+00,3657    0837,N,Y,3227,,,144.905208627688,945.560748904676
3879655,2010/03/01 00:00:00+00,2009/09/28 00:00:00+00,"SEE CONDO BOOK 80, PAGE 20 (CONDOS 2001 - 2106) KILLED TAX (903,905,906,908,910) & AIR RIGHTS LOTS (7035,7050,7052 - 7056,7058,7069) ON 9/26/2013.",,2,0374,,0905,2,2003,,,,,,,,,,,2019,,,,,,,,3847,"I,J,K,&L",1,80,20,2013/09/26 00:00:00+00,0374    0905,N,Y,5029,,,81.5345028835946,307.66381374106
3879656,2006/09/09 00:00:00+00,,SEE CONDO BOOK 112 PAGE 33 (CONDOS 2013 & 2014) KILLED TAX LOT 822 ON 9/21/2020.,,2,0366,,0822,2,1449,,,,,,,,,,,1449,1,,,,,,,2390,*,1,112,33,2020/09/21 00:00:00+00,0366    0822,Y,Y,9999,,,70.6373028065683,222.666890810778
3879657,2010/03/01 00:00:00+00,2009/09/28 00:00:00+00,"SEE CONDO BOOK 80, PAGE 20 (CONDOS 2001 - 2106) KILLED TAX (903,905,906,908,910) & AIR RIGHTS LOTS (7035,7050,7052 - 7056,7058,7069) ON 9/26/2013.",,2,0374,,0903,2,8067,,,,,,,,,,,8077,,,,,,,,3847,"I,J,K,&L",1,80,20,2013/09/26 00:00:00+00,0374    0903,N,Y,5029,,,307.483511126415,1239.33539587642
3879658,2008/09/16 00:00:00+00,2007/04/18 00:00:00+00,"SEE CONDO BOOK 64, PAGE 27 (CONDOS 2150 - 2931) KILLED TAX LOTS (865, 866, 867, 868) AND AIR RIGHTS LOTS (7007, 7008, 7009, 7012, 7013) ON 8/30/2007.",,2,0515,,0865,2,2496,,,,,,,,,,,2495,,,,,,,,3828,V,1,64,27,2007/08/30 00:00:00+00,0515    0865,N,Y,2876,,,99.6285019099877,383.439723514941
3879659,2008/09/16 00:00:00+00,2007/04/18 00:00:00+00,"SEE CONDO BOOK 64, PAGE 27 (CONDOS 2150 - 2931) KILLED TAX LOTS (865, 866, 867, 868) AND AIR RIGHTS LOTS (7007, 7008, 7009, 7012, 7013) ON 8/30/2007.",,2,0515,,0866,2,956,,,,,,,,,,,956,,,,,,,,3828,V,1,64,27,2007/08/30 00:00:00+00,0515    0866,N,Y,2876,,,52.1560009894477,146.841893316183
3879660,2008/09/16 00:00:00+00,2007/04/18 00:00:00+00,"SEE CONDO BOOK 64, PAGE 27 (CONDOS 2150 - 2931) KILLED TAX LOTS (865, 866, 867, 868) AND AIR RIGHTS LOTS (7007, 7008, 7009, 7012, 7013) ON 8/30/2007.",,2,0515,,0868,2,156,,,,,,,,,,,156,,,,,,,,3828,V,1,64,27,2007/08/30 00:00:00+00,0515    0868,N,Y,2876,,,20.6958004696207,23.9758474430575
3879661,2008/09/16 00:00:00+00,2007/04/18 00:00:00+00,"SEE CONDO BOOK 64, PAGE 27 (CONDOS 2150 - 2931) KILLED TAX LOTS (865, 866, 867, 868) AND AIR RIGHTS LOTS (7007, 7008, 7009, 7012, 7013) ON 8/30/2007.",,2,0515,,0867,2,342,,,,,,,,,,,342,,,,,,,,3828,V,1,64,27,2007/08/30 00:00:00+00,0515    0867,N,Y,2876,,,34.6960006634641,52.5587767841488
3879662,2007/07/18 00:00:00+00,2002/01/23 00:00:00+00,SEE CONDO BOOK 39 PAGE 16 (CONDOS 2001 - 2008) KILLED TAX LOT 805.,,2,3576,,0805,2,82499,,,,,,,,,,,,,,,,,,,,,1,39,16,1990/03/30 00:00:00+00,3576    0805,N,Y,4009,,,458.189453389088,12678.115411335
3879663,2006/09/09 00:00:00+00,,SEE CONDO BOOK 56 PAGE 40 (CONDOS 2006 - 2008) KILLED TAX LOT 814 ON 9/29/2007.,,2,3130,,0814,2,1553,,,,,,,,,,,1555,1,,,,,,,97,*,1,56,40,2007/09/29 00:00:00+00,3130    0814,N,Y,1906,,,76.730040304419,238.821548168566
3879664,2006/09/09 00:00:00+00,,"SEE CONDO BOOK 57, PAGE 36 (CONDOS 2151 - 2160) KILLED TAX LOT 804 ON 3/31/2005.",,2,0273,,0804,2,3087,,,,,,,,,,,3087,1,,,,,,,2390,*,1,55,13,2005/03/31 00:00:00+00,0273    0804,N,Y,2709,,,130.584906409912,474.475370165799
3879665,2010/04/05 00:00:00+00,1921/03/16 00:00:01+00,SEE CONDO BOOK 25 PAGE 9 (CONDOS 2010 - 2018) KILLED TAX LOT 814 ON 5/27/1980.,,2,0904,,0814,2,2182,,,,,,,,,,,,,,,,,,,,,1,25,9,1980/05/27 00:00:00+00,0904    0814,N,Y,2338,,,101.014800107921,334.959783706415
3879666,2010/04/05 00:00:00+00,1921/03/16 00:00:01+00,SEE CONDO BOOK 25 PAGE 9 (CONDOS 2019 - 2027) KILLED TAX LOT 815 ON 5/27/1980.,,2,0904,,0815,2,2309,,,,,,,,,,,,,,,,,,,,,1,25,9,1980/05/27 00:00:00+00,0904    0815,N,Y,2338,,,101.92940009938,354.465709257982
3879667,2010/04/05 00:00:00+00,1972/09/05 00:00:00+00,SEE CONDO BOOK 37 PAGE 52 (CONDOS 2001 - 2033) KILLED TAX LOT 805 ON 11/8/1988.,,2,0946,,0805,2,7261,,,,,,,,,,,7263,,,,,,,,3600,I,1,37,52,1988/11/08 00:00:00+00,0946    0805,N,Y,2343,,,149.065967959054,1114.90271320678
3879668,2010/05/25 00:00:00+00,1982/12/21 00:00:00+00,SEE CONDO BOOK 30 PAGE 8 (CONDOS 2031 - 2054) KILLED TAX LOT 802 ON 6/24/1982.,,2,1822,,0802,2,35861,,,,,,,,,,,34909,,,,,,,,3679,X,1,30,8,1982/06/24 00:00:00+00,1822    0802,N,Y,1066,,,311.95317750619,5515.08483220459
3879669,2010/05/24 00:00:00+00,1985/12/14 00:00:00+00,SEE CONDO BOOK 36 PAGE 18 (CONDOS 2289 - 2320) KILLED TAX LOT 810,,2,1821,,0810,2,29928,,,,,,,,,,,30374,,,,,,,,3716,J,1,36,18,1986/12/24 00:00:00+00,1821    0810,N,Y,1657,,,405.895000174297,4602.56748642384
3879670,2010/05/25 00:00:00+00,1982/12/21 00:00:00+00,SEE CONDO BOOK 29 PAGE 41 (CONDOS 2055 - 2136) KILLED TAX LOT 800 ON 2/19/1982.,,2,1822,,0800,2,123033,,,,,,,,,,,124092,,,,,,,,3679,X,1,29,41,1982/06/24 00:00:00+00,1822    0800,N,Y,1066,,,723.51190617519,18921.362958812
3879671,2010/05/25 00:00:00+00,1982/12/21 00:00:00+00,SEE CONDO BOOK 30 PAGE 10 (CONDOS 2001 - 2030) KILLED TAX LOT 801 ON 6/24/1982.,,2,1822,,0801,2,41043,,,,,,,,,,,39208,,,,,,,,3679,X,1,30,10,1982/06/24 00:00:00+00,1822    0801,N,Y,1066,,,330.434849959292,6312.00530805837
3879672,2010/06/09 00:00:00+00,,SEE CONDO BOOK 21 PAGE 4 (CONDOS 2234 - 2313) KILLED TAX LOT 803 ON 2/14/1978.,,2,1978,,0803,2,34772,,,,,,,,,,,,,,,,,,,3644,K,1,21,4,1978/02/14 00:00:00+00,1978    0803,N,Y,3014,,,306.177480640356,5349.53708965942
3879673,,,SEE CONDO BOOK 27 PAGE 48 (CONDOS 2003 - 2004 & 2006 - 2007) KILLED TAX LOT 801 ON 9/21/1981.,,2,1047,,0801,2,2746,,,,,,,,,,,2746,,,,,,,,,,1,27,48,1981/09/21 00:00:00+00,1047    0801,N,Y,2371,,,101.441601051147,421.613464058884
3879674,,,SEE CONDO BOOK 27 PAGE 48 (CONDOS 2001 - 2002 & 2005) KILLED TAX LOT 802 ON 9/21/1981.,,2,1047,,0802,2,2746,,,,,,,,,,,2746,,,,,,,,,,1,27,48,1981/09/21 00:00:00+00,1047    0802,N,Y,2371,,,101.441501029581,421.611451723297
3879675,2010/04/05 00:00:00+00,1977/11/22 00:00:00+00,SEE CONDO BOOK 23 PAGE 13 (CONDOS 2001 - 2329) KILLED TAX LOT 809 ON 3/7/1980.,,2,1187,,0809,2,64623,,,,,,,,,,,65074,,,,,,,,3642,*,1,23,13,1980/03/07 00:00:00+00,1187    0809,N,Y,2382,,,490.575834055043,9928.90932219541
3879676,2010/05/24 00:00:00+00,1985/12/14 00:00:00+00,SEE CONDO BOOK 35 PAGE 15 (CONDOS 2073 - 2106) KILLED TAX LOT 804,,2,1821,,0804,2,22933,,,,,,,,,,,22934,,,,,,,,3716,J,1,35,15,1985/12/23 00:00:00+00,1821    0804,N,Y,1657,,,282.251923164592,3526.97932926488
3879677,2010/04/05 00:00:00+00,1979/05/14 00:00:00+00,SEE CONDO BOOK 22 PAGE 10 (CONDOS 2001 - 2012) KILLED TAX LOT 829 ON 3/11/1980.,,2,1188,,0829,2,5551,,,,,,,,,,,5339,,,,,,,,3661,Y,1,22,10,1980/03/11 00:00:00+00,1188    0829,N,Y,2383,,,123.971910269917,852.854896208656
3879678,2010/05/17 00:00:00+00,1987/01/28 00:00:00+00,SEE CONDO BOOK 37 PAGE 19 (CONDOS 2041 - 2260) KILLED TAX LOT 803 ON 4/25/1988.,,2,1819,,0803,2,69734,,,,,,,,,,,66841,,,,,,,,3726,R,1,37,19,1988/04/25 00:00:00+00,1819    0803,N,Y,1658,,,440.043556871497,10723.7038237457
3879679,2010/06/11 00:00:00+00,1977/01/11 00:00:00+00,SEE CONDO BOOK 21 PAGE 9 (CONDOS 2025 - 2034) KILLED TAX LOT 827 ON 8/21/1979.,,2,2529,,0827,2,22813,,,,,,,,,,,22822,,,,,,,,3636,A,1,21,9,1979/08/21 00:00:00+00,2529    0827,N,Y,1108,,,239.671179016131,3506.13045596672
3879680,2010/06/16 00:00:00+00,1996/07/23 00:00:00+00,SEE CONDO BOOK 42 PAGE 27 (CONDOS 2041 - 2071) KILLED TAX LOT 823 ON 12/5/1995.,,2,2545,,0823,2,9927,,,,,,,,,,,9968,,,,,,,,3783,F,1,42,27,1995/12/05 00:00:00+00,2545    0823,N,Y,1139,,,169.998034599633,1525.90141985327
3879681,2010/06/16 00:00:00+00,1996/07/23 00:00:00+00,SEE CONDO BOOK 42 PAGE 50 (CONDOS 2072 - 2106) KILLED TAX LOT 824.,,2,2545,,0824,2,7835,,,,,,,,,,,7881,,,,,,,,3783,F,1,42,50,1996/09/20 00:00:00+00,2545    0824,N,Y,1139,,,150.182761341188,1204.33081680589
3879682,2010/06/16 00:00:00+00,1998/02/19 00:00:00+00,SEE CONDO BOOK 43 PAGE 19 (CONDOS 2107 - 2145) KILLED TAX LOT 825 ON 4/28/1998.,,2,2545,,0825,2,16314,,,,,,,,,,,16199,,,,,,,,3792,D,1,43,19,1998/04/28 00:00:00+00,2545    0825,N,Y,1139,,,219.1312335856,2507.78059973425
3879683,2010/06/16 00:00:00+00,1998/02/19 00:00:00+00,SEE CONDO BOOK 43 PAGE 31 (CONDOS 2146 - 2215) KILLED TAX LOT 826 ON 5/19/1998.,,2,2545,,0826,2,18261,,,,,,,,,,,18278,,,,,,,,3792,D,1,43,50,1998/05/19 00:00:00+00,2545    0826,N,Y,1139,,,269.98051939812,2806.86667782584
3879684,2012/04/26 00:00:00+00,2012/04/25 00:00:00+00,"SEE CONDO BOOK 83, PAGE 45 (CONDOS 2034 - 2042) KILLED TAX LOT 837 ON 10/28/2014",,2,1189,,0837,2,11167,,,,,,,,,,,11168,,,,,,,,3855,P,1,83,45,2014/10/28 00:00:00+00,1189    0837,N,Y,4234,,,190.956740352356,1715.67535581848
3879685,2015/06/03 00:00:00+00,2015/05/18 00:00:00+00,"AIR RIGHTS LOTS (7006, 7007, 7009, 7011, & 7012) AND TAX LOTS (833, 834, & 844)  KILLED BY CONDO BOOK 87, PAGE 41 (COMMERCIAL CONDOS 2000 - 2004) ON 3/11/2016",,2,1920,,0844,2,93705,,,,,,,,,,,91158,,,,,,,,,,0,87,41,2016/03/11 00:00:00+00,1920    0844,N,Y,5255,,,728.867570075864,14409.295005593
3879686,2015/06/03 00:00:00+00,2015/05/18 00:00:00+00,"AIR RIGHTS LOTS (7008, 7010, & 7013) AND TAX LOTS (835 & 845)  KILLED BY CONDO BOOK 85, PAGE 21 (CONDOS 2005 - 2017) ON 4/13/2016",,2,1920,,0845,2,168,,,,,,,,,,,168,,,,,,,,,,1,85,21,2016/04/13 00:00:00+00,1920    0845,N,Y,5274,,,21.5529164827518,25.8451538498455
3879687,2012/11/07 00:00:00+00,2012/11/06 00:00:00+00,"AIR RIGHTS LOTS (7000 - 7004) AND TAX LOTS (832 - 834)  KILLED BY CONDO BOOK 84, PAGE 10 (COMMERCIAL CONDOS 2000 - 2004) ON 12/16/2014",,2,1920,,0833,2,16046,,,,,,,,,,,17436,,,,,,,,3858,F,0,84,10,2014/12/16 00:00:00+00,1920    0833,N,Y,5255,,,253.035940684347,2467.53632319241
3879688,2010/03/01 00:00:00+00,2009/09/28 00:00:00+00,"SEE CONDO BOOK 80, PAGE 20 (CONDOS 2001 - 2106) KILLED TAX (903,905,906,908,910) & AIR RIGHTS LOTS (7035,7050,7052 - 7056,7058,7069) ON 9/26/2013.",,2,0374,,0906,2,156,,,,,,,,,,,155,,,,,,,,3847,"I,J,K,&L",1,80,20,2013/09/26 00:00:00+00,0374    0906,N,Y,5029,,,22.3815007830235,23.9823861214195
3879689,2010/03/01 00:00:00+00,2009/09/28 00:00:00+00,"SEE CONDO BOOK 80, PAGE 20 (CONDOS 2001 - 2106) KILLED TAX (903,905,906,908,910) & AIR RIGHTS LOTS (7035,7050,7052 - 7056,7058,7069) ON 9/26/2013.",,2,0374,,0910,2,4244,,,,,,,,,,,4243,,,,,,,,3847,"I,J,K,&L",1,80,20,2013/09/26 00:00:00+00,0374    0910,N,Y,5029,,,132.712304789221,651.929330358128
3879690,2010/03/01 00:00:00+00,2009/09/28 00:00:00+00,"SEE CONDO BOOK 80, PAGE 20 (CONDOS 2001 - 2106) KILLED TAX (903,905,906,908,910) & AIR RIGHTS LOTS (7035,7050,7052 - 7056,7058,7069) ON 9/26/2013.",,2,0374,,0908,2,1197,,,,,,,,,,,1197,,,,,,,,3847,"I,J,K,&L",1,80,20,2013/09/26 00:00:00+00,0374    0908,N,Y,5029,,,54.9922019936516,183.826667541042
3879691,2006/09/09 00:00:00+00,,"SEE CONDO BOOK 101, PAGE 36 (CONDO 2035 - 2049) KILLED TAX LOT 811 ON 7/3/2018",,2,2832,,0811,2,2338,,,,,,,,,,,2342,1,,,,,,,1282,*,1,101,36,,2832    0811,N,Y,9999,,,92.9526613275961,359.487715464065
3879692,2006/09/09 00:00:00+00,,PHASE 1.  CONDOS 2011 - 2015) KILLED TAX LOT 831,,2,0510,,0831,2,2200,,,,,,,,,,,2200,1,,,,,,,2391,*,1,,,,0510    0831,N,Y,9999,,,102.065301791948,338.069797392549
3879693,2006/09/09 00:00:00+00,,,,1,2584,,0506,1,1826,,,,,,,,,,,1833,,,,,,,0,214,190,1,105,41,,2584    0506,Y,Y,9999,,,99.3014636792519,280.72330722057
3879694,2006/09/09 00:00:00+00,,DELIVERY 8,,1,2546,,0059,1,1951,,,,,,,,,,,1958,1,,,,,,0,COUNTY,49,1,105,7,,2546    0059,Y,Y,9999,,,104.120640746863,299.998876475099
3879695,2006/09/09 00:00:00+00,,DELIVERY 8,,1,2548,,0031,1,2240,,,,,,,,,,,2240,1,,,,,,0,COUNTY,7,1,104,28,,2548    0031,Y,Y,9999,,,103.655531302238,344.341888347078
3879696,2006/09/09 00:00:00+00,,DELIVERY 8,,1,2555,,0042,1,1733,,,,,,,,,,,1733,1,,,,,,0,COUNTY,43,1,107,8,,2555    0042,Y,Y,9999,,,94.7476101224692,266.305028608758
3879697,2006/09/09 00:00:00+00,,DELIVERY 15,,1,2567,,0079,1,259048,,,,,,,,,,,259289,1,,,,,,0,SUB,39,1,20,40,,2567    0079,Y,Y,1210,,,890.513430099003,39818.0855811183
3879698,2006/09/09 00:00:00+00,,DELIVERY 14,,1,2565,,0038,1,1683,,,,,,,,,,,1683,1,,,,,,0,COUNTY,65,1,108,38,,2565    0038,Y,Y,9999,,,91.0942110339377,258.733088850707
3879699,2020/10/01 00:00:00+00,2020/01/23 00:00:00+00,,,1,2566,,0105,1,2332,,,,,,,,,,,2332,,,,,,,0,216,161,1,120,30,,2566    0105,Y,Y,9999,,,123.042410295622,358.545793856432
3879700,2018/09/04 00:00:00+00,2018/07/16 00:00:00+00,,,1,2581,,0479,1,3541,,,,,,,,,,,3544,,,,,,,0,214,53,1,112,39,,2581    0479,Y,Y,9999,,,108.428206718731,544.290145835189
3879701,2006/09/09 00:00:00+00,,MAINTENANCE,,1,0369,,0070,1,29942,,,,,,,,,,,29940,1,,,,,,0,198,126,1,60,24,,0369    0070,Y,Y,2805,,,325.82171195212,4600.56582023808
3879702,2012/11/07 00:00:00+00,2012/11/06 00:00:00+00,"AIR RIGHTS LOTS (7000 - 7004) AND TAX LOTS (832 - 834)  KILLED BY CONDO BOOK 84, PAGE 10 (COMMERCIAL CONDOS 2000 - 2004) ON 12/16/2014",,2,1920,,0834,2,12313,,,,,,,,,,,12582,,,,,,,,3858,F,0,84,10,2014/12/16 00:00:00+00,1920    0834,N,Y,5255,,,213.998901056108,1893.41630977343
3879703,2012/11/07 00:00:00+00,2012/11/06 00:00:00+00,"AIR RIGHTS LOTS (7008, 7010, & 7013) AND TAX LOTS (835 & 845)  KILLED BY CONDO BOOK 85, PAGE 21 (CONDOS 2005 - 2017) ON 4/13/2016",,2,1920,,0835,2,1270,,,,,,,,,,,1270,,,,,,,,3858,F,1,85,21,2016/04/13 00:00:00+00,1920    0835,N,Y,5274,,,59.043690904302,195.344069563679
3879704,2013/04/08 00:00:00+00,2013/04/08 00:00:00+00,"SEE CONDO BOOK 83, PAGE 8 (CONDOS 2226 - 2243) KILLED TAX LOT 920 ON 9/4/2014",,2,2528,,0920,2,7578,,,,,,,,,,,7847,,,,,,,,3859,P,1,83,8,2014/09/04 00:00:00+00,2528    0920,N,Y,5117,,,161.104302329001,1153.72617782514
3879705,2014/12/19 00:00:00+00,2013/11/12 00:00:00+00,"SEE CONDO BOOK 91, PAGE 10 (CONDOS 2218 - 2250) KILLED TAX LOT 887 ON 6/14/2016",,2,2563,,0887,2,14050,,,,,,,,,,,13853,1,,,,,,,2413,*,1,91,10,2016/06/14 00:00:00+00,2563    0887,N,Y,5399,,,191.509304966476,2159.81797115192
3879706,2017/08/21 00:00:00+00,2016/10/31 00:00:00+00,"SEE CONDO BOOK 94, PAGE 11 (CONDOS 2114 - 2122) KILLED TAX LOT 859 ON 1/26/2017",,2,2583,,0859,2,4298,,,,,,,,,,,4298,,,,,,,,,,1,94,14,2017/01/26 00:00:00+00,2583    0859,Y,Y,5474,,,135.903243903026,660.701290203762
3879707,2006/09/09 00:00:00+00,,"SEE CONDO BOOK 88, PAGE 12 (CONDOS 2100 - 2105) KILLED TAX LOT 815 ON 4/7/2016",,2,2591,,0815,2,3448,,,,,,,,,,,3448,1,,,,,,,3517,y,1,88,12,2016/04/07 00:00:00+00,2591    0815,Y,Y,5259,,,140.012844466915,530.17848823142
3879708,2014/12/17 00:00:00+00,2014/12/01 00:00:00+00,"SEE CONDO BOOK 93, PAGE 49 (CONDOS 2041 - 2044) KILLED TAX LOT 850 ON 1/27/2017",,2,2614,,0850,2,2800,,,,,,,,,,,2800,,,,,,,,,,1,93,49,2017/01/27 00:00:00+00,2614    0850,N,Y,5427,,,107.429148848694,430.557285086848
3879709,2014/12/17 00:00:00+00,2014/12/01 00:00:00+00,"SEE CONDO BOOK 93, PAGE 50 (CONDOS 2036 - 2040) KILLED TAX LOT 851 ON 1/12/2017",,2,2614,,0851,2,2749,,,,,,,,,,,2749,,,,,,,,,,1,93,50,2017/01/12 00:00:00+00,2614    0851,N,Y,5428,,,106.023884809894,422.752447125398
3879710,2006/09/09 00:00:00+00,,"SEE CONDO BOOK 83, PAGE 10 (CONDOS 2273 - 2288) KILLED TAX LOT 828 ON 8/15/2014",,2,2662,,0828,2,7500,,,,,,,,,,,7500,1,,,,,,,80,*,1,83,10,2014/08/15 00:00:00+00,2662    0828,Y,Y,5122,,,156.985500687723,1152.88023298249
3879711,2006/09/09 00:00:00+00,,"SEE CONDO BOOK 79, PAGE 40 (CONDOS 2009 & 2010) KILLED TAX LOT 843 ON 8/15/2013",,2,2908,,0843,2,2295,,,,,,,,,,,2295,1,,,,,,,3818,Q,1,79,40,2013/08/15 00:00:00+00,2908    0843,Y,Y,5055,,,119.126503043531,352.966844310838
3879712,2006/09/09 00:00:00+00,,"SEE CONDO BOOK 86, PAGE 19 (CONDOS 2007 - 2011) KILLED TAX LOT 806 ON 6/9/2015",,2,2686,,0806,2,2938,,,,,,,,,,,2938,1,,,,,,,1218,*,1,86,19,2015/06/09 00:00:00+00,2686    0806,N,Y,5231,,,111.850282410752,451.723112280923
3879713,2006/09/09 00:00:00+00,,"SEE CONDO BOOK 95, PAGE 29 (CONDOS 2011 - 2030) KILLED TAX LOT 804 ON 4/19/2017",,2,2891,,0804,2,1260,,,,,,,,,,,1260,1,,,,,,,95,*,1,95,29,2017/04/19 00:00:00+00,2891    0804,N,Y,5576,,,69.0928786305112,193.734238085913
3879714,2006/09/09 00:00:00+00,,"SEE CONDO BOOK 95, PAGE 29 (CONDOS 2045 - 2047) KILLED TAX LOT 879 ON 9/30/2015",,2,2894,,0879,2,1781,,,,,,,,,,,1782,1,,,,,,,1235,*,1,87,44,2015/09/30 00:00:00+00,2894    0879,N,Y,5233,,,121.761504227645,273.900744855157
3879715,2014/10/15 00:00:00+00,2014/05/29 00:00:00+00,,,1,2894,,0100,1,1584,,,,,,,,,,,1512,,,,,,,0,208,119,1,89,7,,2894    0100,Y,Y,5287,,,80.791408729401,243.516256216513
3879716,2006/09/09 00:00:00+00,,PHASE 1,,1,0277,,0041,1,1395,,,,,,,,,,,,1,,,,,,0,11,104,1,66,13,,0277    0041,Y,Y,2884,,,70.2887036634585,214.385072772998
3879717,2006/09/09 00:00:00+00,,PHASE 1,,1,0478,,0056,1,1603,,,,,,,,,,,1603,1,,,,,,0,181,104,1,92,29,,0478    0056,Y,Y,5328,,,86.550202003199,246.402956393303
3879718,2006/09/09 00:00:00+00,,DELIVERY 11,,1,2549,,0637,1,1853,,,,,,,,,,,1854,1,,,,,,0,SUB,189,1,42,26,,2549    0637,Y,Y,1160,,,97.3873266660544,284.81563667801
3879719,2006/09/09 00:00:00+00,,DELIVERY 13,,1,2677,,0372,1,1667,,,,,,,,,,,1667,1,,,,,,0,COUNTY,119,1,59,42,,2677    0372,Y,Y,1799,,,91.5768671932633,256.269086208
3879720,2006/09/09 00:00:00+00,,PHASE 1,,1,0368,,0050,1,2064,,,,,,,,,,,,1,,,,,,0,WF,223,1,55,8,,0368    0050,Y,Y,2735,,,107.727303981163,317.118575419978
3879721,2011/03/25 00:00:00+00,2011/01/24 00:00:00+00,CONDOS KILLED BY LOT 854 ON 12/28/2012 ,,1,2567,,0087,1,1879,,,,,,,,,,,1881,,,,,,,0,205,53,1,74,11,,2567    0087,N,Y,1399,,,86.1670457572262,288.763311888964
3879722,2006/09/09 00:00:00+00,,PHASE 1,,1,0207,,0108,1,8062,,,,,,,,,,,8062,1,,,,,,0,CONDO_00044,8,1,31,48,,0207    0108,Y,Y,2516,,,155.04501018015,1238.90002561132
3879723,2006/09/09 00:00:00+00,,PHASE 1,,1,0043,,0025,1,12726,,,,,,,,,,,12726,1,,,,,,0,CONDO_00032,30,1,32,30,,0043    0025,Y,Y,2014,,,201.330545988389,1954.91830230602
3879724,2006/09/09 00:00:00+00,,DELIVERY 7,,1,3106,,0084,1,3250,,,,,,,,,,,3250,1,,,,,,0,COUNTY,72,1,88,34,,3106    0084,Y,Y,5247,,,103.781076911926,499.488547780709
3879725,2006/09/09 00:00:00+00,,DELIVERY 7,,1,1819,,0004,1,123726,,,,,,,,,,,118395,1,,,,,,0,175,96,1,56,6,,1819    0004,Y,Y,1658,,,624.675434873459,19026.6987696573
3879726,2014/10/15 00:00:00+00,2014/05/29 00:00:00+00,,,1,2894,,0099,1,1512,,,,,,,,,,,1512,,,,,,,0,208,119,1,89,7,,2894    0099,Y,Y,5287,,,80.1076305463521,232.541513509601
3879727,2006/09/09 00:00:00+00,,DELIVERY 7,,1,2853,,0144,1,2438,,,,,,,,,,,2438,1,,,,,,0,COUNTY,102,1,70,8,,2853    0144,Y,Y,1322,,,127.968706278644,374.82042293739
3879728,2011/03/31 00:00:00+00,2010/10/22 00:00:00+00,,,1,0806,,0043,1,1678,,,,,,,,,,,1678,,,,,,,0,205,21,1,56,41,,0806    0043,Y,Y,2995,,,91.7776999172532,257.833426762482
3879729,2008/08/04 00:00:00+00,2008/01/08 00:00:00+00,,,1,2666,,0227,1,6875,,,,,,,,,,,6875,1,,,,,,0,202,125,1,69,12,,2666    0227,Y,Y,1980,,,146.893883464848,1056.90759562791
3879730,2006/09/09 00:00:00+00,,PHASE 1,,1,0421,,0004,1,1900,,,,,,,,,,,1900,1,,,,,,0,REC_00002,421,1,51,32,,0421    0004,Y,Y,2655,,,90.0417028114862,291.970010622711
3879731,2006/09/09 00:00:00+00,,PHASE 1,,1,0510,,0051,1,2255,,,,,,,,,,,2255,1,,,,,,0,RW,105,1,62,37,,0510    0051,Y,Y,1057,,,102.195704754949,346.558398851977
3879732,2006/09/09 00:00:00+00,,DELIVERY 13,,1,1368,,0059,1,34857,,,,,,,,,,,34974,1,,,,,,0,29,6,1,29,6,,1368    0059,Y,Y,2418,,,390.235813386995,5356.76272044978
3879733,2006/09/09 00:00:00+00,,DELIVERY 12,,1,5592,,0035,1,6700,,,,,,,,,,,6700,1,,,,,,0,130,181,1,75,33,,5592    0035,Y,Y,1407,,,136.429852945024,1028.5070676198
3879734,2006/09/09 00:00:00+00,,DELIVERY 12,,1,5672,,0002,1,29006,,,,,,,,,,,29031,1,,,,,,0,113,30,1,3,10,,5672    0002,Y,Y,1277,,,291.410217714278,4451.66006510249
3879735,2006/09/09 00:00:00+00,,PHASE 1,,1,0366,,0068,1,1100,,,,,,,,,,,,1,,,,,,0,13,185,1,100,18,,0366    0068,Y,Y,9999,,,58.8560021778003,169.03039758381
3879736,2006/09/09 00:00:00+00,,PHASE 1,,1,0397,,0023,1,1502,,,,,,,,,,,,1,,,,,,0,13,62,1,108,45,,0397    0023,Y,Y,9999,,,86.315202903928,230.764479109453
3879737,2016/06/03 00:00:00+00,2015/12/21 00:00:00+00,,,1,0397,,0038,1,1415,,,,,,,,,,,1415,,,,,,,0,210,131,1,85,15,,0397    0038,Y,Y,9999,,,85.5927026850081,217.446640673162
3879738,2018/01/24 00:00:00+00,2017/11/14 00:00:00+00,,,1,0416,,0034,1,2118,,,,,,,,,,,2118,,,,,,,0,213,72,1,103,43,,0416    0034,Y,Y,9999,,,94.8872029462124,325.491429931921
3879739,2016/05/02 00:00:00+00,2015/05/26 00:00:00+00,,,1,0399,,0070,1,1887,,,,,,,,,,,1887,,,,,,,0,209,174,1,109,44,,0399    0070,Y,Y,9999,,,89.5180029017031,289.943389132697
3879740,2017/10/03 00:00:00+00,2017/08/11 00:00:00+00,,,1,0399,,0071,1,7074,,,,,,,,,,,7075,,,,,,,0,212,179,1,110,10,,0399    0071,Y,Y,9999,,,132.714304332987,1086.98527535569
3879741,2018/06/18 00:00:00+00,2018/04/30 00:00:00+00,,,1,0429,,0023,1,7600,,,,,,,,,,,7600,,,,,,,0,213,191,1,101,18,,0429    0023,Y,Y,9999,,,137.161004061805,1167.58929240596
3879742,2006/09/09 00:00:00+00,,PHASE 1,,1,0445,,0036,1,1900,,,,,,,,,,,,1,,,,,,0,CHB,341,1,100,41,,0445    0036,Y,Y,9999,,,93.1712023179533,292.016299964791
3879743,2006/09/09 00:00:00+00,,DELIVERY 10,,1,4061,,0140,1,2664,,,,,,,,,,,2664,1,,,,,,0,107,12,1,98,43,,4061    0140,Y,Y,5661,,,87.2588110135601,409.385830343035
3879744,2006/09/09 00:00:00+00,,PHASE 1,,1,0154,,0046,1,8640,,,,,,,,,,,8640,1,,,,,,0,CONDO_00040,35,1,40,35,,0154    0046,Y,Y,2116,,,145.824513217811,1327.83484349221
3879745,2006/09/09 00:00:00+00,,DELIVERY 10,,1,5970,,0009,1,33596,,,,,,,,,,,33711,1,,,,,,0,142,68,1,26,19,,5970    0009,Y,Y,1286,,,353.16565092568,5152.65379177665
3879746,2007/05/16 00:00:00+00,2004/07/20 00:00:00+00,,,1,0377,,0045,1,13201,,,,,,,,,,,13330,,,,,,,0,198,95,1,57,27,,0377    0045,Y,Y,3099,,,193.009507075731,2027.7973262912
3879747,2008/03/12 00:00:00+00,2006/09/14 00:00:00+00,,,1,5336,,0039,1,8928,,,,,,,,,,,8928,,,,,,,0,201,43,1,71,4,,5336    0039,Y,Y,1342,,,189.899555014394,1370.99671568487
3879748,2006/09/09 00:00:00+00,,PHASE 1,,1,0552,,0064,1,1561,,,,,,,,,,,1561,1,,,,,,0,27,193,1,61,28,,0552    0064,Y,Y,2820,,,87.4895011058038,239.865897399629
3879749,2008/04/15 00:00:00+00,2007/06/05 00:00:00+00,,,1,2888,,0203,1,1723,,,,,,,,,,,1723,,,,,,,0,202,17,1,70,29,,2888    0203,Y,Y,1332,,,114.287836638628,264.827319843843
3879750,2009/05/14 00:00:00+00,2009/02/10 00:00:00+00,,,1,5969,,0243,1,4258,,,,,,,,,,,4254,,,,,,,0,203,136,1,85,44,,5969    0243,Y,Y,5187,,,107.139373169615,653.064770279085
3879751,2006/09/09 00:00:00+00,,DELIVERY 5,,1,1060,,0027,1,2063,,,,,,,,,,,2063,1,,,,,,0,23,166,1,96,45,,1060    0027,Y,Y,5588,,,110.72670148049,316.715350859828
3879752,2006/09/09 00:00:00+00,,DELIVERY 5,,1,1005,,0087,1,3669,,,,,,,,,,,3671,1,,,,,,0,157,107,1,67,26,,1005    0087,Y,Y,2924,,,129.449435733549,563.694709618566
3879753,,1943/10/07 00:00:01+00,DELIVERY 7,,1,1823,,0006,1,38678,,,,,,,,,,,38680,1,,,,,,0,30,15,1,33,1,,1823    0006,Y,Y,1066,,,309.84707370314,5948.65446975338
3879754,2010/09/13 00:00:00+00,2010/06/15 00:00:00+00,,,1,3096,,0158,1,1546,,,,,,,,,,,1805,,,,,,,0,204,162,1,81,38,,3096    0158,Y,Y,5089,,,94.1185347306912,237.61092532006
3879755,2013/09/24 00:00:00+00,2013/09/10 00:00:00+00,,,1,2552,,0072,1,3000,,,,,,,,,,,3000,,,,,,,0,207,180,1,85,42,,2552    0072,Y,Y,10503,,,113.852012617043,461.147765137644
3879756,2011/04/12 00:00:00+00,2011/03/15 00:00:00+00,,,1,1028,,0194,1,5484,,,,,,,,,,,5485,,,,,,,0,205,76,1,74,30,,1028    0194,Y,Y,4029,,,125.299404748451,842.432194373847
3879757,2014/11/21 00:00:00+00,2014/08/13 00:00:00+00,,,1,3931,,0051,1,1274,,,,,,,,,,,1274,,,,,,,0,208,163,1,89,13,,3931    0051,Y,Y,3249,,,113.120990681302,195.908120251242
3879758,2006/09/09 00:00:00+00,,DELIVERY 15,,1,2583,,0438,1,2192,,,,,,,,,,,2187,1,,,,,,0,SUB,14,1,104,19,,2583    0438,Y,Y,9999,,,116.055505728812,336.94172434624
3879759,2006/09/09 00:00:00+00,,DELIVERY 15,,1,2583,,0358,1,2430,,,,,,,,,,,2430,1,,,,,,0,SUB,95,1,105,3,,2583    0358,Y,Y,9999,,,87.0536915774398,373.541521457709
3879760,2019/05/01 00:00:00+00,2018/11/19 00:00:00+00,,,1,0513,,0170,1,2012,,,,,,,,,,,2012,,,,,,,0,214,147,1,111,7,,0513    0170,Y,Y,9999,,,94.2989018924773,309.166935660421
3879761,2020/12/21 00:00:00+00,2020/07/14 00:00:00+00,,,1,0514,,0103,1,2050,,,,,,,,,,,2050,,,,,,,0,217,77,1,112,25,,0514    0103,Y,Y,9999,,,94.5934015582066,314.960071929551
3879762,2006/09/09 00:00:00+00,,PHASE 1,,1,0514,,0088,1,1800,,,,,,,,,,,1800,1,,,,,,0,186,132,1,102,18,,0514    0088,Y,Y,9999,,,92.6376018282828,276.548553310732
3879763,2019/07/31 00:00:00+00,2019/03/01 00:00:00+00,,,1,0521,,0047,1,2700,,,,,,,,,,,2700,,,,,,,0,215,33,1,109,7,,0521    0047,Y,Y,9999,,,100.151801488565,414.930433758693
3879764,2006/09/09 00:00:00+00,,PHASE 1,,1,0521,,0039,1,1339,,,,,,,,,,,,1,,,,,,0,27,84,1,109,40,,0521    0039,Y,Y,9999,,,80.9681011919957,205.737635750966
3879765,2019/05/01 00:00:00+00,2018/11/19 00:00:00+00,,,1,0513,,0171,1,2013,,,,,,,,,,,2013,,,,,,,0,214,147,1,111,7,,0513    0171,Y,Y,9999,,,94.3040019080014,309.268703781712
3879766,2006/09/09 00:00:00+00,,DELIVERY 4,,1,0830,,0057,1,1640,,,,,,,,,,,1640,1,,,,,,0,28,113,1,102,23,,0830    0057,Y,Y,9999,,,80.0613000078191,251.968980505448
3879767,2006/09/09 00:00:00+00,,MAINTENANCE,,1,0829,,0070,1,1806,,,,,,,,,,,1805,1,,,,,,0,,,1,101,28,,0829    0070,Y,Y,9999,,,92.6806001492946,277.418791192515
3879768,2006/09/09 00:00:00+00,,MAINTENANCE,,1,0829,,0071,1,1806,,,,,,,,,,,1806,1,,,,,,0,,,1,101,28,,0829    0071,Y,Y,9999,,,92.6845000024178,277.495381870568
3879769,2006/09/09 00:00:00+00,,MAINTENANCE,,1,0829,,0069,1,1806,,,,,,,,,,,1805,1,,,,,,0,,,1,101,28,,0829    0069,Y,Y,9999,,,92.6807001484169,277.419144391915
3879770,2006/09/09 00:00:00+00,,DELIVERY 4,,1,0831,,0033,1,1568,,,,,,,,,,,1568,1,,,,,,0,JHK,5,1,107,2,,0831    0033,Y,Y,9999,,,89.2360000058181,240.903675800838
3879771,2006/09/09 00:00:00+00,,DELIVERY 4,,1,0835,,0029,1,1276,,,,,,,,,,,1276,1,,,,,,0,16,107,1,111,2,,0835    0029,Y,Y,9999,,,78.336800004342,196.037163403429
3879772,2006/09/09 00:00:00+00,,DELIVERY 4,,1,0837,,0021,1,1792,,,,,,,,,,,1792,1,,,,,,0,172,92,1,101,5,,0837    0021,Y,Y,9999,,,72.1720000027579,275.27040438386
3879773,2006/09/09 00:00:00+00,,DELIVERY 4,,1,0855,,0169,1,1800,,,,,,,,,,,1800,1,,,,,,0,16,78,1,108,41,,0855    0169,Y,Y,9999,,,86.3478000445689,276.569360020728
3879774,2006/09/09 00:00:00+00,,DELIVERY 4,,1,0855,,0176,1,1040,,,,,,,,,,,1042,1,,,,,,0,16,78,1,110,15,,0855    0176,Y,Y,9999,,,56.7691818827072,159.742355135357
3879775,2006/09/09 00:00:00+00,,DELIVERY 4,,1,0858,,0027,1,2082,,,,,,,,,,,,1,,,,,,0,13,117,1,52,4,,0858    0027,N,Y,2656,,,100.925000078407,319.911242673526
3879776,2006/09/09 00:00:00+00,,DELIVERY 7,,1,0857,,0117,1,3393,,,,,,,,,,,3394,1,,,,,,0,181,41,1,103,44,,0857    0117,Y,Y,9999,,,107.585219870618,521.239019667209
3879777,2007/11/15 00:00:00+00,2006/09/30 00:00:00+00,,,1,0876,,0065,1,1831,,,,,,,,,,,1880,,,,,,,0,201,84,1,112,34,,0876    0065,Y,Y,9999,,,84.0253857384485,281.16789083436
3879778,2006/09/09 00:00:00+00,,DELIVERY 4,,1,0886,,0067,1,1190,,,,,,,,,,,1190,1,,,,,,0,52,127,1,99,32,,0886    0067,Y,Y,9999,,,68.1199000662564,182.849415896896
3879779,2006/09/09 00:00:00+00,,DELIVERY 4,,1,0886,,0036,1,2332,,,,,,,,,,,2332,1,,,,,,0,38,108,1,102,4,,0886    0036,Y,Y,9999,,,106.919400112426,358.243793836265
3879780,2015/06/03 00:00:00+00,2015/03/19 00:00:00+00,,,1,2720,,0063,1,2400,,,,,,,,,,,,,,,,,,1,209,138,0,,,,2720    0063,N,Y,,,,109.674207591217,369.286995880952
3879781,2006/09/09 00:00:00+00,,PHASE 1,,1,0614,,0061,1,1428,,,,,,,,,,,,1,,,,,,0,16,7,1,109,29,,0614    0061,Y,Y,9999,,,79.2968006260217,219.46966283127
3879782,2018/05/08 00:00:00+00,2018/03/05 00:00:00+00,,,1,0615,,0312,1,3200,,,,,,,,,,,3200,,,,,,,0,213,149,1,103,30,,0615    0312,Y,Y,9999,,,103.382300560536,491.761588384844
3879783,2017/10/06 00:00:00+00,2017/09/07 00:00:00+00,,,1,0615,,0311,1,1750,,,,,,,,,,,1750,,,,,,,0,213,11,1,,,,0615    0311,Y,Y,9999,,,92.2533007824525,268.91956974025
3879784,2020/08/04 00:00:00+00,2019/12/20 00:00:00+00,,,1,0616,,0121,1,1832,,,,,,,,,,,1832,,,,,,,0,216,132,1,111,3,,0616    0121,Y,Y,9999,,,92.6346345922427,281.543985016991
3879785,2006/09/09 00:00:00+00,,PHASE 1,,1,0617,,0242,1,34257,,,,,,,,,,,34256,1,,,,,,0,211,41,1,101,8,,0617    0242,Y,Y,9999,,,290.208902137704,5263.80840735265
3879786,2006/09/09 00:00:00+00,,PHASE 1,,1,0618,,0051,1,1104,,,,,,,,,,,,1,,,,,,0,15,118,1,112,43,,0618    0051,Y,Y,9999,,,62.0038275516849,169.62716960554
3879787,2019/08/09 00:00:00+00,2019/03/26 00:00:00+00,,,1,0656,,0056,1,9138,,,,,,,,,,,9138,1,,,,,,1,215,66,0,118,48,,0656    0056,Y,Y,9999,,,168.157701391374,1402.70556152296
3879788,2017/10/31 00:00:00+00,2017/09/07 00:00:00+00,,,1,0667,S,0016,1,19362,,,,,,,,,,,19287,,,,,,,0,211,128,1,110,3,,0667S   0016,Y,Y,9999,,,273.378314234957,2971.55454016665
3879789,2019/07/25 00:00:00+00,2018/09/20 00:00:00+00,,,1,0694,,0047,1,2869,,,,,,,,,,,2859,,,,,,,0,3,694,1,,,,0694    0047,Y,Y,9999,,,96.9876344692874,440.615322370562
3879790,2018/01/18 00:00:00+00,2017/12/19 00:00:00+00,,,1,0755,,0046,1,816,,,,,,,,,,,816,,,,,,,0,213,98,1,106,31,,0755    0046,Y,Y,9999,,,45.4494000112852,125.355482361522
3879791,2006/09/09 00:00:00+00,,DELIVERY 4,,1,0773,,0213,1,1038,,,,,,,,,,,1038,1,,,,,,0,75,123,1,108,9,,0773    0213,Y,Y,9999,,,63.3079000063101,159.439079727611
3879792,2006/09/09 00:00:00+00,2018/09/06 00:00:00+00,DELIVERY 4,,1,0793,,0042,1,2568,,,,,,,,,,,2568,1,,,,,,0,214,101,1,108,10,,0793    0042,Y,Y,9999,,,99.0234000029539,394.245434408117
3879793,2006/09/09 00:00:00+00,,DELIVERY 4,,1,0806,,0018,1,1600,,,,,,,,,,,1600,1,,,,,,0,JHK,361,1,112,1,,0806    0018,Y,Y,9999,,,90.8010000104778,245.785102952984
3879794,2019/08/05 00:00:00+00,2019/03/29 00:00:00+00,,,1,0806,,0047,1,1596,,,,,,,,,,,1596,,,,,,,0,215,79,1,106,28,,0806    0047,Y,Y,9999,,,87.7699000110327,245.22531856722
3879795,2006/09/09 00:00:00+00,,DELIVERY 4,,1,0829,,0058,1,2000,,,,,,,,,,,2000,1,,,,,,0,CHB,63,1,112,11,,0829    0058,Y,Y,9999,,,93.9466000201452,307.289878161137
3879796,2006/09/09 00:00:00+00,,DELIVERY 14,,1,2693,,0018,1,2954,,,,,,,,,,,2954,1,,,,,,0,61,17,1,113,12,,2693    0018,Y,Y,9999,,,124.292163708199,454.328515510681
3879797,2006/09/09 00:00:00+00,,PHASE 1,,1,0555,,0084,1,2000,,,,,,,,,,,2000,1,,,,,,0,19,98,1,108,27,,0555    0084,Y,Y,9999,,,94.20440109982,307.306353099099
3879798,2006/09/09 00:00:00+00,,PHASE 1,,1,0555,,0093,1,2000,,,,,,,,,,,2000,1,,,,,,0,19,98,1,100,20,,0555    0093,Y,Y,9999,,,94.2050010950679,307.308700220536
3879799,2006/09/09 00:00:00+00,,PHASE 1,,1,0552,,0160,1,1598,,,,,,,,,,,1598,1,,,,,,0,31,144,1,111,11,,0552    0160,Y,Y,9999,,,87.7938009612749,245.559038648006
3879800,2006/09/09 00:00:00+00,,PHASE 1,,1,0555,,0147,1,2496,,,,,,,,,,,2492,1,,,,,,0,26,146,1,110,18,,0555    0147,Y,Y,9999,,,129.415582758529,383.487739326255
3879801,2022/03/30 00:00:00+00,2021/07/02 00:00:00+00,,,1,3037,,0086,1,2055,,,,,,,,,,,2055,,,,,,,0,218,155,1,122,43,,3037    0086,Y,Y,9999,,,100.411219031229,315.962254541389
3879802,2017/09/26 00:00:00+00,2017/05/19 00:00:00+00,,,1,0509,E,0092,1,1954,,,,,,,,,,,1955,,,,,,,0,212,119,0,103,11,,0509E   0092,Y,Y,9999,,,82.7029122879999,300.230065017473
3879803,2013/01/28 00:00:00+00,2012/09/12 00:00:00+00,,,1,0523,,0024,1,1869,,,,,,,,,,,1868,,,,,,,0,206,163,1,78,24,,0523    0024,Y,Y,4115,,,88.8409728980055,287.211667668457
3879804,2017/10/18 00:00:00+00,2017/05/10 00:00:00+00,,,1,3036,,0117,1,2075,,,,,,,,,,,2075,,,,,,,0,,,1,107,3,,3036    0117,Y,Y,9999,,,95.9387253207532,319.069952472176
3879805,2018/05/03 00:00:00+00,2018/02/28 00:00:00+00,,,1,0523,,0033,1,1440,,,,,,,,,,,1441,,,,,,,0,213,143,1,100,28,,0523    0033,Y,Y,9999,,,85.1970012829023,221.20686855992
3879806,2006/09/09 00:00:00+00,,DELIVERY 8,,1,2699,,0015,1,1875,,,,,,,,,,,1875,1,,,,,,0,SUB,122,1,106,3,,2699    0015,Y,Y,9999,,,78.3586051450091,288.40115288602
3879807,2006/09/09 00:00:00+00,,DELIVERY 14,,1,2693,,0023,1,2585,,,,,,,,,,,2585,1,,,,,,0,61,17,1,106,45,,2693    0023,Y,Y,9999,,,126.987586795696,397.627962589847
3879808,2006/09/09 00:00:00+00,,DELIVERY 13,,1,2696,,0024,1,1400,,,,,,,,,,,1400,1,,,,,,0,SUB,198,1,112,40,,2696    0024,Y,Y,9999,,,70.5131046839048,215.329096722
3879809,2013/01/28 00:00:00+00,2012/09/12 00:00:00+00,,,1,0523,,0025,1,1870,,,,,,,,,,,1868,,,,,,,0,206,163,1,78,24,,0523    0025,Y,Y,4115,,,88.8409562158735,287.352092510708
3879810,2019/03/01 00:00:00+00,2018/11/07 00:00:00+00,,,1,2586,W,0413,1,4635,,,,,,,,,,,4488,,,,,,,0,214,143,1,116,8,,2586   0413,Y,Y,9999,,,106.797170164556,712.553069789807
3879811,2006/09/09 00:00:00+00,,DELIVERY 15,,1,2587,,0490,1,1777,,,,,,,,,,,1777,1,,,,,,0,SUB,12,1,112,3,,2587    0490,Y,Y,9999,,,84.6222423042031,273.224758713551
3879812,2006/09/09 00:00:00+00,,DELIVERY 15,,1,2583,,0459,1,2844,,,,,,,,,,,2844,1,,,,,,0,SUB,57,1,108,23,,2583    0459,Y,Y,9999,,,127.427923784646,437.251852897074
3879813,2006/09/09 00:00:00+00,,DELIVERY 7,,1,2614,,0033,1,2749,,,,,,,,,,,2748,1,,,,,,0,COUNTY,18,1,93,50,,2614    0033,Y,Y,9999,,,106.023884809894,422.752447125398
3879814,2006/09/09 00:00:00+00,,DELIVERY 7,,1,2602,,0071,1,2000,,,,,,,,,,,2000,1,,,,,,0,COUNTY,68,1,101,6,,2602    0071,Y,Y,9999,,,93.9814087680625,307.515856063863
3879815,2006/09/09 00:00:00+00,,DELIVERY 9,,1,2600,,0124,1,2100,,,,,,,,,,,2100,1,,,,,,0,SUB,7,1,102,50,,2600    0124,Y,Y,9999,,,98.1645092875053,322.881503234541
3879816,2006/09/09 00:00:00+00,,DELIVERY 9,,1,2600,,0126,1,2100,,,,,,,,,,,2100,1,,,,,,0,SUB,7,1,108,46,,2600    0126,Y,Y,9999,,,98.1647092977444,322.883956695154
3879817,2006/09/09 00:00:00+00,,DELIVERY 8,,1,2613,,0047,1,2872,,,,,,,,,,,2872,1,,,,,,0,COUNTY,88,1,104,24,,2613    0047,Y,Y,9999,,,148.036007817247,441.690744036584
3879818,2006/09/09 00:00:00+00,,DELIVERY 7,,1,2614,,0032,1,2800,,,,,,,,,,,2800,1,,,,,,0,COUNTY,18,1,93,49,,2614    0032,Y,Y,9999,,,107.429148848694,430.557285086848
3879819,2018/01/25 00:00:00+00,2017/12/06 00:00:00+00,,,1,2660,,0242,1,2821,,,,,,,,,,,2811,,,,,,,0,213,91,1,105,5,,2660    0242,Y,Y,9999,,,113.485483640255,433.64423080925
3879820,2019/05/29 00:00:00+00,2018/12/21 00:00:00+00,,,1,2614,,0074,1,2811,,,,,,,,,,,2811,,,,,,,0,214,177,1,107,46,,2614    0074,Y,Y,9999,,,115.189912517065,432.262136367289
3879821,2006/09/09 00:00:00+00,,DELIVERY 10,,1,1601,,0007,1,578890,,,,,,,,,,,576642,1,,,,,,0,167,127,1,,,,1601    0007,Y,Y,"2422,2424",,,1486.5786827491,89013.547249911
3879822,2006/09/09 00:00:00+00,,DELIVERY 7,,1,2615,,0057,1,2067,,,,,,,,,,,2067,1,,,,,,0,COUNTY,197,1,102,11,,2615    0057,Y,Y,9999,,,110.494311907681,317.853019703294
3879823,2018/02/14 00:00:00+00,2018/01/10 00:00:00+00,,,1,2621,,1005,1,2063,,,,,,,,,,,2064,,,,,,,0,213,113,1,101,13,,2621    1005,Y,Y,9999,,,89.6885771684186,317.217162268638
3879824,2019/10/07 00:00:00+00,2019/04/09 00:00:00+00,,,1,2661,,0223,1,3750,,,,,,,,,,,3750,,,,,,,0,215,93,1,110,38,,2661    0223,Y,Y,9999,,,137.421626318808,576.436515541945
3879825,2019/05/29 00:00:00+00,2018/12/21 00:00:00+00,,,1,2614,,0073,1,3389,,,,,,,,,,,3389,,,,,,,0,214,177,1,107,46,,2614    0073,Y,Y,9999,,,118.83621300806,521.091767998487
3879826,2017/05/09 00:00:00+00,2016/02/05 00:00:00+00,,,1,2660,,0240,1,7454,,,,,,,,,,,7501,,,,,,,0,210,149,1,107,25,,2660    0240,Y,Y,9999,,,156.74545749911,1145.84058382859
3879827,2006/09/09 00:00:00+00,,DELIVERY 8,,1,2666,,0224,1,3308,,,,,,,,,,,3308,1,,,,,,0,SUB,153,1,111,42,,2666    0224,Y,Y,9999,,,127.760254891408,508.592359657626
3879828,2006/09/09 00:00:00+00,,DELIVERY 14,,1,2668,,0037,1,2610,,,,,,,,,,,2610,1,,,,,,0,COUNTY,112,1,111,1,,2668    0037,Y,Y,9999,,,128.017156171992,401.226315046085
3879829,2006/09/09 00:00:00+00,,DELIVERY 7,,1,2665,,0039,1,1400,,,,,,,,,,,1400,1,,,,,,0,SUB,191,1,103,16,,2665    0039,Y,Y,9999,,,70.4974486806208,215.239863334197
3879830,2006/09/09 00:00:00+00,,DELIVERY 7,,1,2665,,0040,1,1400,,,,,,,,,,,1400,1,,,,,,0,SUB,191,1,107,50,,2665    0040,Y,Y,9999,,,70.4947488715521,215.203863420521
3879831,2020/01/29 00:00:00+00,2019/09/24 00:00:00+00,,,1,2663,,0023,1,2745,,,,,,,,,,,2746,,,,,,,0,216,61,1,108,34,,2663    0023,Y,Y,9999,,,134.638229099805,422.009741208968
3879832,2019/11/07 00:00:00+00,2019/07/25 00:00:00+00,,,1,2668,,0071,1,2900,,,,,,,,,,,2900,,,,,,,0,215,195,1,107,7,,2668    0071,Y,Y,1961,,,129.649303171934,445.813690105729
3879833,2006/09/09 00:00:00+00,,,,1,2665,,0047,1,1733,,,,,,,,,,,1733,1,,,,,,0,216,11,1,107,9,,2665    0047,Y,Y,9999,,,83.5408395872781,266.475308868841
3879834,2006/09/09 00:00:00+00,,DELIVERY 14,,1,2669,,0029,1,2027,,,,,,,,,,,2027,1,,,,,,0,SUB,147,1,105,23,,2669    0029,Y,Y,9999,,,91.3520013431366,311.697532635017
3879835,2017/05/09 00:00:00+00,2016/03/30 00:00:00+00,,,1,2677,,0713,1,1520,,,,,,,,,,,1520,,,,,,,0,,,1,106,38,,2677    0713,Y,Y,9999,,,87.1315282152032,233.734698832911
3879836,2017/09/22 00:00:00+00,2017/05/31 00:00:00+00,,,1,2670,,0097,1,2743,,,,,,,,,,,2720,,,,,,,0,212,127,1,102,22,,2670    0097,Y,Y,9999,,,128.780855636924,421.771752160208
3879837,2018/10/09 00:00:00+00,2018/09/13 00:00:00+00,,,1,2672,,0733,1,3901,,,,,,,,,,,3901,,,,,,,0,214,118,1,107,11,,2672    0733,Y,Y,9999,,,105.030610438109,599.799095870492
3879838,2006/09/09 00:00:00+00,,DELIVERY 13,,1,2677,,0384,1,1620,,,,,,,,,,,1620,1,,,,,,0,COUNTY,133,1,107,41,,2677    0384,Y,Y,9999,,,84.769259632959,249.089976886199
3879839,2017/05/09 00:00:00+00,2016/03/30 00:00:00+00,,,1,2677,,0714,1,1520,,,,,,,,,,,1520,,,,,,,0,,,1,106,37,,2677    0714,Y,Y,9999,,,87.129290459472,233.732149040039
3879840,2006/09/09 00:00:00+00,,DELIVERY 8,,1,2676,,0475,1,2000,,,,,,,,,,,2000,1,,,,,,0,COUNTY,107,1,103,34,,2676    0475,Y,Y,9999,,,93.9833073191684,307.529962545104
3879841,2006/09/09 00:00:00+00,,DELIVERY 8,,1,2685,,0433,1,2261,,,,,,,,,,,2195,1,,,,,,0,SUB,106,1,104,49,,2685    0433,Y,Y,9999,,,111.510286800341,347.620826306789
3879842,2017/06/14 00:00:00+00,2017/02/01 00:00:00+00,,,1,2685,,0552,1,2699,,,,,,,,,,,2803,,,,,,,0,212,25,1,103,21,,2685    0552,Y,Y,9999,,,92.7357458435106,415.127072903586
3879843,2017/06/14 00:00:00+00,2017/02/01 00:00:00+00,,,1,2685,,0553,1,2899,,,,,,,,,,,2943,,,,,,,0,212,29,1,103,37,,2685    0553,Y,Y,9999,,,84.3934559665108,445.755262865005
3879844,2006/09/09 00:00:00+00,,DELIVERY 8,,1,2678,,0012,1,1223,,,,,,,,,,,1240,1,,,,,,0,SUB,135,1,103,7,,2678    0012,Y,Y,9999,,,63.705787768227,188.048780891024
3879845,2006/09/09 00:00:00+00,,DELIVERY 14,,1,2689,,0064,1,2005,,,,,,,,,,,2003,1,,,,,,0,SUB,102,1,104,34,,2689    0064,Y,Y,9999,,,94.2591831635529,308.253753672509
3879846,2006/09/09 00:00:00+00,,DELIVERY 8,,1,2692,,0057,1,1271,,,,,,,,,,,1272,1,,,,,,0,SUB,99,1,108,25,,2692    0057,Y,Y,9999,,,69.1877396610117,195.479144040898
3879847,2022/04/04 00:00:00+00,2021/07/22 00:00:00+00,,,1,2693,,0046,1,4250,,,,,,,,,,,4250,,,,,,,0,218,173,1,126,15,,2693    0046,Y,Y,9999,,,105.829906934921,653.634861092411
3879848,2006/09/09 00:00:00+00,,DELIVERY 14,,1,2672,,0683,1,24119,,,,,,,,,,,24124,1,,,,,,0,SUB,150,1,45,35,,2672    0683,Y,Y,1490,,,241.62553860784,3708.11823012584
3879849,2006/09/09 00:00:00+00,,DELIVERY 8,,1,3233,,0061,1,2375,,,,,,,,,,,2375,1,,,,,,0,COUNTY,40,1,73,3,,3233    0061,Y,Y,3182,,,125.041939702378,365.340609633849
3879850,2006/09/09 00:00:00+00,,DELIVERY 15,,1,2660,,0213,1,3398,,,,,,,,,,,3429,1,,,,,,0,SUB,135,1,123,9,,2660    0213,Y,Y,6655,,,99.3244592146828,522.353329289913
3879851,2006/09/09 00:00:00+00,,PHASE 1,,1,0194,,0111,1,3159,,,,,,,,,,,3159,1,,,,,,0,CONDO_00046,11,1,46,11,,0194    0111,Y,Y,2540,,,88.7126069047357,485.429222683277
3879852,2006/09/09 00:00:00+00,,DELIVERY 13,,1,2677,,0710,1,6696,,,,,,,,,,,6696,1,,,,,,0,SUB,123,1,86,39,,2677    0710,Y,Y,5186,,,132.167393567394,1029.65311027473
3879853,2006/09/09 00:00:00+00,,MAINTENANCE,,1,0369,,0069,1,19844,,,,,,,,,,,19809,1,,,,,,0,198,4,1,57,11,,0369    0069,Y,Y,2763,,,311.542928034622,3048.86839889295
3879854,2006/09/09 00:00:00+00,,DELIVERY 11,,1,4550,,0081,1,5132,,,,,,,,,,,5436,1,,,,,,0,114,101,1,87,21,,4550    0081,Y,Y,4281,,,127.133804337111,788.213506556388
3879855,2006/09/09 00:00:00+00,,DELIVERY 12,,1,2106,,0105,1,102583,,,,,,,,,,,102603,1,,,,,,0,SUB,32,1,3,9,,2106    0105,Y,Y,1085,,,549.493141829127,15772.8410765724
3879856,2006/09/09 00:00:00+00,,PHASE 1,,1,0151,,0016,1,2000,,,,,,,,,,,,1,,,,,,0,REC_00001,151,1,22,49,,0151    0016,Y,Y,2067,,,94.216908956034,307.386763467159
3879857,2006/09/09 00:00:00+00,,DELIVERY 5,,1,0931,,0002,1,1102,,,,,,,,,,,1102,1,,,,,,0,37,18,1,86,42,,0931    0002,Y,Y,4286,,,72.965300233762,169.239321703327
3879858,2021/06/08 00:00:00+00,2020/09/30 00:00:00+00,,,1,2692,,0065,1,3847,,,,,,,,,,,3916,,,,,,,0,217,134,1,125,27,,2692    0065,Y,Y,6766,,,99.6053575818069,591.621811516921
3879859,2006/09/09 00:00:00+00,,PHASE 1,,1,0188,S,0004,1,6939,,,,,,,,,,,6939,1,,,,,,0,CONDO_00026,27,1,26,27,,0188S   0004,Y,Y,2181,,,160.483528720987,1066.57728697206
3879860,2006/09/09 00:00:00+00,,DELIVERY 7,,1,3118,,0124,1,2700,,,,,,,,,,,2700,1,,,,,,0,SUB,9,1,60,28,,3118    0124,Y,Y,1812,,,127.812700737697,415.002554169487
3879861,2006/09/09 00:00:00+00,,DELIVERY 7,,1,2616,,0081,1,2080,,,,,,,,,,,2110,1,,,,,,0,COUNTY,145,1,22,5,,2616    0081,Y,Y,1231,,,82.3334270679686,319.942731367408
3879862,2006/09/09 00:00:00+00,,DELIVERY 15,,1,5869,,0067,1,47006,,,,,,,,,,,48110,1,,,,,,0,146,7,1,45,49,,5869    0067,Y,Y,1499,,,469.098844272025,7213.39366434783
3879863,2006/09/09 00:00:00+00,,PHASE 1,,1,0154,,0006,1,8592,,,,,,,,,,,,1,,,,,,0,CONDO_00024,1,1,24,1,,0154    0006,Y,Y,2114,,,151.324996228936,1320.40634998616
3879864,2006/09/09 00:00:00+00,,DELIVERY 10,,1,4057,,0205,1,2725,,,,,,,,,,,2703,1,,,,,,0,111,33,1,99,37,,4057    0205,Y,Y,5714,,,89.5293828216963,418.691958853505
3879865,2006/09/09 00:00:00+00,,PHASE 1,,1,0151,,0203,1,1622,,,,,,,,,,,1622,1,,,,,,0,CONDO_00029,40,1,29,40,,0151    0203,Y,Y,2076,,,78.7148076953332,249.222855750109
3879866,2006/09/09 00:00:00+00,,DELIVERY 11,,1,4560,,0184,1,3787,,,,,,,,,,,3787,1,,,,,,0,107,60,1,98,8,,4560    0184,Y,Y,5634,,,99.8664028819132,581.715103030695
3879867,2018/08/02 00:00:00+00,2016/01/15 00:00:00+00,,,1,2892,,0010,1,3563,,,,,,,,,,,3563,1,,,,,,0,210,142,1,89,29,,2892    0120,Y,Y,5279,,,131.539982710062,547.737087410201
3879868,2006/09/09 00:00:00+00,,DELIVERY 9,,1,2891,,0034,1,1330,,,,,,,,,,,,1,,,,,,0,GS,91,1,83,48,,2891    0034,Y,Y,5144,,,69.8749706045633,204.48643364032
3879869,2006/09/09 00:00:00+00,,DELIVERY 14,,1,2670,,0085,1,7250,,,,,,,,,,,7250,1,,,,,,0,SUB,97,1,70,22,,2670    0085,Y,Y,1323,,,153.06920426673,1114.62306411294
3879870,2016/11/07 00:00:00+00,2016/08/26 00:00:00+00,,,1,0916,,0081,1,11457,,,,,,,,,,,11457,,,,,,,0,211,119,1,93,30,,0916    0081,Y,Y,5416,,,169.838000280039,1759.84017785059
3879871,2017/04/13 00:00:00+00,2015/12/08 00:00:00+00,,,1,1806,,0033,1,7500,,,,,,,,,,,7500,,,,,,,0,210,118,1,89,1,,1806    0033,Y,Y,5201,,,145.179452615584,1153.04276740608
3879872,2017/05/25 00:00:00+00,2015/09/14 00:00:00+00,,,1,2824,,0130,1,2823,,,,,,,,,,,2823,1,,,,,,0,210,68,1,94,12,,2824    0130,Y,Y,5544,,,126.586907002722,434.152055103961
3879873,2017/07/06 00:00:00+00,2016/09/30 00:00:00+00,,,1,3136,,0087,1,2000,,,,,,,,,,,2000,,,,,,,0,211,164,1,99,25,,3136    0087,Y,Y,5690,,,93.9951404290349,307.617531226038
3879874,2017/07/06 00:00:00+00,2015/12/23 00:00:00+00,,,1,3152,,0071,1,5211,,,,,,,,,,,5211,,,,,,,0,210,135,1,95,15,,3152    0071,Y,Y,5567,,,160.585462743088,801.813026566136
3879875,2017/07/11 00:00:00+00,2016/04/22 00:00:00+00,,,1,4064,,0129,1,1936,,,,,,,,,,,1936,,,,,,,0,211,38,1,93,6,,4064    0129,Y,Y,5441,,,86.1788532840883,297.455707669345
3879876,2017/08/02 00:00:00+00,2016/05/10 00:00:00+00,,,1,3206,,0119,1,1593,,,,,,,,,,,1591,,,,,,,0,211,48,1,97,14,,3206    0119,Y,Y,5586,,,88.3055157039526,245.090424983424
3879877,2017/08/04 00:00:00+00,2017/03/17 00:00:00+00,,,1,0442,,0123,1,1510,,,,,,,,,,,1509,,,,,,,0,212,67,1,99,43,,0442    0123,Y,Y,5712,,,85.3607272584718,232.030070385246
3879878,2017/08/04 00:00:00+00,2017/03/17 00:00:00+00,,,1,0442,,0125,1,1327,,,,,,,,,,,1327,,,,,,,0,212,67,1,99,43,,0442    0125,Y,Y,5712,,,73.8742409767923,203.936508921748
3879879,2017/08/04 00:00:00+00,2017/03/21 00:00:00+00,,,1,1076,,0096,1,3160,,,,,,,,,,,3160,,,,,,,0,212,77,1,97,37,,1076    0096,Y,Y,5678,,,121.643102203869,485.226398312445
3879880,2006/09/09 00:00:00+00,,DELIVERY 15,,1,2660,,0222,1,1052,,,,,,,,,,,1053,1,,,,,,0,SUB,170,1,71,18,,2660    0222,Y,Y,1338,,,55.8563728366779,161.752274425069
3879881,2006/09/09 00:00:00+00,,DELIVERY 5,,1,1125,,0030,1,3253,,,,,,,,,,,3253,1,,,,,,0,109,112,1,95,32,,1125    0030,Y,Y,5561,,,99.9114434136639,499.586048277481
3879882,2006/09/09 00:00:00+00,,MAINTENANCE,,1,4540,,0291,1,2880,,,,,,,,,,,2880,1,,,,,,0,,,1,76,24,,4540    0291,Y,Y,4063,,,84.6761440457067,442.410892006887
3879883,2006/09/09 00:00:00+00,,DELIVERY 8,,1,2538,,0010,1,13352,,,,,,,,,,,13371,1,,,,,,0,SUB,168,1,22,13,,2538    0010,Y,Y,1122,,,185.576541500467,2052.38805869482
3879884,2006/09/09 00:00:00+00,,PHASE 1,,1,0312,,0047,1,4218,,,,,,,,,,,4218,1,,,,,,0,42,17,1,42,17,,0312    0047,Y,Y,2257,,,113.917305043085,648.140187999217
3879885,2006/09/09 00:00:00+00,,DELIVERY 14,,1,3042,,0012,1,1771,,,,,,,,,,,1777,1,,,,,,0,COUNTY,93,1,96,17,,3042    0012,Y,Y,5516,,,85.2620244768459,272.320168200018
3879886,2006/09/09 00:00:00+00,,DELIVERY 10,,1,4545,,0145,1,2801,,,,,,,,,,,2801,1,,,,,,0,96,180,1,56,4,,4545    0145,Y,Y,2731,,,92.4740017888707,430.185220876206
3879887,2006/09/09 00:00:00+00,,DELIVERY 10,,1,5046,E,0038,1,2720,,,,,,,,,,,2720,1,,,,,,0,116,86,1,54,29,,5046E   0038,Y,Y,3093,,,89.3268953707242,417.767648136045
3879888,2006/09/09 00:00:00+00,,DELIVERY 8,,1,3131,,0036,1,1766,,,,,,,,,,,1766,1,,,,,,0,SUB,178,1,83,18,,3131    0036,Y,Y,3211,,,80.5829728461139,271.568508171458
3879889,2006/09/09 00:00:00+00,,MAINTENANCE,,1,1039,,0090,1,2000,,,,,,,,,,,2000,1,,,,,,0,,,1,50,50,,1039    0090,Y,Y,2652,,,93.9219011197912,307.1288031456
3879890,2006/09/09 00:00:00+00,,PHASE 1,,1,0151,,0192,1,4200,,,,,,,,,,,4200,1,,,,,,0,CONDO_00022,3,1,22,3,,0151    0192,Y,Y,2066,,,111.432510303738,645.531484140417
3879891,2006/09/09 00:00:00+00,,DELIVERY 7,,1,2861,,0053,1,1808,,,,,,,,,,,1808,1,,,,,,0,COUNTY,118,1,65,18,,2861    0053,Y,Y,1904,,,92.9896050325283,277.847714626277
3879892,2006/09/09 00:00:00+00,,DELIVERY 8,,1,3125,,0140,1,1642,,,,,,,,,,,1641,1,,,,,,0,SUB,54,1,98,28,,3125    0140,Y,Y,5762,,,80.1952893447421,252.396566566929
3879893,2011/06/21 00:00:00+00,1978/09/14 00:00:00+00,DELIVERY 15,,1,2547,,0044,1,13041,,,,,,,,,,,13033,1,,,,,,0,169,78,1,23,17,,2547    0044,Y,Y,1148,,,180.266447789986,2004.72098446166
3879894,2006/09/09 00:00:00+00,,DELIVERY 9,,1,1300,,0555,1,4158,,,,,,,,,,,4124,1,,,,,,0,31,16,1,31,16,,1300    0555,Y,Y,1061,,,114.577754221659,639.229421506444
3879895,2006/09/09 00:00:00+00,,DELIVERY 13,,1,2677,,0430,1,1471,,,,,,,,,,,1471,1,,,,,,0,COUNTY,101,1,67,24,,2677    0430,Y,Y,1942,,,83.4897996378666,226.191952369239
3879896,2006/09/09 00:00:00+00,,PHASE 1,,1,0453,,0028,1,2100,,,,,,,,,,,2100,1,,,,,,0,10,43,1,58,21,,0453    0028,Y,Y,3110,,,94.7274026499522,322.629398076827
3879897,2006/09/09 00:00:00+00,,PHASE 1,,1,0194,,0005,1,2200,,,,,,,,,,,2200,1,,,,,,0,CHB,101,1,43,15,,0194    0005,Y,Y,2209,,,95.7750071496334,338.088847927169
3879898,2006/09/09 00:00:00+00,,DELIVERY 11,,1,2549,,0631,1,2423,,,,,,,,,,,2422,1,,,,,,0,SUB,25,1,29,35,,2549    0631,Y,Y,1156,,,110.830176638736,372.404516204645
3879899,2006/09/09 00:00:00+00,,DELIVERY 8,,1,2037,,0015,1,41279,,,,,,,,,,,40989,1,,,,,,0,SUB,50,1,33,36,,2037    0015,Y,Y,1079,,,337.046324135075,6350.67066305035
3879900,2006/09/09 00:00:00+00,,DELIVERY 4,,1,0784,,0006,1,1909,,,,,,,,,,,,1,,,,,,0,10,131,1,22,41,,0784    0006,Y,Y,2305,,,91.0994250127813,293.196265774343
3879901,2006/09/09 00:00:00+00,,PHASE 1,,1,0444,,0131,1,1552,,,,,,,,,,,1552,1,,,,,,0,14,161,1,55,49,,0444    0131,Y,Y,2723,,,84.8006021695953,238.565149058727
3879902,2006/09/09 00:00:00+00,,DELIVERY 11,,1,3521,,0085,1,1530,,,,,,,,,,,1530,1,,,,,,0,COUNTY,57,1,97,46,,3521    0085,Y,Y,5673,,,84.0072003249054,235.101441867182
3879903,2006/09/09 00:00:00+00,,DELIVERY 8,,1,3108,,0007,1,1502,,,,,,,,,,,1504,1,,,,,,0,SUB,169,1,75,3,,3108    0007,Y,Y,1416,,,81.6517680073946,230.863159835461
3879904,2006/09/09 00:00:00+00,,MAINTENANCE,,1,5956,,0027,1,14124,,,,,,,,,,,14129,1,,,,,,0,199,85,1,54,41,,5956    0027,Y,Y,1677,,,186.678953927474,2166.36285776857
3879905,2006/09/09 00:00:00+00,,DELIVERY 7,,1,1315,,0040,1,4655,,,,,,,,,,,4655,1,,,,,,0,108,41,1,87,19,,1315    0040,Y,Y,4287,,,112.987540860459,715.544906877487
3879906,2006/09/09 00:00:00+00,,PHASE 1,,1,0153,,0133,1,6000,,,,,,,,,,,6000,1,,,,,,0,CONDO_00036,4,1,36,4,,0153    0133,Y,Y,2111,,,133.25442147019,922.1055682832
3879907,2007/06/22 00:00:00+00,2006/09/29 00:00:00+00,,,1,0453,,0058,1,12492,,,,,,,,,,,12486,,,,,,,0,201,71,1,80,9,,0453    0058,Y,Y,5030,,,206.009832650517,1919.12672606188
3879908,2006/09/09 00:00:00+00,,DELIVERY 10,,1,4068,,0051,1,1638,,,,,,,,,,,1650,1,,,,,,0,42,48,1,93,3,,4068    0051,Y,Y,5464,,,79.8372404603743,251.685108070984
3879909,2007/07/10 00:00:00+00,2006/03/31 00:00:00+00,,,1,2660,,0237,1,4067,,,,,,,,,,,4141,,,,,,,0,200,151,1,78,33,,2660    0237,Y,Y,5021,,,107.282073849818,625.126099358756
3879910,2006/09/09 00:00:00+00,,DELIVERY 8,,1,3125,,0111,1,2167,,,,,,,,,,,2164,1,,,,,,0,COUNTY,1,1,84,31,,3125    0111,Y,Y,5145,,,110.965087068149,333.04158473434
3879911,2006/09/09 00:00:00+00,,DELIVERY 11,,1,3509,S,0037,1,1751,,,,,,,,,,,1751,1,,,,,,0,COUNTY,116,1,24,42,,3509S   0037,Y,Y,1685,,,89.3738003414597,269.041565722464
3879912,2006/09/09 00:00:00+00,,PHASE 1,,1,0734,,0079,1,5298,,,,,,,,,,,5299,1,,,,,,0,160,173,1,52,42,,0734    0079,Y,Y,2696,,,127.320833703796,813.581826612823
3879913,2006/09/09 00:00:00+00,,DELIVERY 7,,1,2836,,0133,1,1980,,,,,,,,,,,1980,1,,,,,,0,SUB,49,1,64,32,,2836    0133,Y,Y,1890,,,86.5580054728351,304.463836297285
3879914,2014/11/17 00:00:00+00,2014/05/19 00:00:00+00,,,1,3046,,0064,1,6000,,,,,,,,,,,6000,,,,,,,0,208,114,1,88,44,,3046    0064,Y,Y,3242,,,180.159877113799,922.516191037186
3879915,2006/09/09 00:00:00+00,,MAINTENANCE,,1,2853,,0205,1,5830,,,,,,,,,,,5830,1,,,,,,0,196,7,1,50,9,,2853    0205,Y,Y,1570,,,140.436818737442,896.337309665975
3879916,2006/09/09 00:00:00+00,,DELIVERY 13,,1,3031,,0147,1,2230,,,,,,,,,,,2231,1,,,,,,0,SUB,3,1,93,23,,3031    0147,Y,Y,5411,,,85.3386678575112,343.007198075879
3879917,2006/09/09 00:00:00+00,,PHASE 1,,1,0241,,0039,1,3006,,,,,,,,,,,3019,1,,,,,,0,CONDO_00035,3,1,35,3,,0241    0039,Y,Y,2236,,,108.550297074453,461.839754870994
3879918,2006/09/09 00:00:00+00,,DELIVERY 14,,1,2565,,0028,1,1742,,,,,,,,,,,1742,1,,,,,,0,COUNTY,5,1,50,40,,2565    0028,Y,Y,1581,,,87.9386608546272,267.720166857743
3879919,2006/09/09 00:00:00+00,,PHASE 1,,1,0190,,0127,1,3150,,,,,,,,,,,3150,1,,,,,,0,CONDO_00033,29,1,33,29,,0190    0127,Y,Y,2186,,,97.503307675279,484.187728632449
3879920,2006/09/09 00:00:00+00,,PHASE 1,,1,0369,,0039,1,3469,,,,,,,,,,,3465,1,,,,,,0,28,23,1,28,23,,0369    0039,Y,Y,2449,,,128.191604559723,532.963942024661
3879921,2006/09/09 00:00:00+00,,DELIVERY 14,,1,5087,,0073,1,15000,,,,,,,,,,,15000,1,,,,,,0,195,135,1,47,21,,5087    0073,Y,Y,3049,,,219.951172658246,2303.95115566932
3879922,2006/09/09 00:00:00+00,,DELIVERY 8,,1,3095,,0049,1,2795,,,,,,,,,,,2800,1,,,,,,0,COUNTY,21,1,91,45,,3095    0049,Y,Y,5386,,,125.258966501047,429.544397933462
3879923,2006/09/09 00:00:00+00,,DELIVERY 11,,1,3565,,0051,1,5328,,,,,,,,,,,5328,1,,,,,,0,SUB,194,1,68,39,,3565    0051,Y,Y,1967,,,149.335400082285,818.891054938267
3879924,2006/09/09 00:00:00+00,,DELIVERY 8,,1,3241,,0046,1,1059,,,,,,,,,,,1059,1,,,,,,0,SUB,172,1,82,16,,3241    0046,Y,Y,3204,,,57.8856084854381,162.845188420296
3879925,2017/09/12 00:00:00+00,2017/03/21 00:00:00+00,,,1,0939,,0098,1,3221,,,,,,,,,,,3221,,,,,,,0,212,76,1,97,43,,0939    0098,Y,Y,5683,,,112.477501253402,494.638195062473
3879926,2017/09/21 00:00:00+00,2017/01/31 00:00:00+00,,,1,3321,,0073,1,6200,,,,,,,,,,,6200,,,,,,,0,212,21,1,98,36,,3321    0073,Y,Y,5708,,,153.137427279924,953.615318809098
3879927,2017/09/21 00:00:00+00,2017/03/15 00:00:00+00,,,1,3237,,0101,1,2500,,,,,,,,,,,2500,,,,,,,0,212,61,1,97,30,,3237    0101,Y,Y,5614,,,97.9232646743491,384.506936121521
3879928,2017/09/21 00:00:00+00,2017/03/15 00:00:00+00,,,1,3237,,0100,1,2500,,,,,,,,,,,2500,,,,,,,0,212,61,1,97,31,,3237    0100,Y,Y,5612,,,97.9206782499703,384.465435149599
3879929,2017/09/21 00:00:00+00,2017/03/21 00:00:00+00,,,1,4513,,0089,1,1022,,,,,,,,,,,1022,,,,,,,0,212,80,1,99,48,,4513    0089,Y,Y,5721,,,70.4590874055995,157.014327521718
3879930,2017/09/29 00:00:00+00,2017/08/03 00:00:00+00,,,1,2831,,0144,1,1998,,,,,,,,,,,1998,,,,,,,0,212,175,1,97,19,,2831    0144,Y,Y,5540,,,110.377160428433,307.195831010119
3879931,2017/10/25 00:00:00+00,2017/08/11 00:00:00+00,,,1,1661,,0031,1,96255,,,,,,,,,,,95644,,,,,,,0,212,183,1,98,42,,1661    0031,Y,Y,5659,,,550.118686377916,14812.2310219882
3879932,2017/10/03 00:00:00+00,2017/07/10 00:00:00+00,,,1,2616,,0127,1,5649,,,,,,,,,,,5649,,,,,,,0,212,148,1,96,35,,2616    0127,Y,Y,5575,,,140.243014879692,868.610631789688
3879933,2006/09/09 00:00:00+00,,DELIVERY 10,,1,2204,,0162,1,7276,,,,,,,,,,,7200,1,,,,,,0,SUB,197,1,58,14,,2204    0162,Y,Y,1723,,,142.084064225793,1118.59381908565
3879934,2006/09/09 00:00:00+00,,DELIVERY 7,,1,1874,,0040,1,4460,,,,,,,,,,,4441,1,,,,,,0,73,101,1,77,24,,1874    0040,Y,Y,3199,,,139.962972726681,686.322403359929
3879935,2006/09/09 00:00:00+00,,PHASE 1,,1,0177,,0125,1,4708,,,,,,,,,,,4708,1,,,,,,0,28,152,1,70,42,,0177    0125,Y,Y,2955,,,115.405309699725,723.575060276286
3879936,2007/07/03 00:00:00+00,2006/03/30 00:00:00+00,,,1,2885,,0114,1,3563,,,,,,,,,,,3563,,,,,,,0,200,126,1,58,31,,2885    0114,Y,Y,1743,,,131.531229709716,547.640712384362
3879937,2006/09/09 00:00:00+00,,DELIVERY 7,,1,2853,,0204,1,24596,,,,,,,,,,,24596,1,,,,,,0,SUB,96,1,36,29,,2853    0204,Y,Y,1247,,,263.03951230853,3781.3939635539
3879938,2008/08/18 00:00:00+00,2006/02/10 00:00:00+00,,,1,2971,,0070,1,12724,,,,,,,,,,,12849,,,,,,,0,200,81,1,24,49,,2971    0070,Y,Y,3101,,,195.013279158277,1958.67312519251
3879939,2009/03/15 00:00:00+00,1952/01/16 00:00:01+00,,,1,6163,,0123,1,7337,,,,,,,,,,,7337,1,,,,,,0,132,154,1,62,50,,6163    0123,Y,Y,1839,,,138.292100167735,1124.88895527997
3879940,2006/09/09 00:00:00+00,,PHASE 1,,1,0693,,0093,1,1800,,,,,,,,,,,1800,1,,,,,,0,191,86,1,77,5,,0693    0093,Y,Y,4093,,,82.1086820995454,276.381483775831
3879941,2006/09/09 00:00:00+00,,DELIVERY 9,,1,3950,,0001,1,5961,,,,,,,,,,,5961,1,,,,,,0,SUB,43,1,70,34,,3950    0001,Y,Y,1331,,,128.548962494212,916.303368659246
3879942,2006/09/09 00:00:00+00,,DELIVERY 4,,1,0855,,0172,1,1313,,,,,,,,,,,1312,1,,,,,,0,16,78,1,123,11,,0855    0172,Y,Y,6689,,,69.1841602483629,201.804092050175
3879943,2006/09/09 00:00:00+00,,DELIVERY 7,,1,2614,,0068,1,12400,,,,,,,,,,,12400,1,,,,,,0,SUB,198,1,27,1,,2614    0068,Y,Y,1229,,,175.71241822009,1906.68825832402
3879944,2006/09/09 00:00:00+00,,PHASE 1,,1,0152,,0190,1,1995,,,,,,,,,,,1495,1,,,,,,0,CONDO_00026,31,1,26,31,,0152    0190,Y,Y,2094,,,91.0710086962217,306.624347134397
3879945,2006/09/09 00:00:00+00,,PHASE 1,,1,0221,,0035,1,5883,,,,,,,,,,,5883,1,,,,,,0,150,67,1,70,37,,0221    0035,Y,Y,0034,,,128.65240910833,903.764217021375
3879946,2006/09/09 00:00:00+00,,DELIVERY 7,,1,1282,,0276,1,43817,,,,,,,,,,,43869,1,,,,,,0,180,95,1,80,3,,1282    0276,Y,Y,4138,,,334.208653523483,6733.8127603939
3879947,2006/09/09 00:00:00+00,,DELIVERY 10,,1,4052,,0127,1,3560,,,,,,,,,,,3500,1,,,,,,0,111,119,1,95,24,,4052    0127,Y,Y,5572,,,107.248795348938,547.093754798831
3879948,2006/09/09 00:00:00+00,,DELIVERY 15,,1,2567,,0054,1,1512,,,,,,,,,,,1512,1,,,,,,0,COUNTY,110,1,58,15,,2567    0054,Y,Y,1717,,,85.5590149241873,232.453661337897
3879949,2006/09/09 00:00:00+00,,PHASE 1,,1,0202,,0074,1,5400,,,,,,,,,,,5400,1,,,,,,0,25,52,1,65,26,,0202    0074,Y,Y,2883,,,117.665507609331,830.031012211612
3879950,2006/09/09 00:00:00+00,,DELIVERY 5,,1,0984,,0044,1,1710,,,,,,,,,,,1710,1,,,,,,0,30,67,1,54,17,,0984    0044,Y,Y,2711,,,85.3272004293486,262.663245652685
3879951,2006/09/09 00:00:00+00,,PHASE 1,,1,0275,,0056,1,2040,,,,,,,,,,,2040,1,,,,,,0,193,123,1,44,19,,0275    0056,Y,Y,2458,,,91.8130047706017,313.529627420894
3879952,2006/09/09 00:00:00+00,,DELIVERY 13,,1,2621,,0366,1,5400,,,,,,,,,,,5400,1,,,,,,0,COUNTY,105,1,51,24,,2621    0366,Y,Y,1593,,,129.333528994261,830.360399688407
3879953,2006/09/09 00:00:00+00,,DELIVERY 8,,1,2555,,0017,1,5200,,,,,,,,,,,,1,,,,,,0,COUNTY,115,1,33,46,,2555    0017,Y,Y,1195,,,120.836613338874,799.242829189268
3879954,2006/09/09 00:00:00+00,,PHASE 1,,1,0513,,0079,1,1108,,,,,,,,,,,,1,,,,,,0,13,98,1,50,46,,0513    0079,Y,Y,2647,,,57.0654009104485,170.280261901729
3879955,2006/09/09 00:00:00+00,,DELIVERY 8,,1,2678,,0023,1,1278,,,,,,,,,,,1282,1,,,,,,0,SUB,135,1,98,10,,2678    0023,Y,Y,5636,,,65.8763343903888,196.532595672027
3879956,2019/05/08 00:00:00+00,2018/11/19 00:00:00+00,DELIVERY 10,,1,3572,,0076,1,2114,,,,,,,,,,,2114,1,,,,,,0,214,151,1,110,27,,3572    0076,Y,Y,6168,,,93.8716000673539,324.886518619333
3879957,2006/09/09 00:00:00+00,,PHASE 1,,1,0153,,0067,1,3000,,,,,,,,,,,,1,,,,,,0,CONDO_00027,5,1,27,5,,0153    0067,Y,Y,2107,,,113.640791021552,461.047818293723
3879958,2006/09/09 00:00:00+00,,DELIVERY 14,,1,2550,,0181,1,2442,,,,,,,,,,,2422,1,,,,,,0,COUNTY,167,1,33,31,,2550    0181,Y,Y,1164,,,111.585556392372,375.348674795803
3879959,2006/09/09 00:00:00+00,,DELIVERY 4,,1,0778,,0008,1,8234,,,,,,,,,,,,1,,,,,,0,3,778,1,34,8,,0778    0008,Y,Y,2299,,,160.315500028875,1264.86907353741
3879960,2007/06/05 00:00:00+00,2005/08/26 00:00:00+00,,,1,5203,,0046,1,37686,,,,,,,,,,,37686,,,,,,,0,208,82,1,54,37,,5203    0046,Y,Y,3096,,,476.801778654209,5790.06391545953
3879961,2006/09/09 00:00:00+00,,DELIVERY 14,,1,3399,,0024,1,3450,,,,,,,,,,,3450,1,,,,,,0,SUB,16,1,96,28,,3399    0024,Y,Y,5528,,,105.408705649013,530.788130773402
3879962,2006/09/09 00:00:00+00,,DELIVERY 14,,1,3576,,0030,1,1500,,,,,,,,,,,,1,,,,,,0,COUNTY,117,1,50,38,,3576    0030,Y,Y,1577,,,83.750600051352,230.564131785605
3879963,2006/09/09 00:00:00+00,,DELIVERY 9,,1,2885,,0050,1,3563,,,,,,,,,,,3563,1,,,,,,0,COUNTY,77,1,65,10,,2885    0050,Y,Y,1898,,,131.533057208098,547.678015881469
3879964,2013/06/06 00:00:00+00,2013/02/21 00:00:00+00,,,1,4546,,0175,1,1898,,,,,,,,,,,1898,,,,,,,0,207,47,1,87,15,,4546    0175,Y,Y,4290,,,96.6025022134133,291.455341031068
3879965,2006/09/09 00:00:00+00,,DELIVERY 11,,1,2549,,0025,1,7125,,,,,,,,,,,,1,,,,,,0,COUNTY,13,1,28,13,,2549    0025,Y,Y,1155,,,144.229910471539,1095.28145904093
3879966,2006/09/09 00:00:00+00,,PHASE 1,,1,0069,,0228,1,2480,,,,,,,,,,,2480,1,,,,,,0,CONDO_00029,5,1,29,5,,0069    0228,Y,Y,1028,,,107.124014216643,381.005830612488
3879967,2006/09/09 00:00:00+00,,PHASE 1,,1,0453,,0027,1,2283,,,,,,,,,,,2208,1,,,,,,0,10,43,1,58,21,,0453    0027,Y,Y,3110,,,96.1628026993229,350.702941510883
3879968,2006/09/09 00:00:00+00,,DELIVERY 5,,1,1097,,0046,1,2736,,,,,,,,,,,2736,1,,,,,,0,64,21,1,86,27,,1097    0046,Y,Y,4275,,,123.075302844306,420.152360388673
3879969,2006/09/09 00:00:00+00,,DELIVERY 5,,1,1046,,0138,1,1800,,,,,,,,,,,1800,1,,,,,,0,28,12,1,28,12,,1046    0138,Y,Y,2370,,,86.3155009909489,276.361849181741
3879970,2006/09/09 00:00:00+00,,DELIVERY 5,,1,1046,,0139,1,1788,,,,,,,,,,,1788,1,,,,,,0,28,12,1,28,12,,1046    0139,Y,Y,2370,,,85.1678639614789,274.442722362936
3879971,2006/09/09 00:00:00+00,,DELIVERY 9,,1,2891,,0037,1,1330,,,,,,,,,,,,1,,,,,,0,GS,91,1,95,29,,2891    0037,Y,Y,5576,,,69.8735260808517,204.468985339189
3879972,2006/09/09 00:00:00+00,,DELIVERY 5,,1,1098,,0143,1,1965,,,,,,,,,,,1965,1,,,,,,0,79,1,1,82,49,,1098    0143,Y,Y,4196,,,93.9071023720084,301.799350666811
3879973,2006/09/09 00:00:00+00,,DELIVERY 4,,1,0911,,0024,1,2098,,,,,,,,,,,,1,,,,,,0,17,77,1,81,19,,0911    0024,Y,Y,4171,,,105.343900191396,322.417347282593
3879974,2006/09/09 00:00:00+00,,DELIVERY 12,,1,6239,S,0055,1,8600,,,,,,,,,,,8600,1,,,,,,0,185,66,1,40,43,,6239S   0055,Y,Y,1296,,,145.677301533989,1318.41832445033
3879975,2006/09/09 00:00:00+00,,DELIVERY 14,,1,4469,,0052,1,2020,,,,,,,,,,,2020,1,,,,,,0,2,74,1,84,3,,4469    0052,Y,Y,5164,,,94.7898804685163,310.390454134378
3879976,2006/09/09 00:00:00+00,,PHASE 1,,1,0158,,0079,1,21719,,,,,,,,,,,21720,1,,,,,,0,CONDO_00003,7,1,3,7,,0158    0079,Y,Y,1058,,,265.020348498729,3337.38140248728
3879977,2006/09/09 00:00:00+00,,DELIVERY 7,,1,1806,,0022,1,5625,,,,,,,,,,,5625,1,,,,,,0,104,44,1,87,20,,1806    0022,Y,Y,5238,,,133.440648699066,864.78418918454
3879978,2006/09/09 00:00:00+00,,PHASE 1,,1,0014,,0055,1,1597,,,,,,,,,,,1597,1,,,,,,0,CONDO_00039,40,1,39,40,,0014    0055,Y,Y,1005,,,87.6771152404655,245.345024401385
3879979,2006/09/09 00:00:00+00,,PHASE 1,,1,0205,,0061,1,4840,,,,,,,,,,,4840,1,,,,,,0,CONDO_00045,7,1,45,7,,0205    0061,Y,Y,2524,,,120.852808228635,743.865886901829
3879980,2006/09/09 00:00:00+00,,DELIVERY 5,,1,1088,,0035,1,6901,,,,,,,,,,,6901,1,,,,,,0,135,24,1,47,26,,1088    0035,Y,Y,2573,,,135.504562996785,1059.72534028468
3879981,2006/09/09 00:00:00+00,,DELIVERY 6,,1,1202,,0063,1,6686,,,,,,,,,,,6693,1,,,,,,0,36,51,1,36,51,,1202    0063,Y,Y,0018,,,134.931524466699,1027.27363713348
3879982,2006/09/09 00:00:00+00,,DELIVERY 11,,1,2549,,0419,1,2522,,,,,,,,,,,2527,1,,,,,,0,COUNTY,22,1,94,1,,2549    0419,Y,Y,5476,,,120.525217474302,387.741188188214
3879983,2009/04/22 00:00:00+00,2009/03/04 00:00:00+00,,,1,1051,,0200,1,1400,,,,,,,,,,,1400,,,,,,,0,203,150,1,71,19,,1051    0200,Y,Y,2971,,,70.4703011107455,215.068156284838
3879984,2006/09/09 00:00:00+00,,DELIVERY 12,,1,5729,,0062,1,11534,,,,,,,,,,,11536,1,,,,,,0,132,169,1,59,24,,5729    0062,Y,Y,1771,,,170.900673898494,1769.70527709925
3879985,2006/09/09 00:00:00+00,,MAINTENANCE,,1,0904,,0060,1,2037,,,,,,,,,,,2037,1,,,,,,0,,,1,57,19,,0904    0060,Y,Y,2758,,,99.9707000974407,312.702572761071
3879986,2014/11/21 00:00:00+00,2014/08/13 00:00:00+00,,,1,3931,,0053,1,1252,,,,,,,,,,,1252,,,,,,,0,208,163,1,89,15,,3931    0053,Y,Y,3252,,,100.090701221948,192.449148498576
3879987,2006/09/09 00:00:00+00,,DELIVERY 12,,1,5672,,0095,1,43986,,,,,,,,,,,43775,1,,,,,,0,163,175,1,4,5,,5672    0095,Y,Y,1278,,,320.296468566746,6750.42321946587
3879988,2006/09/09 00:00:00+00,,PHASE 1,,1,0191,,0007,1,2145,,,,,,,,,,,2145,1,,,,,,0,CONDO_00044,14,1,44,14,,0191    0007,Y,Y,2530,,,106.484907852742,329.592219520902
3879989,2006/09/09 00:00:00+00,,PHASE 1,,1,0475,S,0035,1,1637,,,,,,,,,,,1642,1,,,,,,0,41,23,1,41,23,,0475S   0035,Y,Y,2268,,,78.9222351150007,251.645201282688
3879990,2006/09/09 00:00:00+00,,DELIVERY 9,,1,3841,,0077,1,2880,,,,,,,,,,,2880,1,,,,,,0,SUB,27,1,97,20,,3841    0077,Y,Y,5592,,,95.7605002364115,442.722894043043
3879991,2006/09/09 00:00:00+00,,DELIVERY 8,,1,2845,,0032,1,3203,,,,,,,,,,,3204,1,,,,,,0,COUNTY,11,1,46,1,,2845    0032,Y,Y,1480,,,89.9283314821382,492.456983301892
3879992,2006/09/09 00:00:00+00,,DELIVERY 5,,1,1100,,0096,1,1640,,,,,,,,,,,1640,1,,,,,,0,75,75,1,94,15,,1100    0096,Y,Y,5449,,,93.0110021042287,251.846772920297
3879993,2006/09/09 00:00:00+00,,DELIVERY 5,,1,1046,,0080,1,1800,,,,,,,,,,,,1,,,,,,0,15,60,1,59,20,,1046    0080,Y,Y,2799,,,86.091801043437,276.358914203877
3879994,2006/09/09 00:00:00+00,,DELIVERY 5,,1,1046,,0019,1,1800,,,,,,,,,,,,1,,,,,,0,15,60,1,87,27,,1046    0019,Y,Y,4291,,,86.0920010468202,276.362433593451
3879995,2006/09/09 00:00:00+00,,DELIVERY 12,,1,3403,,0005,1,9029,,,,,,,,,,,9029,1,,,,,,0,SUB,120,1,69,41,,3403    0005,Y,Y,3173,,,146.237690856073,1389.16095823312
3879996,2006/09/09 00:00:00+00,,DELIVERY 10,,1,6125,,0019,1,4109,,,,,,,,,,,4109,1,,,,,,0,18,23,1,27,44,,6125    0019,Y,Y,1288,,,121.760533403282,630.141615181201
3879997,2006/09/09 00:00:00+00,,PHASE 1,,1,0181,,0165,1,88266,,,,,,,,,,,,1,,,,,,0,177,88,1,37,23,,0181    0165,Y,Y,2180,,,549.479646581549,13563.3053002546
3879998,2006/09/09 00:00:00+00,,PHASE 1,,1,0190,,0128,1,1870,,,,,,,,,,,1870,1,,,,,,0,CONDO_00035,40,1,35,40,,0190    0128,Y,Y,2187,,,79.1579668951086,287.401943320073
3879999,2006/09/09 00:00:00+00,,PHASE 1,,1,0068,,0093,1,7200,,,,,,,,,,,7200,1,,,,,,0,CONDO_00033,48,1,33,48,,0068    0093,Y,Y,1023,,,133.297217654179,1106.39708801893
3880000,2006/09/09 00:00:00+00,,DELIVERY 10,,1,4545,,0131,1,3036,,,,,,,,,,,3036,1,,,,,,0,96,68,1,73,23,,4545    0131,Y,Y,2635,,,98.0782019984843,466.379096848995
3880001,2006/09/09 00:00:00+00,,DELIVERY 8,,1,2555,,0041,1,1733,,,,,,,,,,,1733,1,,,,,,0,COUNTY,43,1,90,11,,2555    0041,Y,Y,5283,,,94.7477101715975,266.307073158367
3880002,2006/09/09 00:00:00+00,,PHASE 1,,1,0014,,0047,1,1002,,,,,,,,,,,,1,,,,,,0,CONDO_00023,27,1,23,27,,0014    0047,Y,Y,1003,,,62.5265107712511,153.985137245538
3880003,2006/09/09 00:00:00+00,,DELIVERY 14,,1,2577,,0039,1,4606,,,,,,,,,,,4606,1,,,,,,0,SUB,193,1,53,39,,2577    0039,Y,Y,1213,,,144.174014754215,708.165548167361
3880004,2006/09/09 00:00:00+00,,DELIVERY 12,,1,5672,,0001,1,47677,,,,,,,,,,,47606,1,,,,,,0,113,30,1,3,10,,5672    0001,Y,Y,1277,,,349.25997363608,7317.20702083254
3880005,2008/03/27 00:00:00+00,2007/07/03 00:00:00+00,,,1,0333,,0042,1,1834,,,,,,,,,,,1832,,,,,,,0,202,27,1,80,46,,0333    0042,Y,Y,4152,,,97.7911132919713,281.804608110837
3880006,2006/09/09 00:00:00+00,,MAINTENANCE,,1,1027,,0160,1,3608,,,,,,,,,,,3608,1,,,,,,0,200,14,1,57,48,,1027    0160,Y,Y,2773,,,106.158207084478,554.19149322973
3880007,2006/09/09 00:00:00+00,,PHASE 1,,1,0715,,0011,1,7833,,,,,,,,,,,7833,1,,,,,,0,193,170,1,72,6,,0715    0011,Y,Y,2974,,,173.700660411712,1203.40416610048
3880008,2006/09/09 00:00:00+00,,DELIVERY 11,,1,3511,,0015,1,1550,,,,,,,,,,,1550,1,,,,,,0,COUNTY,108,1,66,10,,3511    0015,Y,Y,1899,,,85.8675003818693,238.267319871455
3880009,2006/09/09 00:00:00+00,,MAINTENANCE,,1,3573,,0079,1,1800,,,,,,,,,,,1800,1,,,,,,0,197,61,1,90,6,,3573    0079,Y,Y,5285,,,92.6500000449279,276.656756697183
3880010,2006/09/09 00:00:00+00,,DELIVERY 8,,1,2037,,0002,1,13394,,,,,,,,,,,13332,1,,,,,,0,SUB,59,1,20,12,,2037    0002,Y,Y,1078,,,192.885942497663,2060.59641539787
3880011,2006/09/09 00:00:00+00,,DELIVERY 5,,1,0995,,0061,1,1959,,,,,,,,,,,1959,1,,,,,,0,50,177,1,80,15,,0995    0061,Y,Y,4172,,,104.988500544729,300.74966546386
3880012,2006/09/09 00:00:00+00,,PHASE 1,,1,0211,,0047,1,8070,,,,,,,,,,,8070,1,,,,,,0,CONDO_00042,9,1,42,9,,0211    0047,Y,Y,2225,,,140.855809594543,1240.00279340311
3880013,2006/09/09 00:00:00+00,,PHASE 1,,1,0132,,0251,1,1885,,,,,,,,,,,1885,1,,,,,,0,187,50,1,72,11,,0132    0251,Y,Y,2976,,,93.7227100045583,289.790617269745
3880014,2006/09/09 00:00:00+00,,MAINTENANCE,,1,3667,,0057,1,14841,,,,,,,,,,,14841,1,,,,,,0,199,130,1,54,28,,3667    0057,Y,Y,3089,,,226.96460014499,2282.73795592505
3880015,2006/09/09 00:00:00+00,,DELIVERY 7,,1,3107,,0065,1,1498,,,,,,,,,,,1497,1,,,,,,0,COUNTY,83,1,51,35,,3107    0065,Y,Y,1595,,,83.4572007771483,230.263556861066
3880016,2006/09/09 00:00:00+00,,DELIVERY 13,,1,2543,,0083,1,14747,,,,,,,,,,,14747,1,,,,,,0,SUB,10,1,22,32,,2543    0083,Y,Y,1134,,,192.009839219547,2266.87270583242
3880017,2006/09/09 00:00:00+00,,DELIVERY 5,,1,1046,,0118,1,1096,,,,,,,,,,,1096,1,,,,,,0,30,182,1,85,41,,1046    0118,Y,Y,4267,,,70.1267734702447,168.317031482884
3880018,2006/09/09 00:00:00+00,,PHASE 1,,1,0206,,0020,1,2033,,,,,,,,,,,2033,1,,,,,,0,WF,210,1,91,28,2016/08/17 00:00:00+00,0206    0020,Y,Y,5734,,,94.471906523914,312.418911496488
3880019,2006/09/09 00:00:00+00,,DELIVERY 9,,1,4027,,0043,1,3306,,,,,,,,,,,3526,1,,,,,,0,118,159,1,62,30,,4027    0043,N,Y,1829,,,104.864232006554,508.151368160519
3880020,2006/09/09 00:00:00+00,,DELIVERY 10,,1,6214,,0013,1,3380,,,,,,,,,,,3383,1,,,,,,0,118,158,1,31,13,,6214    0013,Y,Y,1291,,,101.411977376204,518.264932269653
3880021,2012/03/26 00:00:00+00,2012/02/03 00:00:00+00,,,1,2566,,0102,1,7000,,,,,,,,,,,7000,,,,,,,0,206,48,1,78,50,,2566    0102,Y,Y,5037,,,149.133906666997,1076.09339428181
3880022,2006/09/09 00:00:00+00,,DELIVERY 6,,1,2824,,0093,1,2000,,,,,,,,,,,2000,1,,,,,,0,SUB,63,1,83,9,,2824    0093,Y,Y,5109,,,107.030105882978,307.651422361026
3880023,2010/06/08 00:00:00+00,2010/03/10 00:00:00+00,,,1,3127,,0154,1,2334,,,,,,,,,,,2334,,,,,,,0,204,129,1,73,17,,3127    0154,Y,Y,1389,,,123.048100996946,358.747616089944
3880024,2006/09/09 00:00:00+00,,DELIVERY 8,,1,2548,,0026,1,2240,,,,,,,,,,,2240,1,,,,,,0,COUNTY,133,1,53,14,,2548    0026,Y,Y,1618,,,103.655520891462,344.320127868997
3880025,2006/09/09 00:00:00+00,,DELIVERY 4,,1,0765,,0040,1,2000,,,,,,,,,,,2000,1,,,,,,0,23,81,1,23,7,,0765    0040,Y,Y,2295,,,93.9186000609738,307.106462316755
3880026,2006/09/09 00:00:00+00,,DELIVERY 9,,1,4045,,0034,1,1499,,,,,,,,,,,1500,1,,,,,,0,118,17,1,79,3,,4045    0034,Y,Y,5063,,,62.7267132739159,230.442949936757
3880027,2006/09/09 00:00:00+00,,DELIVERY 9,,1,2891,,0033,1,1813,,,,,,,,,,,,1,,,,,,0,GS,91,1,67,37,,2891    0033,Y,Y,1963,,,92.7667898695139,278.75729061893
3880028,2006/09/09 00:00:00+00,,DELIVERY 5,,1,1090,,0069,1,1017,,,,,,,,,,,1017,1,,,,,,0,123,190,1,66,29,,1090    0069,Y,Y,2928,,,62.2597013368059,156.08584558602
3880029,2006/09/09 00:00:00+00,,DELIVERY 14,,1,2581,,0478,1,791,,,,,,,,,,,791,1,,,,,,0,SUB,34,1,69,20,,2581    0478,Y,Y,1998,,,49.8106117484092,121.536143557249
3880030,2006/09/09 00:00:00+00,,DELIVERY 13,,1,6126,,0030,1,3721,,,,,,,,,,,3721,1,,,,,,0,18,23,1,24,44,,6126    0030,Y,Y,1288,,,115.86799679796,570.633142824706
3880031,2006/09/09 00:00:00+00,,DELIVERY 10,,1,2235,,0097,1,19562,,,,,,,,,,,19505,1,,,,,,0,SUB,149,1,44,42,,2235    0097,Y,Y,1478,,,218.676359754772,3008.72330587107
3880032,2006/09/09 00:00:00+00,,PHASE 1,,1,0653,,0103,1,1400,,,,,,,,,,,1400,1,,,,,,0,194,158,1,46,47,,0653    0103,Y,Y,2562,,,75.1298004689132,214.869464096661
3880033,2006/09/09 00:00:00+00,,PHASE 1,,1,0132,,0208,1,1921,,,,,,,,,,,,1,,,,,,0,CONDO_00030,29,1,30,29,,0132    0208,Y,Y,2046,,,90.8612101778669,295.203954314838
3880034,2006/09/09 00:00:00+00,,DELIVERY 14,,1,3953,,0027,1,16155,,,,,,,,,,,16154,1,,,,,,0,SUB,110,1,53,34,,3953    0027,Y,Y,1635,,,209.734905188635,2483.34618290929
3880035,2006/09/09 00:00:00+00,,DELIVERY 5,,1,0931,,0003,1,1076,,,,,,,,,,,1076,1,,,,,,0,37,18,1,86,43,,0931    0003,Y,Y,4288,,,64.7347002112381,165.278976798242
3880036,2011/11/10 00:00:00+00,2011/09/27 00:00:00+00,,,1,2670,,0095,1,3478,,,,,,,,,,,3478,,,,,,,0,205,190,1,76,47,,2670    0095,Y,Y,1457,,,133.95115819379,534.705188315372
3880037,2006/09/09 00:00:00+00,,DELIVERY 10,,1,3572,,0016,1,6471,,,,,,,,,,,6471,1,,,,,,0,COUNTY,85,1,84,38,,3572    0016,Y,Y,5175,,,129.199000040779,994.514354863562
3880038,2006/09/09 00:00:00+00,,DELIVERY 7,,1,2848,,0046,1,2471,,,,,,,,,,,2471,1,,,,,,0,COUNTY,104,1,46,26,,2848    0046,Y,Y,1509,,,129.553207611778,379.931373711579
3880039,2006/09/09 00:00:00+00,,DELIVERY 5,,1,1098,,0070,1,2454,,,,,,,,,,,2454,1,,,,,,0,70,165,1,88,42,,1098    0070,Y,Y,4304,,,93.1148021076087,376.813938424127
3880040,2006/09/09 00:00:00+00,,DELIVERY 7,,1,1908,,0019,1,18342,,,,,,,,,,,18345,1,,,,,,0,35,28,1,35,28,,1908    0019,Y,Y,1073,,,214.934193906429,2820.72928141625
3880041,2006/09/09 00:00:00+00,,DELIVERY 14,,1,2581,,0475,1,2016,,,,,,,,,,,2016,1,,,,,,0,SUB,34,1,81,3,,2581    0475,Y,Y,5116,,,91.7849821098577,309.942081415839
3880042,2006/09/09 00:00:00+00,,PHASE 1,,1,0069,,0188,1,2017,,,,,,,,,,,2017,1,,,,,,0,CONDO_00025,21,1,25,21,,0069    0188,Y,Y,1027,,,128.729616433325,309.868675469061
3880043,2006/09/09 00:00:00+00,,PHASE 1,,1,0150,,0273,1,1050,,,,,,,,,,,1050,1,,,,,,0,26,81,1,51,47,,0150    0273,Y,Y,2659,,,64.2677390763958,161.445731950213
3880044,2006/09/09 00:00:00+00,,DELIVERY 14,,1,2550,,0152,1,2442,,,,,,,,,,,2422,1,,,,,,0,COUNTY,67,1,28,20,,2550    0152,Y,Y,1162,,,111.585558045936,375.346852453928
3880045,2006/09/09 00:00:00+00,,DELIVERY 12,,1,5672,,0003,1,46532,,,,,,,,,,,46659,1,,,,,,0,113,30,1,3,10,,5672    0003,Y,Y,1277,,,353.45437149099,7141.34347890078
3880046,2006/09/09 00:00:00+00,,DELIVERY 13,,1,3031,,0143,1,1558,,,,,,,,,,,1558,1,,,,,,0,SUB,3,1,56,38,,3031    0143,Y,Y,1684,,,76.8625630950974,239.5927978827
3880047,2007/05/29 00:00:00+00,2006/06/26 00:00:00+00,,,1,2574,,0034,1,5600,,,,,,,,,,,5600,,,,,,,0,200,190,1,58,49,,2574    0034,Y,Y,1742,,,117.64364575872,860.919139409255
3880048,2006/09/09 00:00:00+00,,PHASE 1,,1,0552,,0093,1,1603,,,,,,,,,,,1603,1,,,,,,0,30,28,1,96,14,,0552    0093,Y,Y,5524,,,84.6390010593113,246.295196529737
